Ticker,Date,Cleaned_Headlines
META,2023-02-27,"['meta creating new top product group focused on ai', 'some short term risk: the next move for aapl, msft, amzn, goog, tsla, meta, nvda', 'oversight board meta give more info to verify goals of recommendation on updates to instagram community guidelines were met, confirm implementation; requests meta provide more information about the reallocation of resources and restoration rates', ""xiaomi follows meta's quest pro, launches ar glasses leveraging qualcomm's snapdragon chip"", 'entravision announced as authorized sales partner of meta in mongolia; terms not disclosed']"
META,2023-02-28,"['watching meta platforms; investor business daily swingtrader picks stock', 'metaverse project token skyrockets 430% on meta tie news']"
META,2023-03-01,"[""bloomberg reported earlier: meta accused of trying to extinguish cambridge analytica claims; new mexico ag said $725m settlement doesn't end all suits"", 'lights, camera, iphone! zhuzh up your ordinary videos with this simple cinematic mode trick', 'meta takes active step against revenge porn after facing flak for neymar incident', ""'tiktok's u.s. survival plan faces potential hurdle: apple's app store rules' - the information"", ""'this is meta's ar/vr hardware roadmap for the next four years'  report from the verge; hints at meta quest 3""]"
META,2023-03-03,"['meta chief zuckerberg faces opposition from democrat senators over metaverse app launch for teenagers', 'check out what whales are doing with meta']"
META,2023-03-06,"['expert ratings for meta platforms', '\'meta may launch a quest 2 ""game pass"" for vr apps\'  report', 'meta quest pro now available at $999: is mark zuckerberg planning ahead for apple mr headset?', ""google, meta filed lawsuit against s. korean data protection watchdog's ruling"", 'arete research downgrades meta platforms to sell']"
META,2023-03-07,"['meta shares are trading higher following a bloomberg report suggesting the company is planning more layoffs as soon as this week.', 'top wall street bets mentions for tuesday march 7, 2023: spy, nvda, tsla, dte, ing, aapl, trka, meta, snap, qqq', 'meta layoffs not over yet? zuckerberg to reportedly finalize plan to fire thousands more this week', ""meta shuns chatgpt model in sharing ai tools despite leak rumors for 'responsibility, openness'"", ""what's going on with meta platforms stock today?""]"
META,2023-03-08,['needham reiterates underperform on meta platforms']
META,2023-03-09,"['meta platforms coo javier olivan', ""looking into meta platforms's recent short interest"", ""3 etfs may bear the brunt of meta's decisions, from layoffs to price cuts"", 'meta platforms to rally 27%? here are 10 other analyst forecasts for thursday', ""critics argue meta's lack of policing in metaverse is harmful for underage users: washington post report"", 'oppenheimer maintains outperform on meta platforms, raises price target to $235', ""elon musk vs. mark zuckerberg: when meta schemed to take away twitter's 'bread and butter'""]"
META,2023-03-10,"['platformer reported thursday: meta is building a decentralized, text social network', ""benzinga pro's top 5 stocks to watch for friday, march 10, 2023: meta, schw, xpev, dox, hut"", 'meta retreats on creator reward bonus: report', ""like myspace, 'meta has no terminal value in its core business:' analyst flags concerns on meta and looming tiktok threat"", ""meta plans job cuts in similar magnitude to 2022's 13% cut""]"
META,2023-03-11,"['benzinga bulls and bears: amazon, meta, tesla, and a bitcoin bull', 'meta plans more layoffs in key projects, likely to match job cut numbers from 2022: report']"
META,2023-03-13,"['cerebral under fire for sharing sensitive health data of 3.1m us patients with google, meta, tiktok', 'meta weighs letting go of cash asset kustomer within one year of acquisition', ""us steps in to stem svb rot, shiba inu's 'shibarium beta,' meta eyeing more job cuts and more: 5 weekend stories you may have missed"", 'meta analyst estimates potential cost savings from fresh round of layoffs, mostly from metaverse', 'meta executive']"
META,2023-03-14,"[""jim cramer compares zuckerberg to musk as he pounds the table on meta, nvidia: 'if you're short ... send me an invitation to your funeral'"", 'evercore isi group maintains outperform on meta platforms, raises price target to $305', 'meta prepares to let 10k employees go, flatten organizational structure, cut back on non projects', ""meta's restructuring initiatives will create eps slingshot opportunity for revenue growth recovery, analyst"", 'watching meta platforms; hearing investor business daily buys stock', 'on march 14, 2023, meta platforms posts planned layoffs; preliminary update to total expense outlook, expects fy23 total expenses in range of $86b-$92b, down from $89b-$95b which includes fleet layoffs and restructuring costs of ~$3b-$5b', 'meta platforms expects to reduce team size by around 10,000 people', 'washington post reported monday: meta is set to begin another round of job cuts this week', 'meta platforms unusual options activity']"
META,2023-03-15,"[""benzinga pro's top 5 stocks to watch for wednesday, march 15, 2023: aapl, meta, nflx, tbi, dri"", ""what's going on with meta platforms stock today?"", ""snap shares up 8.3% after, meta shares up more than $7; wall street journal reported earlier u.s. threatening to ban tiktok if chinese founder doesn't sell ownership stake"", ""4 meta platforms analysts on 'ominous' 10k layoffs"", ""raymond james maintains outperform rating for meta platforms: here's what you need to know"", 'wolfe research maintains outperform on meta platforms, raises price target to $230', ""apple eases on bonus & hiring, federal reserve mulls tougher rules after svb failure, meta undersea cable project delayed by china: today's top stories"", 'meta platforms to rally over 36%? here are 10 other analyst forecasts for wednesday', ""dutch court finds meta (facebook) acted improperly in handling people's data"", 'raymond james maintains outperform on meta platforms, raises price target to $238', 'citigroup maintains buy on meta platforms, raises price target to $260', 'oppenheimer maintains outperform on meta platforms, raises price target to $260', 'meta undersea cable project reportedly delayed by china over spying fears']"
META,2023-03-16,"['ftc issues orders to meta, tiktok, youtube, twitter others seeking info on how platforms screen for misleading ads for scams, counterfeit products', 'jmp securities reiterates market outperform on meta platforms, maintains $240 price target', ""tesla, meta, thermogenesis, adobe, uipath: why these 5 stocks are drawing investors' attention today""]"
META,2023-03-17,"[""'introducing meta verified; a subscription bundle to help you establish and grow your presence on instagram and facebook. check availability on instagram and facebook' - blog post"", 'dan niles rings the register on meta, what led the manager to sell?', ""looking at meta platforms's recent unusual options activity"", 'meta platforms', 'meta ousts 1.5k hr employees under its second downsizing round', ""does it pay to bet on zuckerberg's metaverse…like steve jobs' iphone and bezos' amazon? here's what analyst"", 'team biden reportedly warns tiktok ban unless chinese owners divest stake — meta, snap shares shoot up']"
META,2023-03-18,"['benzinga bulls and bears: tesla, amazon, meta and shiba inu developer admits to big mistake']"
META,2023-03-19,"['meta launches paid verification on instagram and facebook in u.s.', ""if you invested $1,000 in meta platforms when they banned donald trump, here's how much you'd have now""]"
META,2023-03-20,['edward jones upgrades meta platforms to buy']
META,2023-03-21,"['meta platforms', ""meta's 'structural and cultural pivot' inspires analyst to raise price target by 30%"", ""benzinga pro's top 5 stocks to watch for tuesday, march 21, 2023: meta, lulu, bigb, onon, dwac"", 'check out what whales are doing with meta', 'meta platforms to rally over 26%? here are 10 other analyst forecasts for tuesday', 'morgan stanley upgrades meta platforms to overweight, raises price target to $250', ""avangrid to support meta's operations in texas with new 240 mw solar farm; shares spike higher""]"
META,2023-03-22,"['46 analysts have this to say about meta platforms', 'as twitter moves forward with cannabis advertising, meta really should get with the program', 'meta can easily return to 30%+ operating margin profile by 2024, analyst', 'keybanc upgrades meta platforms to overweight, announces $240 price target']"
META,2023-03-23,"['watching meta over one year: this was the headline on meta employees one year ago; what changed?', 'watching snap, meta platforms, alphabet; traders circulate post with images from analyst bernstein giving insight into a possible tiktok ban', ""watching snap and meta shares ahead of today's congressional testimony from tiktok ceo shou chew"", 'meta loses veteran ad official amid current organizational restructuring', ""whatsapp's latest update brings bigger group video and voice calls to windows — mac users will have to wait"", 'why snap and meta platforms shares are rising']"
META,2023-03-24,"[""jp morgan maintains overweight rating for meta platforms: here's what you need to know"", 'check out what whales are doing with meta', 'meta platforms to rally over 32%? here are 10 other analyst forecasts for friday', 'barclays maintains overweight on meta platforms, raises price target to $270', 'jp morgan maintains overweight on meta platforms, raises price target to $270']"
META,2023-03-27,"['conflict of interest? congress members who own meta, goog, snap shares could benefit from tiktok ban', ""it's not tesla, meta or nvidia — the best performing large stock in 2023 is a crypto play"", 'guggenheim maintains buy on meta platforms, raises price target to $240', 'wix announces integration with meta for business owners to seamlessly connect with their customers across whatsapp, instagram and messenger']"
META,2023-03-28,"['reported late monday march 27, dg media network offers new ad solutions for meta platforms', 'meta platforms sharpens knives on bonus payouts', 'meta platforms unusual options activity for march 28']"
META,2023-03-30,"['meta platforms is planning to let european users of facebook and instagram opt out of certain highly personalized ads as part of plans to limit impact of a european union privacy order', 'credit suisse maintains outperform on meta platforms, raises price target to $251', 'meta weighs political ad ban in wake of tougher eu regulations', 'meta has significant room for revenue ramp up with high margin revenue from search: analyst']"
META,2023-03-31,"[""meta's rally might be over, focus should be on revenue and not cost cuts: analyst"", ""meta's 136% rally from november lows gets a like from former hedge fund manager: 'kind of turnarounds i look for...'""]"
META,2023-04-01,"['benzinga bulls and bears: meta, alibaba, disney and what it will take for meme coins like doge to 100x']"
META,2023-04-03,"[""tesla, meta, wwe, mcdonald's, ford: why these 5 stocks are drawing investors' attention today"", ""meta chief ai scientist reacts after elon musk and co's call to pause ai trials: 'preposterously stupid'"", 'tesla, amazon, meta: options market went on a happy weekend, shrugging off opec+ intentions', 'check out what whales are doing with meta']"
META,2023-04-04,"[""time to buy? apple watch tops rolex in latest teens survey: jim cramer lauds apple, nike, meta as 'unassailable'"", 'tim cook seems to have addressed a million dollar question — why it took apple years to enter ar market']"
META,2023-04-05,"['meta platforms to rally over 16%? here are 10 other analyst forecasts for wednesday', 'jefferies maintains buy on meta platforms, raises price target to $250', ""benzinga pro's top 5 stocks to watch for wednesday, april 5, 2023: jpm, meta, fdx, expe, spot""]"
META,2023-04-06,"['ubs maintains buy on meta platforms, raises price target to $280', ""ubs maintains buy rating for meta platforms: here's what you need to know""]"
META,2023-04-10,"['tesla, amazon, meta: what options market indicates about these mega caps this week', ""this analyst with 83% accuracy rate sees around 30% upside in meta platforms - here are 5 stock picks for last week from wall street's most accurate analysts"", ""looking at meta platforms's recent unusual options activity""]"
META,2023-04-11,"['otr global upgrades meta platforms to positive', 'where meta platforms stands with analysts']"
META,2023-04-12,"['meta platforms unusual options activity', ""meta's restructuring efforts spark job stability concerns among employees amid layoffs and absence of leaders at headquarters""]"
META,2023-04-13,"['goldman sachs maintains buy on meta platforms, raises price target to $245', 'eu data protection board adopted dispute resolution decision concerning draft decision on the legality of data transfers to us by meta for facebook service', ""benzinga pro's top 10 stocks to watch for thursday, april 13, 2023: aapl, tsla, amzn, msft, intc, meta, nflx, bac, mcd, fcx"", 'piper sandler maintains overweight on meta platforms, raises price target to $250', ""tiktok flares up meta rivalry with latest move, doles out attractive offers to meta's vr contenders""]"
META,2023-04-14,"['meta platforms inc new features on instagram reels: trends, editing and gifts, adding two new metrics to instagram reels insights: total and average watch times; bringing gifts on instagram reels to more countries', 'td cowen maintains outperform on meta platforms, raises price target to $195']"
META,2023-04-17,"[""looking at meta platforms's recent unusual options activity"", '""breaking the barrier: can meta\'s stock price triumph over resistance and soar to unprecedented heights?', 'new street research downgrades meta platforms to neutral, announces $220 price target', 'tesla, amazon, meta: crucial trading levels priced in by options market for the week']"
META,2023-04-19,"[""meta prepares for further job cuts, google to allow developers to use alternative payment options, intel ditches production of bitcoin mining chip: today's top stories"", ""meta platforms prioritizes gaming, vr while cutting staff elsewhere during zuckerberg's 'year of efficiency'"", 'meta sharpens knives on facebook, whatsapp, instagram and reality labs workforce: begin next round of layoff', 'wolfe research maintains outperform on meta platforms, raises price target to $260', 'b of a securities maintains buy on meta platforms, raises price target to $250']"
META,2023-04-20,"['benzinga bulls and bears: apple, meta, rivian, and crypto expert predicts when bitcoin returns to all high', ""'meta plans to cut 10% of uk workforce in retreat from london'"", 'meta proposes centralized control: migrates instagram staff from london to new york under restructuring drive']"
META,2023-04-21,"[""meta's townhall: mark zuckerberg updates on layoffs, hiring and incentives"", 'rbc capital reiterates outperform on meta platforms, maintains $225 price target', 'meta has improved in ad campaigns over last half of march: bullish analyst lauds efforts', ""'you've shattered the morale,' meta employee demands answers from zuckerberg, questions reasons to stay, ceo responds""]"
META,2023-04-23,"[""this retailer generated mouth returns amid 2022's market slump and has outperformed apple, meta, nvidia and walmart""]"
META,2023-04-24,"[""looking at meta platforms's recent unusual options activity"", 'tesla, amazon, meta: here are crucial trading ranges priced by options market this week', ""analyst questions nvidia's valuation after company earned less than 20% of meta's profits in 2022: 'are expectations too high?'""]"
META,2023-04-25,"[""'meta to bring in microsoft exec to lead chips effort as it evaluates strategy' - the information"", 'check out what whales are doing with meta', 'meta muddles ai progress: chip project mishaps and metaverse ambitions inflate costs', 'ai to the rescue: morgan stanley foresees ai content unleashing monetization magic for meta']"
META,2023-04-26,"[""meta: ' ad impressions delivered across our family of apps increased by 26% year and the average price per ad decreased by 17% year.'"", 'meta sees q2 2023 revenue $29.5b-$32b vs $29.53b est', ""meta: 'we expect capital expenditures to be in the range of $30 billion, unchanged from our prior estimate.'"", 'meta sees fy23 total expenses $86b-$90b', 'meta sees $3b-$5b in restructuring costs related to facilities consolidation charges, severance', 'meta', 'meta platforms inc', 'meta platforms', 'meta platforms ceo zuckerberg', 'meta platforms cfo expects headcount growth in excess 1%- 2% in 2024', 'meta q1 family dap 3.02b, up 5% yoy, facebook daus 2.04b, up 4% yoy', 'meta platforms q1 earnings highlights: revenue and eps beat, ads delivered rise 26%, ai spending update and more', 'meta platforms q1 eps $2.20 beats $2.03 estimate, sales $28.64b beat $27.62b estimate', 'trading strategies for meta platforms stock before and after q1 earnings', 'top wall street bets mentions for wednesday april 26, 2023: frc, msft, spy, bbby, tsla, nvda, meta, qqq, atvi, cmg', ""if you invested $1,000 in meta stock at its early lows, here's how much you would have now"", 'meta options traders bet on stock recovering some losses by friday', 'meta platforms q1 earnings preview: job cuts, ai shift, metaverse and more']"
META,2023-04-27,"['oppenheimer maintains outperform on meta platforms, raises price target to $285', ""analyst expectations for meta platforms's future"", 'meta platforms technical outlook: a checkered flag? stock seems set up for continued run', 'meta platforms to rally around 67%? here are 10 other analyst forecasts for thursday', 'rbc capital maintains outperform on meta platforms, raises price target to $285', 'huber research upgrades meta platforms to overweight, announces $290 price target', ""what's going on with pinterest (pins) stock after meta platforms earnings"", 'deutsche bank maintains buy on meta platforms, raises price target to $290', 'guggenheim maintains buy on meta platforms, raises price target to $320', 'lennox international, meta platforms, hasbro and other big stocks moving higher on thursday', 'truist securities maintains buy on meta platforms, raises price target to $265', ""meta platforms's return on capital employed overview"", 'dow surges 100 points; meta platforms', 'citigroup maintains buy on meta platforms, raises price target to $315', 'why meta platforms shares are trading higher by over 11%; here are 20 stocks moving premarket', 'td cowen maintains outperform on meta platforms, raises price target to $220', 'roth capital reiterates buy on meta platforms, raises price target to $255', 'why meta stock is skyrocketing premarket today', 'baird maintains outperform on meta platforms, raises price target to $260', ""tesla, meta platforms, seres therapeutics, atomera, roku: why these 5 stocks are drawing investors' attention today"", 'meta platforms, amazon and 3 stocks to watch heading into thursday', 'keybanc maintains overweight on meta platforms, raises price target to $280', ""meta's 'goldilocks quarter' delights analysts: 'this is a stock that continues to go higher'"", 'piper sandler maintains overweight on meta platforms, raises price target to $270', 'goldman sachs maintains buy on meta platforms, raises price target to $300', 'evercore isi group maintains outperform on meta platforms, raises price target to $350', 'wolfe research maintains outperform on meta platforms, raises price target to $300', 'barclays maintains overweight on meta platforms, raises price target to $320', 'jp morgan maintains overweight on meta platforms, raises price target to $305', 'morgan stanley maintains overweight on meta platforms, raises price target to $300', 'mizuho maintains buy on meta platforms, raises price target to $280', 'credit suisse maintains outperform on meta platforms, raises price target to $277', 'rosenblatt maintains buy on meta platforms, raises price target to $263', 'bernstein maintains outperform on meta platforms, raises price target to $275', 'jmp securities maintains outperform on meta platforms, raises price target to $270', 'stifel maintains buy on meta platforms, raises price target to $280', 'raymond james maintains outperform on meta platforms, raises price target to $287', 'b of a securities maintains buy on meta platforms, raises price target to $300']"
META,2023-04-28,"['mark zuckerberg got a $10b wealth boost thursday on meta earnings: can he crack the top 10 soon?', ""meta platforms wants to use openai for coding, but the cost is 'crazy' high"", 'verge reporter tweets - \'meta is talking to microsoft/openai about doing an internal ai coding assistant for its engineers, but the cost is ""crazy"" at around 0.07 per query\'', 'meta options traders betting on stock continuing to move higher', ""what's going on with facebook (meta platforms) stock"", 'goldman sachs maintains buy on meta platforms, raises price target to $300', ""why meta's social media peers snap and pinterest are plummeting premarket friday"", 'us stocks settle higher after strong results from meta; market volatility decreases sharply']"
META,2023-04-29,"[""if you invested $1,000 in facebook stock when it changed name to meta platforms, here's how much you'd have today"", 'benzinga bulls and bears: apple, tesla, first republic bank, and why meta may be heading to $300']"
META,2023-05-01,"['meta platforms files for offering of $1.5b 4.60% senior notes due 2028, $1b 4.80% senior notes due 2030', 'meta quest gaming showcase 2023: what to expect from the exciting vr event', ""snap's meta move: swiping ad gurus to revitalize its ad strategy"", 'meta eyes raising $7b via bond offering, its second since 2022', ""what's not working for mark zuckerberg's meta? employee morale, metaverse and tiktok struggles tilt scales"", ""looking at meta platforms's recent unusual options activity"", 'meta targets $7b in its second blue bond sale', 'tesla, meta, amazon: options market reveals key trading levels for you to watch this week', ""this analyst with 87% accuracy rate sees around 17% upside in meta platforms - here are 5 stock picks for last week from wall street's most accurate analysts"", ""'meta sec filing reveals debt securities offering plans; facebook parent company filed a prospectus that""]"
META,2023-05-03,"[""hitting where it hurts - what's going on with meta stock today"", 'meta shares were trading lower after the ftc proposed a blanket prohibition preventing facebook from monetizing youth data.', 'meta policy communications director', '$1.6b lawsuit alleges meta algorithm helped spread hate speech in ethiopia', ""meta rival tiktok loses key official as it struggles to win us's vote of trust"", 'meta']"
META,2023-05-04,"[""meta's invite ad access rules: french antitrust watchdog calls for transparency and fairness""]"
META,2023-05-05,"['check out what whales are doing with meta', ""apple's ai playbook: why tim cook is not following the google and microsoft model"", 'meta to spin out kustomer in deal involving three venture firms', ""apple, meta brace for competition as india's richest man enters vr headset battle with a $16 device"", ""amc entertainment & warner bros earnings, broadcom ceo proposes to pitch eu regulators over vmware deal, apple & meta brace for virtual reality competition: today's top stories"", ""future of digital advertising is here - meta's ai ads""]"
META,2023-05-06,"['benzinga bulls and bears: shopify, uber, pacwest, and meta braces for challenger offering $16 vr headset']"
META,2023-05-08,"[""new york times, google deal is worth ~$100m over three years; includes nyt's participation in google news showcase; deal comes after meta platforms moved to end payments to u.s. news publishers"", 'meta lifts chip team from graphcore as ai game heats up', ""tesla, meta, amazon: here's what options market""]"
META,2023-05-09,"[""'expanding ads on reels; evolving our payout model based on the performance of creators' public reels, not the earnings of ads on their reels; in the coming weeks, we'll begin testing a similar program on instagram' - meta""]"
META,2023-05-10,"[""what's going on with meta's stock today""]"
META,2023-05-11,"[""reported earlier, 'facebook discontinuing messenger app for apple watch on may 31' - tech crunch"", 'meta unveiled generative ai features for advertisers', 'this is what whales are betting on meta platforms']"
META,2023-05-12,"[""looking into meta platforms's recent short interest"", 'meta ups ai game with back moves, extends ai competences for ads', ""tick, tock, messenger's off the clock: meta's app to vanish from apple watch on may 31""]"
META,2023-05-15,"['hedge fund coatue management doubles down on meta, nvidia, and microsoft as tech stocks regain momentum', ""analyst expectations for meta platforms's future"", 'meta platforms announces chat lock on whatsapp to increase security of sensitive conversations', ""looking at meta platforms's recent unusual options activity"", 'top wall street bets mentions for monday may 15, 2023: spy, nvda, tsla, qqq, aapl, pacw, amd, sofi, frc, meta', 'tesla, amazon, meta: options market indicates crucial trading levels for the week', 'loop capital upgrades meta platforms to buy, raises price target to $320', ""google launches tools to detect fake images, apple may encounter delays in iphone 15 production, shake shack sees activist investor proxy fight: today's top stories""]"
META,2023-05-17,"[""trouble brewing for meta? facebook parent sees year's 4th major executive exit in india"", 'meta working with bmw group to explore how ar and vr technology can work inside a fast vehicle', 'meta']"
