Ticker,Date,Cleaned_Headlines
META,2021-10-28,"[""10 augmented and virtual reality stocks to watch on the heels of facebook's meta rebrand""]"
META,2021-11-01,"[""welcome to the metaverse: investment implications from facebook's transition to meta.""]"
META,2021-12-30,"['proshares seeks to launch metaverse etf — apple, meta and this chipmaker would be its largest holdings']"
META,2022-02-02,"[""facebook/meta platforms to change ticker from 'mrvs' to 'meta' in h1'22"", 'apple sends letter to us senators dick durbin, chuck grassley related to recent app store bill; apple']"
META,2022-02-03,"['top 10 wallstreetbets mentions for thursday february 3, 2022 premarket: gme, amzn, amd, tsla, snap, aapl, googl, msft, meta, goog', 'why meta platforms shares are falling over 25% today']"
META,2022-02-07,"[""paypal co, peter thiel, won't stand for re to facebook/meta board""]"
META,2022-03-15,"['reversal patterns for meta platforms (facebook), ebay and lululemon: is the bottom forming?']"
META,2022-06-09,"['meta platforms scales back ar glasses plan', 'meta refutes to washington post story on facebook gun sales']"
META,2022-06-10,"['meta retracts from ar glasses project shortly after dumping smartwatch project', 'goldman sachs maintains buy on meta platforms, lowers price target to $290', ""benzinga pro's top 5 stocks to watch for friday, jun. 10, 2022: meta, whr, sfix, kr, palt"", 'why meta platforms shares are falling today', ""meta scrutinizing sheryl sandberg's use of facebook resources over several years""]"
META,2022-06-12,"['top wallstreetbets mentions this weekend: gme, tsla, amc, xom, aapl, amzn, baba, dte, meta, coin']"
META,2022-06-13,['what are whales doing with meta platforms']
META,2022-06-14,"[""here's how much you would have made owning meta platforms stock in the last 10 years"", ""'new tools and resources for parents and teens in vr and on instagram'  from meta"", ""britain's competition appeal tribunal rules that meta's appeal over giphy acquisition succeeds on one ground;"", 'meta platforms option alert: fri $177.5 calls sweep (5) near the ask: 466 @ $0.6 vs 1660 oi; earnings 7/27 after close [est] ref=$164.63']"
META,2022-06-15,['on cnbc: jon najarian highlights unusual options activity in meta platforms']
META,2022-06-16,"['top wallstreetbets mentions for wednesday june 15, 2022 after: gme, tsla, uvxy, amzn, dte, amc, sofi, meta, hood, aapl', 'french regulator reaches truce with facebook owner meta over online ads', 'ubs maintains buy on meta platforms, lowers price target to $215', 'what 24 analyst ratings have to say about meta platforms', 'keybanc sees trade desk gaining out of eu crackdown on alphabet, meta', 'why meta platforms stock is falling']"
META,2022-06-17,"['meta starts digital clothes store on facebook and instagram', 'needham considers it futile for meta to compete with tiktok, youtube, amazon, google', 'this is what whales are betting on meta platforms']"
META,2022-06-18,['meta sued for allegedly sharing medical data in secret: report']
META,2022-06-21,"[""'meta to start testing nfts in instagram stories soon'  report"", 'top wall street bets mentions for tuesday june 21, 2022 since 9:30 am et open: tsla, gme, meta, amd, amc, rev, nflx, nvda, hood, aapl', ""what's going on with meta platforms stock?""]"
META,2022-06-22,"['meta platforms on tuesday said extending commitment to not take fees on subscriptions, badges, paid online events and bulletin until january 1, 2024;', ""key takeaways from facebook parent meta's landmark antitrust settlement with us doj"", 'top wall street bets mentions for wednesday june 22, 2022 since 9:30 am et open: tsla, rev, uvxy, amd, gme, nvda, meta, xela, pltr, amzn', ""meta platforms ceo mark zuckerberg joins jim cramer in the metaverse on 'mad money' tonight"", 'is facebook losing out to tiktok? brazilian investment bank liquidates 4 long position in meta', ""benzinga before the bell: executive shakeup at amazon, boeing supply chain warning, apple's tim cook"", ""meta, microsoft, alibaba, others form metaverse governing body; apple's name missing"", 'meta facing ar/vr slowdown: analayst updates expectations on quest 2 pro headset launch', 'top wall street bets mentions for tuesday june 21, 2022 after: tsla, meta, gme, uvxy, rev, aapl, bbby, amd, amzn, nflx']"
META,2022-06-23,"[""jim cramer's 5 takeaways from his meeting about the metaverse with meta platform's mark zuckerberg"", 'meta renaming facebook pay to meta pay', 'top wall street bets mentions for thursday june 23, 2022 since 9:30 am et open: tsla, gme, amd, webr, amc, meta, fdx, amzn, sft, xom', 'top wall street bets mentions for thursday june 23, 2022 premarket: tsla, gme, amc, rev, meta, baba, webr, oxy, siga, dis', 'meta abruptly ends sponsorship of us event struck with controversy', 'top wall street bets mentions for wednesday june 22, 2022 after: tsla, gme, amc, webr, meta, rev, uvxy, kirk, amzn, bynd']"
META,2022-06-24,"['top wall street bets mentions for friday june 24, 2022 since 9:30 am et open: gme, tsla, meta, amd, uvxy, amc, amzn, ccl, goog, mstr', ""meta's biggest rival posts visible success on gaming foray despite bigger rivals like tencent, netease""]"
META,2022-06-27,"['rbc capital slashes price targets of meta, alphabet, pinterest, amazon - read why', 'top wall street bets mentions for monday june 27, 2022 since 9:30 am et open: tsla, amc, gme, aapl, amd, nke, rev, meta, teva, lly']"
META,2022-06-28,"['this is what whales are betting on meta platforms', 'why meta platforms (facebook) shares are diving today']"
META,2022-06-29,"['jp morgan maintains neutral on meta platforms, lowers price target to $225', 'developers chide meta for exploiting its dominance to charge for metaverse activities']"
META,2022-06-30,"['jmp securities maintains market outperform on meta platforms, lowers price target to $240', 'top wall street bets mentions for thursday june 30, 2022 premarket: tsla, gme, amd, bbby, amzn, amc, rev, meta, uvxy, nio', ""here's how much you would have made owning meta platforms stock in the last 10 years"", 'meta chief product officer']"
META,2022-07-01,"['hearing meta to use novi tech in metaverse, other products: co. said', ""meta's cryptocurrency wallet novi"", 'top wall street bets mentions for friday july 1, 2022 since 9:30 am et market open: tsla, amd, gme, nvda, soxl, bbby, meta, aapl, amzn, zim', 'top wall street bets mentions for the month of june: gme, tsla, amc, amzn, amd, aapl, uvxy, nvda, meta, hood', 'facebook parent meta testing nfts with some creators in the us: report', ""facebook parent meta cuts hiring plans as mark zuckerberg flags 'worst downturn in recent history:' report""]"
META,2022-07-03,"[""meta's novi cryptocurrency wallet is shutting down: what you need to know""]"
META,2022-07-05,"[""what's going on with meta platforms stock today?"", 'expert ratings for meta platforms', 'barclays maintains overweight on meta platforms, lowers price target to $280']"
META,2022-07-06,"['facebook parent company meta hypes up virtual collectibles despite crypto, nft crash', 'check out what whales are doing with meta', 'meta remains adamant on nft push in contrast with google, apple to secure its metaverse ambitions']"
META,2022-07-07,"['ten stocks trending on discord for thursday july 7, 2022: tsla, amzn, ctmx, aapl, gme, rgs, dmac, jagx, meta, ttoo', 'the meta platforms takeaways: why this analyst sees a near triple upside on the stock', 'meta said will no longer require a facebook account to access its virtual reality devices ; meta to roll out new login system for vr headsets starting in august', 'top wall street bets mentions for thursday july 7th, 2022 since 9:30 am et open: gme, tsla, bbby, amd, aapl, amc, meta, amzn, ffie, beam', 'evercore isi group maintains outperform on meta platforms, lowers price target to $280', 'expelled facebook employee files breach of user privacy charges against meta', ""meta plans to call new virtual reality headset the 'quest pro'"", 'meta platforms option alert: jul 22 $175 calls sweep (30) near the ask: 364 @ $4.3 vs 1884 oi; earnings 7/27 after close ref=$168.17']"
META,2022-07-08,"[""final trades on cnbc's halftime report: zoetis, meta platforms, delta air lines"", 'meta platforms, pinterest, snap shares quiet on news elon musk files to terminate purchase of twitter']"
META,2022-07-11,"['ten stocks trending on discord for monday july 11, 2022: tsla, tblt, itrm, twtr, rdhl, cost, epix, upst, meta, aapl', 'what are whales doing with meta platforms', ""cnbc's final trades: meta platforms, zoetis and this stock ahead of earnings"", ""meta's oversight board to hold a roundtable discussing the company's impact on upcoming african elections"", 'needham downgrades meta platforms to underperform', 'why this meta platforms analyst is turning bearish']"
META,2022-07-13,"['cowen & co. maintains outperform on meta platforms, lowers price target to $275']"
META,2022-07-14,"['citigroup maintains buy on meta platforms, lowers price target to $270', 'meta', 'why meta platforms stock is diving lower thursday']"
META,2022-07-15,"[""here's how much $1000 invested in meta platforms 10 years ago would be worth today""]"
META,2022-07-16,"['facebook parent meta, amazon scale back on nyc expansions']"
META,2022-07-17,"['top wall street bets mentions this weekend: nvda, tsla, aapl, amd, nflx, twtr, intc, meta, goog, bac']"
META,2022-07-19,"['top wall street bets mentions for tuesday july 19, 2022 since 9:30 am et open: nflx, tsla, aapl, gme, nvda, twtr, ibm, amd, uvxy, meta', 'credit suisse continues to see sharp upside in meta, alphabet despite double price target cuts', 'bz chart of the day: is meta about to break out?', 'morgan stanley maintains overweight on meta platforms, lowers price target to $280', 'credit suisse maintains outperform on meta platforms, lowers price target to $245']"
META,2022-07-20,"['how one analyst expects alphabet, meta, snap, amazon to perform in upcoming earnings season', 'google bows down to eu tech rules, cuts commission in google play app store']"
META,2022-07-21,"['why meta platforms stock is falling after hours', 'analyst ratings for meta platforms', 'this is what whales are betting on meta platforms', ""benzinga pro's top 5 stocks to watch for thursday, jul. 21, 2022: aapl, amzn, mcd, meta, gm"", 'deutsche bank maintains buy on meta platforms, lowers price target to $235']"
META,2022-07-22,"[""here's a look at meta platforms stock after snap drags the facebook, instagram parent lower"", 'why is meta platforms stock sliding today?', ""snap's 'ugly' results a forewarning for meta investors? munster throws light on q2 results""]"
META,2022-07-24,"['apple, meta, pfizer among key companies reporting in the week ahead, as earnings pick up pace', 'top wall street bets mentions this weekend: gme, tsla, snap, siga, msft, aapl, amzn, meta, amc, goog']"
META,2022-07-25,"[""after snap's dismal q2, this analyst gives take on meta, airbnb"", 'ten stocks trending on discord for for monday july 25, 2022: amzn, tsla, ubs, govx, wmt, aapl, rbc, meta, mod, sivb', 'top wall street bets mentions for monday july 25, 2022: gme, wmt, tsla, aapl, snap, siga, uvxy, amzn, meta, msft', 'meta said to weigh buying eye glasses startup adhawk', 'meta platforms still suffers apple ios privacy challenges, analyst', 'bitcoin shows indecision as markets await apple, amazon, meta platform earnings', ""how will alphabet, meta platforms shares react to earnings following snap's collapse?"", ""meta's revenue feature is facebook's latest move to combat tiktok; creators on facebook to get 20% of revenue share through in ads on certain videos"", 'meta platforms analyst expects company to report negative revenue growth for the first time', 'meta to let facebook creators earn money for videos with music', 'meta platforms to $250? plus this analyst lowers price target on microsoft', 'mizuho maintains buy on meta platforms, lowers price target to $250', 'rosenblatt maintains neutral on meta platforms, lowers price target to $181']"
META,2022-07-26,"['meta increases price of quest 2 vr headsets by about $100', 'why meta platforms stock is rising after hours', 'meta unveils new facebook music revenue sharing feature to better compete with tiktok', ""meta, google, pinterest hit with price target cuts ahead of q2 earnings: here's why"", ""looking at meta platforms's recent whale trades"", ""'meta instagram head adam mosseri said will continue to support photos' - instagram"", 'amazon.com to $170? plus this analyst lowers price target on meta platforms', 'keybanc maintains overweight on meta platforms, lowers price target to $190']"
META,2022-07-27,"['a look at meta platforms stock as the company heads into q2 earnings', 'meta platforms, inc. - class a common stock q2 eps $2.46 misses $2.61 estimate, sales $28.82b miss $28.97b estimate', 'meta platforms sees q3 2022 total revenue $26b-$28.5b vs $30.52b expected', 'meta cfo david wehner to take on role as chief strategy officer; susan li to become cfo', 'meta platforms expects fy22 total expenses $85b-$88b', 'meta platforms ceo zuckerberg', 'meta', 'meta platforms cfo', 'recap: meta platforms q2 earnings', 'meta platforms cfo on apple privacy changes', ""meta platforms misses on q2 earnings: user numbers, ad impressions, zuckerberg's comments and more"", 'meta platforms', 'boeing, meta platforms and 5 stocks to watch heading into wednesday', ""meta's quest 2 headset price hike leaves analyst worried about the gear losing 'critical competitive advantage'"", 'trader bets $1m on meta platforms declining after earnings release', 'senators say meta, twitter should address russian disinformation', 'top wall street bets mentions for wednesday july 27, 2022 since 9:30 am et open: gme, tsla, msft, meta, aapl, goog, shop, uvxy, nvda, sava', 'ftc has sued meta to block it from buying vr company within unlimited']"
META,2022-07-28,"['stifel maintains buy on meta platforms, lowers price target to $230', 'truist securities maintains buy on meta platforms, lowers price target to $260', 'b of a securities maintains buy on meta platforms, lowers price target to $218', ""meta platforms stock is falling: what's happening?"", 'mkm partners maintains buy on meta platforms, lowers price target to $240', 'wells fargo maintains overweight on meta platforms, lowers price target to $275', 'deutsche bank maintains buy on meta platforms, lowers price target to $200', 'evercore isi group maintains outperform on meta platforms, lowers price target to $240', 'meta, charter communications, southwest airlines and some other big stocks moving lower on thursday', 'ubs maintains buy on meta platforms, lowers price target to $195', 'nasdaq dips over 100 points; meta earnings miss estimates', ""'meta to study race of instagram users'  report"", 'rbc capital maintains outperform on meta platforms, lowers price target to $190', ""looking into meta platforms, inc. - class a common stock's return on capital employed"", 'top wall street bets mentions for thursday july 28, 2022 since 9:30 am et open: aapl, tsla, gme, amzn, siga, meta, msft, uvxy, amd, nvda', '7 meta platforms analysts talk q2 weakness in advertising, risk and long growth for reels', ""meta, best buy get cnbc 'fast money' mentions, with steve weiss purchasing this stock"", 'barclays maintains overweight on meta platforms, lowers price target to $250', 'meta officially cuts funding for news publishers', 'mizuho maintains buy on meta platforms, lowers price target to $225', 'meta platforms to $255? here are 5 other price target changes for thursday', 'ten stocks trending on discord for wednesday july 27, 2022: meta, msft, cmg, ubs, goog, shop, ttoo, tsla, aapl, mcd', 'top wall street bets mentions for wednesday july 27, 2022 after: gme, meta, aapl, tdoc, tsla, msft, qcom, snap, amzn, nvda', 'keybanc maintains overweight on meta platforms, raises price target to $196', 'why meta platforms is trading lower by more than 6%: here are 34 stocks moving premarket', 'piper sandler maintains neutral on meta platforms, lowers price target to $190', 'citigroup maintains buy on meta platforms, lowers price target to $222', 'raymond james maintains outperform on meta platforms, lowers price target to $215', 'oppenheimer maintains outperform on meta platforms, lowers price target to $190', ""us ftc seeks to block meta's acquisition of vr content maker citing antitrust concerns"", 'rosenblatt maintains neutral on meta platforms, lowers price target to $156', 'meta platforms faces several price target cuts after downbeat q2 earnings, but this analyst disagrees', 'wolfe research maintains outperform on meta platforms, lowers price target to $200', 'jp morgan maintains neutral on meta platforms, lowers price target to $200', 'goldman sachs maintains buy on meta platforms, lowers price target to $255', 'credit suisse maintains outperform on meta platforms, lowers price target to $214', 'jmp securities maintains market outperform on meta platforms, lowers price target to $215', ""meta gets a higher price target from keybanc despite disappointing q2 result: here's why""]"
META,2022-07-29,"['this is what whales are betting on meta platforms', 'meta could be forced to blackout facebook, instagram from eu pending this agreement: report', 'dz bank downgrades meta platforms to sell, announces $140 price target']"
META,2022-07-30,"[""bulls and bears of the week: meta, netflix, tesla, coinbase and why ethereum's merge isn't price in yet""]"
META,2022-08-01,"['top wall street bets mentions for monday august 1, 2022 since 9:30 am et open: tsla, amd, gme, hexo, siga, amzn, nvda, aapl, uvxy, meta', ""how benzinga's users did at predicting top stock earnings for apple, meta platforms, microsoft and more"", 'top wall street bets mentions this weekend: gme, amd, tsla, amc, siga, baba, aapl, nvda, amzn, meta']"
META,2022-08-02,"[""here's how much you would have made owning meta platforms stock in the last 10 years"", 'target, meta get cnbc fast money mentions: what stephanie link is buying', 'bz chart of the day: is meta about to breakdown?', ""does being on facebook make you richer? here's what meta's research""]"
META,2022-08-03,"['meta to hold investor meetings for possible first bond sale', 'meta platforms whale trades spotted', 'meta platforms is exploring its first potential bond sale: what investors need to know']"
META,2022-08-04,"['meta platforms inc took action against two cyber espionage operations in south asia in quarter', 'meta platforms teams with coinbase and dapper labs for nfts on instagram: here are the details', ""meta's oversight board"", 'meta platforms']"
META,2022-08-05,"['meta has agreed to pause its acquisition of virtual reality company within unlimited inc', ""'meta unleashes blenderbot 3 upon the internet, its most competent chat ai to date'"", ""'meta and twitter have delayed hiring their summer interns. it's a break from the 'follow back' offers that make these companies so popular for top candidates'  reporter""]"
META,2022-08-07,"[""mark zuckerberg is 'kind of creepy and controlling' - this is what meta's new ai chatbot""]"
META,2022-08-08,['looking at meta platforms recent whale trades']
META,2022-08-09,['meta platforms']
META,2022-08-10,"['bofa global research adds meta platforms stock to its u.s. 1 list', 'meta platforms', 'introducing support for duet display app, which turns your meta portal plus (gen 2) & meta portal go into 2nd display for your computer screen', ""here's why meta platforms stock is soaring higher""]"
META,2022-08-11,"['benzinga before the bell: iphone 14 might be costlier, coinbase face another sec probe, binance sees crypto user growth and other top financial stories thursday, august 11', 'analyzing meta platforms short interest']"
META,2022-08-12,['this is what whales are betting on meta platforms']
META,2022-08-14,"[""meet javier olivan, sheryl sandberg's successor at meta""]"
META,2022-08-15,"[""meta platforms investing in this singapore company's app: what investors should know""]"
META,2022-08-16,"[""mark zuckerberg tells employees — 'self is ok with me,' wants those who 'shouldn't be' at meta to leave""]"
META,2022-08-17,"['meta aims to avoid political controversy ahead of us midterms', 'meta platforms shares move higher on report amazon testing a tiktok feed internally', 'amazon succumbs to tiktok fever after meta, youtube']"
META,2022-08-18,"['meta platforms whale trades spotted', 'this energy company earned more than apple, meta, microsoft and tesla combined in q2', ""former meta employee and mark zuckerberg's sister emphasizes on evolution of web3, metaverse for higher adoption""]"
META,2022-08-19,"['41 analysts have this to say about meta platforms', 'roblox poaches meta official to boost presence in asia, remains bullish on china', 'meta platforms price target cut by this analyst, plus bmo capital predicts $223 for salesforce', 'morgan stanley maintains overweight on meta platforms, lowers price target to $225', ""benzinga before the bell: tesla's autopilot attracts regulatory ire again, roblox poaches meta official, snap cancels drone project and other top financial stories friday, august 19""]"
META,2022-08-20,"[""how much $1,000 invested in apple, meta, amazon, netflix, alphabet in mid would have fetched ahead of friday's plunge""]"
META,2022-08-22,"['loop capital maintains hold on meta platforms, lowers price target to $165']"
META,2022-08-23,"['meta platforms whale trades spotted', 'benzinga before the bell: tesla loses challenge against racial bias accusation, monkey pox vaccines may not be enough, apple to manufacture iphone 14 in india soon after release and other top financial stories tuesday, august 23', ""meta's instagram is now testing a feature inspired by a smaller rival""]"
META,2022-08-24,"[""meta reaches $37.5m settlement for facebook's user privacy violation: report"", 'snap, meta have more downside as competition, budget constraints weigh, analysts say']"
META,2022-08-25,"[""'mark zuckerberg confirms new meta vr headset will launch in october'  verge report"", 'meta, twitter removed provocative accounts promoting pro narratives from middle east, a study finds']"
META,2022-08-26,"['why roblox, netflix and meta platforms shares are falling']"
META,2022-08-27,"[""zuckerberg won't be deposed: meta's facebook agrees to settle cambridge analytica data privacy lawsuit"", ""if you invested $1,000 in meta platforms and twitter when they banned donald trump, here's how much you'd have now""]"
META,2022-08-29,"['benzinga before the bell: meta loses key metaverse official, us government to cancel free at covid tests, singapore mulls rules to regulate cryptocurrency trading and other top financial stories monday, august 29', 'meta platforms', 'this is what whales are betting on meta platforms', ""zuckerberg explains why meta doesn't allow porn on its platforms: 'i don't think it's a political decision'"", ""meta loses key metaverse official shortly after criticism over chief mark zuckerberg's avatar"", 'meta and jio platforms collaborate to launch jiomart on whatsapp: the first end shopping experience on whatsapp']"
META,2022-08-30,"[""here's how much $100 invested in meta platforms 10 years ago would be worth today"", 'what are whales doing with meta platforms', 'how is the market feeling about meta platforms?', 'australia compels apple, meta, snapchat to explain how they are tackling child abuse content', 'meta now lets you post your nfts on both facebook and instagram']"
META,2022-08-31,"['top wall street bets mentions for wednesday august 31, 2022 since 9:30 am et open: bbby, gme, amc, snap, tsla, aapl, meta, amd, nvda, crwd', 'why meta platforms stock is rising today', 'ten stocks trending on discord for wednesday august 31, 2022: nuwe, avct, bbby, nerv, allk, snap, meta, lgvn, bhc, ttoo', 'snap, meta platforms, pinterest and some other big stocks moving higher on wednesday', 'meta platforms shares spike higher on snap 8k filing on program, job cuts']"
META,2022-09-01,['meta is planning more paid features for facebook and instagram']
META,2022-09-02,['meta selects qualcomm to accomplish metaverse ambitions']
META,2022-09-06,"['top financial stories tuesday, september 6: focus on iphone 14 event, opec+ plans mild production cut, netflix', ""looking at meta platforms's recent whale trades"", ""apple's rivals bled after it unleashed privacy moves — now the iphone maker reportedly plans to double its advertising staff"", 'meta goes aggressive on vr despite regulatory hindrances; scoops another vr startup for undisclosed terms']"
META,2022-09-07,"['rosenblatt maintains neutral on meta platforms, lowers price target to $154', ""this analyst raises price target on alphabet, but slashes meta's pt"", 'where meta platforms stands with analysts']"
META,2022-09-08,['meta']
META,2022-09-10,"['weekend stock spotlight: meta, apple, amazon and el salvador feeling brunt of bitcoin downturn']"
META,2022-09-12,"[""piper sandler maintains neutral rating for meta platforms: here's what you need to know"", ""'meta platforms announcing pytorch foundation to accelerate progress in ai research' - fb"", 'meta platforms option alert: fri $170 calls at the ask: 500 @ $3.05 vs 38218 oi; earnings 10/24 after close [est] ref=$168.57', ""india's meity startup hub and meta collaborate to accelerate xr technology startups in india"", 'this analyst slashes pt on meta platforms, plus mizuho predicts $440 for adobe', 'piper sandler maintains neutral on meta platforms, lowers price target to $175']"
META,2022-09-13,"[""what's going on with meta platforms stock?"", 'meta platforms option alert: jun, 2024 $340 calls sweep (8) near the ask: 359 @ $5.701 vs 858 oi; earnings 10/24 after close [est] ref=$156.13', 'snap, tiktok and others protest as meta seeks sensitive information to battle ftc lawsuit']"
