Ticker,Date,headline
AMD,2020-10-09,"AMD Nears Deal To Acquire Xilinx At $30B Valuation: WSJ | 5 Stocks To Watch For October 9, 2020 | Wall Street Journal Reported Late Thursday, AMD is in Talks to Acquire Xilinx in $30B+ Deal; Deal Could be Announced as Early as Next Week; Xilinx Shares Rise 17% in Premarket | A Peek Into The Markets: US Stock Futures Climb; AMD In Talks To Buy Xilinx | 40 Stocks Moving in Friday's Pre-Market Session | Xilinx Likely Doesn't Want To Sell - CNBC's Jim Cramer Says | ROCE Insights For Advanced Micro Devices | Mid-Morning Market Update: Markets Open Higher; AMD Nears Deal To Buy Xilinx | Price Over Earnings Overview: Advanced Micro Devices | 44 Stocks Moving In Friday's Mid-Day Session | Mid-Day Market Update: Gold Gains 2%; ShiftPixy Shares Plunge | Why AMD's Interest In Xilinx 'Strategic,' Says Bullish Analyst | Mid-Afternoon Market Update: Nasdaq Rises 1.2%; VivoPower International Shares Spike Higher | 3 Takeaways On AMD's New Ryzen 5000 Series"
AMD,2020-10-12,"62 Biggest Movers From Friday | Truist Securities Initiates Coverage On Advanced Micro Devices with Hold Rating, Announces Price Target of $90 | Benzinga's Top Upgrades, Downgrades For October 12, 2020"
AMD,2020-10-15,"AMD To Report Q3 Earnings On Tuesday, Oct. 27 After Market Close"
AMD,2020-10-22,"Benzinga Pro's Top 5 Stocks To Watch For Thursday, Oct. 22, 2020: INTC, NKLA, AZN, VLRS, MRIN"
AMD,2020-10-23,"Cramer On Intel: The Real Issue Was Competition; AMD With The Mouse Trap, NVIDIA Entering Data | How Large Option Traders Are Playing Intel Following Earnings Sell-Off"
AMD,2020-10-26,"Benzinga Pro's Top 5 Stocks To Watch For Oct. 26, 2020: CHGG, AMD, KNL, PFE, JBLU | Earnings Outlook for Advanced Micro Devices | Susquehanna Maintains Positive on Advanced Micro Devices, Raises Price Target to $95 | AMD Expected To Draw Strength From Intel's Weaknesses, Gaming Console Chips"
AMD,2020-10-27,"Earnings Scheduled For October 27, 2020 | U.S. Equity Futures Marginally Higher Following Monday's Selloff; European Equity Futures Lower on Concerns Over Increasing Restrictions Due to Covid Spike; Microsoft, AMD Report Tuesday After-the-Close | Advanced Micro Devices Q3 Adj. EPS $0.41 Beats $0.35 Estimate, Sales $2.80B Beat $2.56B Estimate | AMD Sees Q4 Sales $2.9B-$3.1B vs $2.62B Est. | AMD To Acquire Xilinx In All Stock Transaction With Combined Enterprise Value Of Approximately $135B | Earnings Scheduled For October 27, 2020 | U.S. Equity Futures Marginally Higher Following Monday's Selloff; European Equity Futures Lower on Concerns Over Increasing Restrictions Due to Covid Spike; Microsoft, AMD Report Tuesday After-the-Close | Advanced Micro Devices Q3 Adj. EPS $0.41 Beats $0.35 Estimate, Sales $2.80B Beat $2.56B Estimate | AMD Sees Q4 Sales $2.9B-$3.1B vs $2.62B Est. | AMD To Acquire Xilinx In All Stock Transaction With Combined Enterprise Value Of Approximately $135B | 40 Stocks Moving in Tuesday's Pre-Market Session | UPDATE: AMD To Buy Xilinx For Fixed Exchange Ratio Of 1.7234 Shares of AMD Common Stock, Or $143/Share | AMD Confirms $35B Purchase Of Xilinx, Reports Beat-And-Raise Q3 | Price Over Earnings Overview: Advanced Micro Devices | How Large Option Traders Are Playing AMD Following Xilinx Buyout, Q3 Earnings | AMD Shares Higher After Hours As Hearing Barclays Upgraded To Overweight, Set $100 Price Target | Jim Cramer Talks AMD, Inovio And Honda Motors"
AMD,2020-10-28,"Barclays Upgrades Advanced Micro Devices to Overweight, Raises Price Target to $100 | 'Trading Nation' Traders Weigh In On AMD | Craig-Hallum Upgrades Advanced Micro Devices to Buy, Raises Price Target to $100 | Benzinga's Top Upgrades, Downgrades For October 28, 2020 | Citigroup Maintains Sell on Advanced Micro Devices, Raises Price Target to $13 | AMD Analysts See Momentum Ahead As $110B Xilinx Deal Expands Market Opportunity"
AMD,2020-10-29,Chip Merger-Frenzy Continued: Marvell Said To Be Nearing $10B Purchase Of Inphi | Semiconductor Firm Allegro MicroSystems Raises $350M In IPO | Looking Into Advanced Micro Devices's Return On Capital Employed
AMD,2020-10-31,"Benzinga's Bulls And Bears Of The Week: FAANGS, Ford, Visa And More"
AMD,2020-11-01,"Barron's Picks And Pans: AT&T, GE, Zynga And More"
AMD,2020-11-02,Why The Best Outcome For Intel Shareholders Is To Break Up The Chipmaker | Intel Shares Move Lower As Hearing Apple To Unveil Mac Laptops Without Intel Processors
AMD,2020-11-04,"Goldman Sachs Upgrades Advanced Micro Devices to Buy, Announces $96 Price Target, Adds to Conviction List | Benzinga's Top Upgrades, Downgrades For November 4, 2020 | Goldman's Semiconductor Pair Trade: Buy AMD, Sell Intel | Yahoo Finance Trending Stocks For Wednesday, Nov. 4, 2020: UBER, LYFT, AAPL, KODK, MSFT, FB, AMD, AMZN, NIO, TSLA, TQQQ, NVDA, QQQ, DRAD, GOOG, DKNG, RIDE, NFLX, FSLY, GOOGL, APVO, ZM, WKHS, ADBE, DOCU, SAVA, SQQQ, SMG | Najarian Mentions AMD Unusual Options, Nov. $87 Calls | Pete Najarian Sees Unusual Options Activity In Wynn, Nvidia"
AMD,2020-11-05,"Growth Stocks To See 'Nirvana' With Blue White House, Divided Congress, Cramer Says"
AMD,2020-11-06,"Wells Fargo Upgrades Advanced Micro Devices to Overweight, Announces $100 Price Target | A Peek Into The Markets: US Stock Futures Drop Ahead Of Jobs Data | Benzinga's Top Upgrades, Downgrades For November 6, 2020 | CNBC Halftime Report Final Trades: Advanced Micro Devices, International Flavors, Brookfield Asset, VGP NV | 'Halftime Report' Traders Calls Of The Day: AMD And More"
AMD,2020-11-09,Cramer On CNBC: Selloff Of AMD Is 'Wrong' | 'Leaked documents tease AMD 'Big Navi' GPUs are coming to... Tesla?' -TechRadar Report | Cramer Thinks Credit Card Stocks Could Be Winners Of Economic Reopening
AMD,2020-11-10,Why Corsair Could Be The Best Way To Play Booming Gaming Market
AMD,2020-11-11,Bitcoin Bull Mark Yusko Calls The Cyptocurrency 'An Asset Most People Don't Understand'
AMD,2020-11-12,"Cramer Shares His Thoughts On CVS Health, T-Mobile, More | Cramer Shares His Thoughts On Nvidia | 10 Information Technology Stocks Showing Unusual Options Activity In Today's Session | 5 Top Semiconductor Stocks As Post-Election Plays"
AMD,2020-11-13,"Cramer Gives His Opinion On Blackstone, Advanced Micro Devices And More"
AMD,2020-11-16,10 Information Technology Stocks With Unusual Options Alerts In Today's Session
AMD,2020-11-17,10 Information Technology Stocks Showing Unusual Options Activity In Today's Session
AMD,2020-11-18,10 Information Technology Stocks With Unusual Options Alerts In Today's Session | 10 Information Technology Stocks With Unusual Options Alerts In Today's Session
AMD,2020-11-19,"10 Information Technology Stocks With Unusual Options Alerts In Today's Session | Yahoo Finance Trending Stocks For Thursday, Nov. 19, 2020: SONO, ROKU, ZBRA, SBE, NVDA, YY, COTY, BILI, BLNK, XPEV, AMD, AYRO, SOLO, SQ, CIIC, BABA, TDOC, TLS, FENG, SHOP, WPX, TWLO, LPX, CSIQ, GEVO, TTNP, NNDM, SNAP, FMCKM, MDGS"
AMD,2020-11-20,"Tigress Financial Analyst Ivan Feinseth, Commenting On Semiconductor Strength, Tells Benzinga 'It's Just General Industry And Sector Demand For The Chips Stocks Because Chips Drive Everything And Are Everywhere'"
AMD,2020-11-23,Unusual Options Activity Insight: Advanced Micro Devices | 10 Information Technology Stocks Showing Unusual Options Activity In Today's Session
AMD,2020-11-24,"'NVIDIA GeForce RTX 3000 Mobility Series Lineup, Roadmap 1H 2021 And AMD CPU Support!' -WCCFTech Report | 10 Information Technology Stocks Showing Unusual Options Activity In Today's Session"
AMD,2020-11-25,10 Information Technology Stocks Showing Unusual Options Activity In Today's Session | Understanding Advanced Micro Devices's Unusual Options Activity
AMD,2020-11-27,10 Information Technology Stocks With Unusual Options Alerts In Today's Session
AMD,2020-11-30,"10 Information Technology Stocks Showing Unusual Options Activity In Today's Session | Pete Najarian On CNBC's Halftime Report Highlights AMD Unusual Options Nov. $98 Calls | AMD Shares Up 5.5% To Around The $92 Level; Co. Had Been Scheduled To Present At Credit Suisse Tech Conference Today; However, Credit Suisse Agenda Did Not List AMD As A Confirmed Speaker | Pete Najarian Sees Unusual Options Activity In AMD And Gap | CNBC Halftime Report Final Trades: Vale, Equinix, Bitcoin, AMD | 'Halftime Repor' Final Trades: AMD, Vale And More"
AMD,2020-12-01,AMD Analyst Projects Strong Start To 2021 For Chipmaker | Will AMD Or Nvidia Stock Grow More By 2025? | 10 Information Technology Stocks Showing Unusual Options Activity In Today's Session
AMD,2020-12-02,"AMD Shares Up 3%, Rebounded From Below $92 Level Earlier; Co. Issued Earlier Press Release Highlighting Amazon's AWS Expanded Its AMD-Based Offerings With New Cloud Instance For Amazon Elastic Compute Cloud | Stocks That Hit 52-Week Highs On Wednesday | 10 Information Technology Stocks Showing Unusual Options Activity In Today's Session"
AMD,2020-12-03,Analyzing Advanced Micro Devices's Unusual Options Activity | 3 Tech Stocks To Keep On Your Holiday Radar | 10 Information Technology Stocks With Unusual Options Alerts In Today's Session
AMD,2020-12-04,10 Information Technology Stocks With Unusual Options Alerts In Today's Session
AMD,2020-12-06,"Cramer Gives His Opinion On Boeing, Fiverr And More"
AMD,2020-12-07,"The Street Price PlayStation 5, Xbox Series X Are Really Selling At, As Per The Verge | Will Micron Or Intel Stock Grow More By 2025? | 10 Information Technology Stocks Showing Unusual Options Activity In Today's Session"
AMD,2020-12-08,10 Information Technology Stocks Showing Unusual Options Activity In Today's Session
AMD,2020-12-09,10 Information Technology Stocks Showing Unusual Options Activity In Today's Session
AMD,2020-12-10,10 Information Technology Stocks With Unusual Options Alerts In Today's Session
AMD,2020-12-11,10 Information Technology Stocks Showing Unusual Options Activity In Today's Session
AMD,2020-12-13,Will AMD's Stock Reach $200 By 2022?
AMD,2020-12-14,"Tony Zhang Shares His Thoughts On Advanced Micro Devices | Steam Data Suggests Nvidia, AMD On Track For Big Q4 | 10 Information Technology Stocks With Unusual Options Alerts In Today's Session | Option Trader Bets $1.3M On AMD As Stock Approaches All-Time High | Watching AMD Shares; Hearing Goldman Sachs Raises Price Target From $96 To $110"
AMD,2020-12-15,"Looking Into Advanced Micro Devices's Return On Capital Employed | Price Over Earnings Overview: Advanced Micro Devices | Stocks That Hit 52-Week Highs On Tuesday | 10 Information Technology Stocks Showing Unusual Options Activity In Today's Session | CNBC Final Trades: Stewart Information Services, Wingstop, AMD, AbbVie | 'Halftime Report' Final Trades: AMD, Wingstop And More"
AMD,2020-12-16,"AMD Shares Fall Below $96 Level, Rebound Off $95.50; Shares Down 1.4% for Session"
AMD,2020-12-17,10 Information Technology Stocks Showing Unusual Options Activity In Today's Session | Hearing Wells Fargo Raised Its Price Target On Advanced Micro Devices To $120 Per Share | 10 Information Technology Stocks Showing Unusual Options Activity In Today's Session | Hearing Wells Fargo Raised Its Price Target On Advanced Micro Devices To $120 Per Share
AMD,2020-12-18,10 Information Technology Stocks Showing Unusual Options Activity In Today's Session | Shares Of Semiconductor/Chip Companies Dip Following Bloomberg Report Suggesting Microsoft Is Designing Its Own Chips | Chip Stocks Fall On Report Microsoft Will Take Things In House
AMD,2020-12-21,10 Information Technology Stocks With Unusual Options Alerts In Today's Session | Will AMD Or Qualcomm Stock Grow More By 2022?
AMD,2020-12-23,10 Information Technology Stocks Showing Unusual Options Activity In Today's Session
AMD,2020-12-28,10 Information Technology Stocks Showing Unusual Options Activity In Today's Session | Mizuho's Top Semiconductor Stocks For 2021: Do You Own Them?
AMD,2020-12-29,10 Information Technology Stocks With Unusual Options Alerts In Today's Session
AMD,2020-12-30,"Is Now The Time To Buy Alibaba, Snap, Intel Or Nano Dimension Stock? | 10 Information Technology Stocks With Unusual Options Alerts In Today's Session"
AMD,2020-12-31,10 Best Performing S&P 500 Stocks Of 2020 | 10 Information Technology Stocks With Unusual Options Alerts In Today's Session
AMD,2021-01-04,P/E Ratio Insights for Advanced Micro Devices | 10 Information Technology Stocks With Unusual Options Alerts In Today's Session
AMD,2021-01-06,"Achronix Semiconductor In Talks For $2B SPAC Merger Deal: Report | 10 Information Technology Stocks Showing Unusual Options Activity In Today's Session | AMD Expands Senior Leadership Team; Appoints CFO, Chief Sales Offiver"
AMD,2021-01-08,Strong iPhone Demand Helps Taiwan Semiconductor Clock Record Quarterly Revenue: Bloomberg | Unusual Options Activity Insight: Advanced Micro Devices
AMD,2021-01-11,"8 Stocks To Watch At CES 2021 | Intel In Talks With TSMC, Samsung To Outsource Production: Report | 10 Information Technology Stocks With Unusual Options Alerts In Today's Session"
AMD,2021-01-12,"Applied Materials, II-VI Are BofA's Favorite Semiconductor Plays For 2021 | Benzinga Pro's Top 5 Stocks To Watch For Tuesday, Jan. 12, 2021: AMD, GBTC, GM, NIO, AMAT | AMD CEO To Appear On CNBC Shortly | Samsung Confirms AMD GPU For Next Flagship Product | AMD Shares Near Recent High, Up 0.1%, As CEO Lisa Su Currently Giving Consumer Electronics Show Keynote Presentation | AMD CEO Lisa Su Welcomes Microsoft Chief Product Officer To CES Presentation | AMD CEO Lisa Su Unveils Ryzen 5000 Mobile Processor | AMD CEO Lisa Su Welcomes On HP CEO To CES Presentation | Intel Shares Near Session High, Do Not Seem To Be Reacting To AMD CEO Lisa Su's Keynote Presentation At CES | AMD CEO Lisa Su Now Discussing Gaming At CES Keynote Presentation, Notes Gaming Industry Larger Than Movie And Music Industries Combined | AMD CEO Lisa Su Says AMD's RDNA 2 Will Be Coming To Laptop/Notebook Gaming | AMD CEO Lisa Su Previewing 3rd Gen AMD Epyc Processor, Highlighting Code Name 'Milan' Weather Research And Forecast Model | AMD Issues 2 Press Releases Highlighting Topics Discussed By CEO Lisa Su During CES Keynote Presentation | 10 Information Technology Stocks Showing Unusual Options Activity In Today's Session | Option Trader Bets $2M On Advanced Micro Devices Following CES Presentation | Will Micron Stock Reach $200 By 2022?"
AMD,2021-01-13,"AMD, Dell Shares Move Lower After CNBC Reports VMWare CEO To Replace Intel CEO | Why Advanced Micro Devices's Stock is Down During Today's Session | Intel Shares Hit 6-Month High As Chipmaker Replaces CEO Bob Swan With VMware's Gelsinger | 'CES has blessed us with a three-webcam laptop' -Engadget | 10 Information Technology Stocks Showing Unusual Options Activity In Today's Session | Qualcomm To Buy Startup Nuvia In $1.4B Deal: What Investors Need To Know | AMD To Report Q4 Earnings On Tuesday, Jan. 26, 2021 After Market Close"
AMD,2021-01-14,"Why Cramer Sees Intel Shakeup As A Buy Opportunity In Rival Chipmaker | BMO Capital Downgrades Advanced Micro Devices to Underperform, Announces $75 Price Target | Why Cramer Sees Intel Shakeup As A Buy Opportunity In Rival Chipmaker | BMO Capital Downgrades Advanced Micro Devices to Underperform, Announces $75 Price Target | Benzinga's Top Ratings Upgrades, Downgrades For January 14, 2021 | 4 Intel Analysts On What New CEO Means For Chipmaker's Market Share, Turnaround | Cowen & Co. Maintains Outperform on Advanced Micro Devices, Raises Price Target to $110 | Jon Najarian Sees Unusual Option Activity In Intel | Why Intel's CEO Transition Is A Negative For AMD: Analyst"
AMD,2021-01-15,10 Information Technology Stocks With Unusual Options Alerts In Today's Session
AMD,2021-01-16,"Benzinga's Weekly Bulls And Bears: AMD, Marathon, Tesla, Uber, Walgreens And More"
AMD,2021-01-19,This Week Will Be About More Than Inauguration Day Alone | ROCE Insights For Advanced Micro Devices | 10 Information Technology Stocks With Unusual Options Alerts In Today's Session | 4 Key Trends That Could Shake Up Semiconductor Stocks In 2021
AMD,2021-01-20,10 Information Technology Stocks With Unusual Options Alerts In Today's Session
AMD,2021-01-21,"Benzinga Pro's Top 5 Stocks To Watch For Thursday, Jan. 21, 2021: AMD, INFI, BATT, FSRV, FTOC | Jim Cramer Discusses Procter & Gamble, Intel And Cautions On SPACs | AMD, NVIDIA Shares At New Session Highs Following Report Of Intel Q4 Earnings Leak Showing Beat, Strong FY21 Guidance | Intel Reports Q4 Earnings Beat"
AMD,2021-01-22,10 Information Technology Stocks Showing Unusual Options Activity In Today's Session | 8 Intel Analysts On Q4 Report: Why Some See Difficult Years Ahead For Chipmaker
AMD,2021-01-24,"Here's How Much Investing $1,000 In Intel Stock 5 Years Ago Would Be Worth Today"
AMD,2021-01-25,"Earnings Preview for Advanced Micro Devices | RBC Capital Maintains Outperform on Advanced Micro Devices, Raises Price Target to $105 | 10 Information Technology Stocks Showing Unusual Options Activity In Today's Session | This Earnings Week Will Be A Busy One"
AMD,2021-01-26,"Earnings Scheduled For January 26, 2021 | Ethereum, Dogecoin And Other Cryptocurrencies You Can 'Create' Using You Laptop | AMD: What The Street Is Saying Ahead Of Chipmaker's Q4 Print | 10 Information Technology Stocks Showing Unusual Options Activity In Today's Session | Advanced Micro Devices Q4 Adj. EPS $0.52 Beats $0.47 Estimate, Sales $3.24B Beat $3.02B Estimate | AMD Sees Q1 Sales $3.1B-$3.3B vs $2.73B Est. | Advanced Micro Devices: Q4 Earnings Insights | AMD Blows Away Q4 Estimates On Broad-Based Strength, Issues Upbeat Guidance | AMC Expects Gaming Console Chip Sales To Be Above Normal Seasonal Levels In First Quarter On Strong Demand; Says Is 'On Track' To Release 'Milan' Server CPU Chip In March"
AMD,2021-01-27,"A Peek Into The Markets: US Stock Futures Mixed; Microsoft Beats Q2 Estimates | Rosenblatt Maintains Buy on Advanced Micro Devices, Raises Price Target to $135 | Why Intel Is Injecting $475M More Into Vietnamese Chip Assembly Unit | 10 Information Technology Stocks With Unusual Options Alerts In Today's Session | JP Morgan Maintains Neutral on Advanced Micro Devices, Raises Price Target to $100 | Loop Capital Maintains Buy on Advanced Micro Devices, Raises Price Target to $115 | Mizuho Maintains Buy on Advanced Micro Devices, Raises Price Target to $105 | Truist Securities Maintains Hold on Advanced Micro Devices, Raises Price Target to $170 | CORRECTION: Deutsche Bank Maintains Hold on Advanced Micro Devices, Raises Price Target to $170 | 3 AMD Analysts Dissect Chipmaker's Q4 Earnings, Guidance Beat | Top 20 Trending Stocks On WallStreetBets For Wednesday, Jan. 27, 2020 (Via Swaggy Stocks) | Will AMD, Nvidia Or Intel Stock Grow The Most By 2022?"
AMD,2021-01-28,"Top 20 Trending Stocks On WallStreetBets As Of Thursday, Jan. 28, 2020 (Via Swaggy Stocks) | 10 Information Technology Stocks Showing Unusual Options Activity In Today's Session | 'Chipmakers reallocate wafer capacity to ease global chip shortage for vehicles' -Global Times"
AMD,2021-01-29,"Top 20 Trending Stocks On WallStreetBets As Of Friday, Jan. 29, 2021 (Via Swaggy Stocks) | Top 20 Trending Stocks On WallStreetBets As Of Friday, Jan. 29, 2021 (Via Swaggy Stocks) | Robinhood Limited Securities (Link To Full List) | Robinhood List Of Limited Securities (Link) | Robinhood Updates Limitations For Stock Trading"
AMD,2021-02-01,"Tesla, Charles Schwab â€” Stocks NYSRTS, One Of US' 10 Largest Pension Funds, Purchased In Q4 | Semiconductor Industry Association Reports Chip Sales Rose 6.5% Globally in 2020 | Top 20 Trending Stocks On WallStreetBets As Of Monday, Feb. 1, 2021 (Via Swaggy Stocks) | 10 Information Technology Stocks Showing Unusual Options Activity In Today's Session"
AMD,2021-02-02,"Top 20 Trending Stocks On WallStreetBets As Of Tuesday, Feb. 2, 2021 (Via Swaggy Stocks) | 10 Information Technology Stocks With Unusual Options Alerts In Today's Session | Cramer Tweets 'I like that $AMD is making a comeback'"
AMD,2021-02-03,"ROCE Insights For Advanced Micro Devices | Top 20 Trending Stocks On WallStreetBets As Of Wednesday, Feb. 3, 2021 (Via Swaggy Stocks) | 10 Information Technology Stocks With Unusual Options Alerts In Today's Session"
AMD,2021-02-04,"Top 20 Trending Stocks On WallStreetBets As Of Thursday, Feb. 4, 2021 (Via Swaggy Stocks)"
AMD,2021-02-05,"Top 20 Trending Stocks On WallStreetBets As Of Friday, Feb. 5, 2021 (Via Swaggy Stocks) | 10 Information Technology Stocks Showing Unusual Options Activity In Today's Session"
AMD,2021-02-06,"Should Microsoft Try To Acquire AMD, Nvidia or Micron In 2021?"
AMD,2021-02-08,"Top 20 Trending Stocks On WallStreetBets As Of Monday, Feb. 8, 2021 (Via Swaggy Stocks) | 10 Information Technology Stocks With Unusual Options Alerts In Today's Session | CNBC's Halftime Report Final Trades: Yum China, Advanced Micro Devices, Ethereum, Financial SPDR | 'Halftime Report' Picks For February 8: AMD, Yum China And More"
AMD,2021-02-09,"Top 20 Trending Stocks On WallStreetBets As Of Tuesday, Feb. 9, 2021 (Via Swaggy Stocks) | Cramer Gives His Opinion On AMD, Alibaba And More | UPDATE: Intel, AMD Shares Move Lower On Intel Chip Delay Report | UPDATE: AMD Shares Move Sharply Higher After Intel Chip Shortage Report | 10 Information Technology Stocks Showing Unusual Options Activity In Today's Session | 3 Reasons Why BofA Says Intel's Earnings Potential Is Limited"
AMD,2021-02-10,"Top 20 Trending Stocks On WallStreetBets As Of Wednesday, Feb. 10, 2021 (Via Swaggy Stocks) | 10 Information Technology Stocks With Unusual Options Alerts In Today's Session"
AMD,2021-02-11,"Top 20 Trending Stocks On WallStreetBets As Of Thursday, Feb. 11, 2021 (Via Swaggy Stocks) | US Chip Companies Seek President Biden's Assistance To Tide Through Semiconductor Crisis: Reuters | 10 Information Technology Stocks With Unusual Options Alerts In Today's Session"
AMD,2021-02-12,"Top 20 Trending Stocks On WallStreetBets As Of Friday, Feb. 12, 2021 (Via Swaggy Stocks) | On CNBC: Market Rebellion Co-Founder Pete Najarian Highlights Purchase Of Advanced Micro Devices, Says Thinks 'There Is Opportunity There'; Notes Out Performance Of Intel, Says Advanced Micro Devices Is Under Priced At These Levels | 10 Information Technology Stocks Showing Unusual Options Activity In Today's Session"
AMD,2021-02-16,"Top 20 Trending Stocks On WallStreetBets As Of Tuesday, Feb. 16, 2021 (Via Swaggy Stocks) | Analyzing Advanced Micro Devices's Unusual Options Activity | 10 Information Technology Stocks Showing Unusual Options Activity In Today's Session | 'Halftime Report' Traders Share Their Thoughts On Air Products & Chemicals, Airbnb And More"
AMD,2021-02-17,"Top 20 Trending Stocks On WallStreetBets As Of Wednesday, Feb.17, 2021 (Via Swaggy Stocks)"
AMD,2021-02-18,"Top 20 Trending Stocks On WallStreetBets As Of Thursday, Feb. 18, 2021 (Via Swaggy Stocks) | 10 Information Technology Stocks Showing Unusual Options Activity In Today's Session | Nvidia's New Ethereum Mining Chip: What You Need To Know"
AMD,2021-02-19,"Top 20 Trending Stocks On WallStreetBets As Of Friday, Feb. 19, 2021 (Via Swaggy Stocks)"
AMD,2021-02-22,"Apple Supplier Foxconn Expects 'Limited Impact' From Chip Crisis: Reuters | Top 20 Trending Stocks On WallStreetBets As Of Monday, Feb. 22, 2021 (Via Swaggy Stocks) | Taiwan Assures Support For US Auto Chip Shortage: Reuters | 10 Information Technology Stocks Showing Unusual Options Activity In Today's Session"
AMD,2021-02-23,"Top 20 Trending Stocks On WallStreetBets As Of Tuesday, Feb. 23, 2021 (Via Swaggy Stocks) | Top 20 Trending Stocks On WallStreetBets As Of Tuesday, Feb. 23, 2021 (Via Swaggy Stocks) | 10 Information Technology Stocks With Unusual Options Alerts In Today's Session"
AMD,2021-02-24,"Top 20 Trending Stocks On WallStreetBets As Of Wednesday, Feb. 24, 2021 (Via Swaggy Stocks) | Biden's Set To Sign Executive Order To Chip Shortages, Supply-Chain Crisis: WSJ | Joseph Terranova On CNBC Says Sold AMD, Said Sold For Risk Management | Joseph Terranova On CNBC Says Doesn't Have To Get Back Into AMD, Says Has Semiconductor Exposure Elsewhere, Cites Teradyne | 10 Information Technology Stocks With Unusual Options Alerts In Today's Session"
AMD,2021-02-25,"Nvidia Raked In $100-300M From Ethereum Miners In Q4 Amid GPU Supply Crunch | Top 20 Trending Stocks On WallStreetBets As Of Thursday, Feb. 25, 2021 (Via Swaggy Stocks) | Biden Seeks $37B In Congress Funding To Counter Chip Crisis: Reuters | Cramer Gives His Opinion On Enphase Energy, Advanced Micro Devices, More | 10 Information Technology Stocks With Unusual Options Alerts In Today's Session"
AMD,2021-02-26,"Top 20 Trending Stocks On WallStreetBets As Of Friday, Feb. 26, 2021 (Via Swaggy Stocks) | Understanding Advanced Micro Devices's Unusual Options Activity | 10 Information Technology Stocks With Unusual Options Alerts In Today's Session"
AMD,2021-03-01,"Top 20 Trending Stocks On WallStreetBets As Of Monday, March 1, 2021 (Via Swaggy Stocks) | 10 Information Technology Stocks With Unusual Options Alerts In Today's Session"
AMD,2021-03-02,"Can You Mine Ethereum With PlayStation 5? Here's What You Should Know | Top 20 Trending Stocks On WallStreetBets As Of Tuesday, Mar. 2, 2021 (Via Swaggy Stocks) | What To Know About Dave Portnoy And The New BUZZ Social Media Sentiment ETF"
AMD,2021-03-03,"Top 20 Trending Stocks On WallStreetBets As Of Wednesday, Mar. 3, 2021 (Via Swaggy Stocks) | AMD Highlights Introduction Of AMD Radeon RX 6700 XT Graphics Card | 10 Information Technology Stocks Showing Unusual Options Activity In Today's Session | AMD Launches New Graphics Card For Gaming Market: What You Need to Know"
AMD,2021-03-04,"Thinking About Buying Stock In Disney, Ford, GM Or AMD? | Top 20 Trending Stocks On WallStreetBets As Of Thursday, Mar. 4, 2021 (Via Swaggy Stocks)"
