Ticker,Date,headline
AMD,2023-12-07,"MicroAlgo, AMD, Chewy, Broadcom, Tesla: Why These 5 Stocks Are On Investors' Radars Today | Raymond James Maintains Strong Buy on Advanced Micro Devices, Raises Price Target to $140 | Wall Street Futures Steady, Big Tech Advances On AI, Yen Roars, Bitcoin Drops 1% Following Jamie Dimon's Concerns | Why Is AMD Stock Trading Higher Thursday? | Top 10 Trending Stocks On WallStreetBets As Of December 7, 2023 (Via Swaggy Stocks) | AMD shares are trading higher after Raymond James maintained a Strong Buy on the stock and raised its price target from $125 to $140. | 10 Information Technology Stocks With Whale Alerts In Today's Session | CNBC Halftime Report Final Trades: AbbVie, Advanced Micro Devices | Stifel Reiterates Buy on Advanced Micro Devices, Maintains $145 Price Target | What's Going On With Nvidia Stock Thursday? | Wall Street Revels In Gains As AI, Tech Titans Surge; Dollar Plunges Against Yen: What's Driving Markets Thursday? | Advanced Micro Devices Projects $45B AI Chip Market In 2023: Analysts Say Chipmaker 'Maturing Fast' After GPU Launch"
AMD,2023-12-08,"AMD, Broadcom, Lululemon, Google Parent Alphabet, Tesla: Why These Five Stocks Are On Investors' Radars Today | AMD's David McAfee Says AI Is Going To Be Transformational For PC Experience As The Mouse Was | What's Going On With Nvidia Stock Friday? | Index Futures Fall, Dollar Rallies As Labor Market Strength Dampens Fed Rate Cut Speculation | Top 10 Trending Stocks On WallStreetBets As Of December 8, 2023 (Via Swaggy Stocks) | What's Going On With Advanced Micro Devices Stock? | 10 Information Technology Stocks With Whale Alerts In Today's Session | Stock Market Inches Higher, AI Race Heats Up, Jamie Dimon Slams Bitcoin: The Week In The Markets"
AMD,2023-12-11,"Nvidia Faces Fierce Competition in China, Tencent and Huawei Lead the Charge | All The Major Highlights From The Global Markets You Need Heading Into The Week Of December 11th, 2023 | 10 Information Technology Stocks With Whale Alerts In Today's Session | What's Going On With AMD Stock Monday? | Nvidia Recovers From 10% Drop Amidst Intense Rivalry With AMD's Groundbreaking AI Chip | AMD Is Set To Challenge Nvidia's Dominance And Amazon Is Going After Microsoft's Early-Start AI Advantage | Nvidia Faces Fierce Competition in China, Tencent and Huawei Lead the Charge | All The Major Highlights From The Global Markets You Need Heading Into The Week Of December 11th, 2023 | 10 Information Technology Stocks With Whale Alerts In Today's Session | What's Going On With AMD Stock Monday? | Nvidia Recovers From 10% Drop Amidst Intense Rivalry With AMD's Groundbreaking AI Chip | AMD Is Set To Challenge Nvidia's Dominance And Amazon Is Going After Microsoft's Early-Start AI Advantage"
AMD,2023-12-12,"$1000 Invested In Advanced Micro Devices 5 Years Ago Would Be Worth This Much Today | AMD Stock Has Gained 14% In The Last 5 Days - What's Going On | 10 Information Technology Stocks With Whale Alerts In Today's Session | WallStreetBets Sets Sights On Tech: What Retail Traders Are Targeting Tuesday | What Happened With Broadcom Stock? | China Outmaneuvers Trade Restrictions, Forges Ahead In Semiconductor Race Say Experts"
AMD,2023-12-13,"Top 10 Trending Stocks On WallStreetBets As Of December 13, 2023 (Via Swaggy Stocks) | Fed Pivot Or Pushback? Markets Poised For Tense Policy Finale To 2023 | Oracle's Latest Results Show Cloud Slowdown Despite Expansion Efforts | What's Going On With Nvidia Stock Wednesday? | 10 Information Technology Stocks With Whale Alerts In Today's Session"
AMD,2023-12-14,What's Going On With Intel Stock Thursday? | 10 Information Technology Stocks Whale Activity In Today's Session | What's Going On With AMD Stock Thursday?
AMD,2023-12-15,"B of A Securities Upgrades Advanced Micro Devices to Buy, Announces $165 Price Target | Analyst Ratings for Advanced Micro Devices | Why Is Nvidia Stock Trading Higher Friday? | Artificial Intelligence ETF Holders Are 37% Richer: But Regulators See 'Emerging Threat' To Stability"
AMD,2023-12-16,"Nvidia Stock Remains A Bargain Despite More Than Tripling In 2023, Says Bernstein Analyst: 'Cheapest AI Play'"
AMD,2023-12-18,"Goldman Sachs Maintains Buy on Advanced Micro Devices, Raises Price Target to $157 | Spotlight on Advanced Micro Devices: Analyzing the Surge in Options Activity | AMD's Rising Star - What's Behind Goldman Sachs' Surprising Price Target Increase?"
AMD,2023-12-19,"Emerging AI Trends In 2024: BlackRock Sees Shift Beyond Semiconductors, Cloud To Model Infrastructure | Market Analysis: Advanced Micro Devices And Competitors In Semiconductors &amp; Semiconductor Equipment Industry | 10 Information Technology Stocks Whale Activity In Today's Session | AMD Recommends Rejection Of $123.45 Per Share Below-Market Mini-Tender Offer From TRC Capital Investment"
AMD,2023-12-21,"$100 Invested In Advanced Micro Devices 20 Years Ago Would Be Worth This Much Today | 10 Information Technology Stocks With Whale Alerts In Today's Session | Analysts Eye AMD and Nvidia's AI Rivalry: Who Leads the Tech Race? | US Stocks Bounce; Chipmakers, Cruise Lines Lead, Dollar Falls: What's Driving Markets Thursday?"
AMD,2023-12-22,Spotlight on Advanced Micro Devices: Analyzing the Surge in Options Activity | SPDR S&P 500 ETF Registers Record Fund Flows Heading Into Santa Claus Rally | 10 Information Technology Stocks Whale Activity In Today's Session
AMD,2023-12-23,Tech Giants In Talks: Synopsys Reportedly Aims For Blockbuster Acquisition Of Ansys In 2024
AMD,2023-12-25,10 Information Technology Stocks With Whale Alerts In Today's Session
AMD,2023-12-26,"Nvidia On Track To Topple Samsung, Intel As Biggest Chipmaker By Revenue; Will The Momentum Continue In 2024? | What's Going On With Nvidia Stock Tuesday? | Nvidia Stock Near All-Time High Yet Indicators Are Mixed â€” All Eyes On 2024 | What's Going On With AMD Stock Tuesday? | Semiconductor Stocks Soar To All-Time Highs: On Track For Strongest Year Since 2008, But Are They Too Expensive Now? | 10 Information Technology Stocks Whale Activity In Today's Session | EVs Outrank AI Among Top Revenue Drivers For Semiconductor Industry In 2024: Survey"
AMD,2023-12-27,"Top 10 Trending Stocks On WallStreetBets As Of December 27, 2023 (Via Swaggy Stocks) | What's Going On With AMD Stock Wednesday? | Top 10 Trending Stocks On WallStreetBets As Of December 27, 2023 (Via Swaggy Stocks) | What's Going On With AMD Stock Wednesday? | ""AMD Starts Prep Work For Zen 5 CPUs â€” Multiple Linux Patches Signal Zen 5's Upcoming Arrival"" - Tom'sHardware | 10 Information Technology Stocks Whale Activity In Today's Session"
AMD,2023-12-28,"Cathie Wood's Ark Invest Buys Over $92M Worth Of ProShares Bitcoin ETF, Sells Coinbase, Block And Palantir Shares | Nvidia, AI and 2023 - What Went Down? | Nasdaq 100 Eyes Best Year Since Dot-Com Boom: AI, Fed's Pivot Behind Tech's Stunning Revival | What's Going On With AMD Stock? | 10 Information Technology Stocks Whale Activity In Today's Session | S&P 500 Inches Higher, Small-Cap Rally Stalls, Bitcoin Sinks: What's Driving Markets Thursday? | EXCLUSIVE: Marc Chaikin Bullish On AI-Enhanced Software Companies, Forecasts S&P 500 Rally To Continue Into 2024 | S&P 500 Eyes 9th Week Of Gains, Longest Streak In 2 Decades: Stocks Leading The Rally"
AMD,2023-12-29,What's Going On With AMD Stock Friday? | 10 Information Technology Stocks Whale Activity In Today's Session
AMD,2023-12-30,"2023's Top Dogs: Nvidia, Meta Lead S&P 500 Charge In Tumultuous Year â€” But Which 'Magnificent Seven' Stock Will Be 2024's Runaway Winner?"
AMD,2024-01-02,"Is Modern AI The Legacy Of Quake? This Machine Learning Expert Thinks So | Why Are Nvidia And AMD Stock Trading Lower Tuesday? | Investigating Advanced Micro Devices's Standing In Semiconductors &amp; Semiconductor Equipment Industry Compared To Competitors | Semiconductor Stocks Tumble, Wiping Out $100 Billion Amid US-China Trade Tensions: Rocky Start To 2024 | 10 Best Stock Traders In Congress In 2023 (Spoiler: Nancy Pelosi Has Reentered The Chat)"
AMD,2024-01-03,"Top 10 Trending Stocks On WallStreetBets As Of January 3, 2024 (Via Swaggy Stocks) | A Glitch In The Rally? Cruise Operators And Chip Stocks Targeted In Profit Taking | Why Are Nvidia And AMD Stock Trading Lower Wednesday? | AI's 2024 Reality Check: Facing 'Peak AI Hype,' It's Time To Prove Its Worth | 10 Information Technology Stocks With Whale Alerts In Today's Session | Chip Stocks At 'Premium Valuations': Why Bank Of America Is Bullish On Semiconductors In 2024"
AMD,2024-01-04,"US Chip Giants AMD, NVIDIA, Qualcomm Start 2024 With Decline After Stellar Performance Last Year | AMD To Unleash Full Prowess This Year? Analyst Sees 25% Upside Potential For Stock On 'GenAI' Boost | Keybanc Maintains Overweight on Advanced Micro Devices, Raises Price Target to $170 | Nasdaq, S&P 500 Futures Waver As Hawkish Fed Minutes Leave Investors Data-Watching: Analyst Thinks Weak Santa Claus Rally Signals 'Potential Warning' | AMD To Rally Over 25%? Here Are 10 Top Analyst Forecasts For Thursday | AMD Reshapes Automotive Industry With Advanced AI Engines And Elevated In-Vehicle Experiences At CES 2024 | Morgan Stanley Wealth Management Adds Position In Spotify Technology SA; Increases Position In NVIDIA Corp; Reducing Position In Advanced Micro Devices | What's Going On With Nvidia Stock Thursday? | 10 Information Technology Stocks With Whale Alerts In Today's Session | AMD Unveils Future of Driving at CES 2024 with AI-Enhanced Processors | Nasdaq 100 Marks Fifth Consecutive Negative Session In Worst Tech Stock Downturn In Nearly 14 Months"
AMD,2024-01-05,"Advanced Micro Devices Unusual Options Activity | AMD Rethinks GPU Release in China - What's Going On? | 10 Information Technology Stocks Whale Activity In Today's Session | Mizuho Maintains Buy on Advanced Micro Devices, Raises Price Target to $162 | US Stocks Attempt Rebound, Bonds Falter, Regional Banks Rise: What's Driving Markets Friday? | Nvidia Prepares to Reveal New Graphics Cards - What's Next for Gamers?"
AMD,2024-01-08,"Melius Research Upgrades Advanced Micro Devices to Buy, Maintains $188 Price Target | A Closer Look at 17 Analyst Recommendations For Advanced Micro Devices | AMD Unveils AMD Radeon RX 7600 XT Graphics Card, Incredible Gaming At 1080p And Beyond For Under $350 | AMD Reveals Next-Gen Desktop Processors For Extreme PC Gaming And Creator Performance | Why Is AMD Stock Trading Higher Monday? | Semiconductor Supply In Automotive Industry Has Caught Up With Demand, AMD and Nvidia Set for Prominent AI and Automotive Role: Analyst"
AMD,2024-01-09,"Top 10 Trending Stocks On WallStreetBets As Of January 9, 2024 (Via Swaggy Stocks) | Top 10 Trending Stocks On WallStreetBets As Of January 9, 2024 (Via Swaggy Stocks) | 320% Profits â€” Nvidia Breaks Out, Reigniting AI Frenzy Ahead Of Inflation Data | US Stocks Rebound, Semiconductors Shine, Boeing's Struggles Weigh On Dow: What's Driving Markets Monday? | Stocks Flip To Losses, Nvidia Defies Gravity, Bitcoin Pauses For A Breather: What's Driving Markets Tuesday?"
AMD,2024-01-10,"Taiwan Semiconductor Q4 Sales Beats Estimates As AI Demand Offsets Chip Shortage: Report | Top 10 Trending Stocks On WallStreetBets As Of January 10, 2024 (Via Swaggy Stocks) | Major Risk To The Stock Market In Four Days - Smart Money Paying Attention But Momo Crowd Oblivious | Semiconductor Industry Association On Tuesday Reported Global Semiconductor Sales Rose 5.3% YoY November, Totaling $48B | 10 Information Technology Stocks With Whale Alerts In Today's Session"
AMD,2024-01-11,"Advanced Micro Devices's Options Frenzy: What You Need to Know | Nvidia Leads AI Chip Rivalry with New GPUs, While AMD and Intel Bet Big on AI PCs | 10 Information Technology Stocks Whale Activity In Today's Session"
AMD,2024-01-12,"$100 Invested In This Stock 20 Years Ago Would Be Worth $800 Today | Qualcomm Gets Citi Upgrade, Stock In Green Pre-Market; Nvidia, AMD, Intel Trade In Red"
AMD,2024-01-15,10 Information Technology Stocks Whale Activity In Today's Session
AMD,2024-01-16,"Keybanc Maintains Overweight on Advanced Micro Devices, Raises Price Target to $195 | Nvidia, AMD Shares Offer Over 30% Upside Potential, Analyst Says Ahead Of Earnings: What's Driving The Chip Optimism? | Investigating Advanced Micro Devices's Standing In Semiconductors &amp; Semiconductor Equipment Industry Compared To Competitors | Barclays Maintains Overweight on Advanced Micro Devices, Raises Price Target to $200 | 10 Information Technology Stocks With Whale Alerts In Today's Session | US Stocks Drift Lower As Dollar, Treasury Yields Rise, AMD Defies Gravity: What's Driving Markets Tuesday? | CES 2023 Sparks Analyst Optimism: Nvidia Leads with AI Innovation, Market on Positive Trend"
AMD,2024-01-17,"Trump-Linked SPAC-Firm Digital World, AMD, Spirit Airlines, Alibaba, Tesla: Why These 5 Stocks Are On Investors' Radars Today | Taiwan Semiconductor Q4 Earnings Preview: Geopolitical Waves, Intel's Challenge, Valuation Signals | Top 10 Trending Stocks On WallStreetBets As Of January 17, 2024 (Via Swaggy Stocks) | 'AI Revolution' Key Narrative For Q4 Tech Earnings, Says Analyst, As He Flags A 'Glaring Positive' That Can Mitigate Bears' Valuation Concerns | 10 Information Technology Stocks Whale Activity In Today's Session"
AMD,2024-01-18,"Nvidia Is Cheapest Route To Invest In AI, Says Bernstein Analyst, After Stock Triples In A Year | Tesla Loses Most-Shorted Crown To This 'Magnificent 7' Stock As EV Giant's Skeptics Take $13B Hit In 2023 | Nasdaq Futures Surge As TSMC Sets Positive Tone To Tech Earnings Season: Analyst Cautions New Bull Market Needs 'Heavier Lifting' | Jim Cramer Predicts Tesla 'Would Be First To Fall' From 'Magnificent 7' Stock Group: 'We Have A CEO Getting A Little Petulant...Again' | Top 10 Trending Stocks On WallStreetBets As Of January 18, 2024 (Via Swaggy Stocks) | Intel Gains Ground in EU Antitrust Case with Court Backing Against Billion-Euro Fine | Why Are Nvidia And AMD Stocks Trading Higher Thursday? | 10 Information Technology Stocks With Whale Alerts In Today's Session | AI Drives Tech Rebound, Oil Soars, Bitcoin Tumbles: What's Driving Markets Thursday? | EXCLUSIVE: The 'Buy Everything' Market Is Over: Synopsys-Ansys Merger Provides Fertile Ground For This Stock Picker"
AMD,2024-01-19,"Wall Street Set To Build On Tech-Driven Rally, S&P 500 Eyes All-Time High: Analyst Points To 'Contrarian Signal' For Buying Stocks | Why Is Nvidia Stock Trading Higher Friday? | Top 10 Trending Stocks On WallStreetBets As Of January 19, 2024 (Via Swaggy Stocks) | Here's Why Nvidia, AMD, Uber, Visa And Costco Investors Are Celebrating | AI Stocks Dominate In January: Nvidia, Juniper, Palo Alto Lead The Charge | Raymond James Maintains Strong Buy on Advanced Micro Devices, Raises Price Target to $190 | Why AMD Stock Hit A New All-Time High This Week | 10 Information Technology Stocks Whale Activity In Today's Session | S&P 500 Index Reaches All-Time Highs: AI, Rate Cut Hopes Cement The Milestone | S&P 500 Shatters Records: The Top-Performing Stocks In January 2024"
AMD,2024-01-20,"Cathie Wood Buys $44M Worth Of Ark's Spot Bitcoin ETF This Week While Selling BITO, Trims This Chip Stock Amid Tech Strength"
AMD,2024-01-22,"Nvidia's Key Market China Wants To Beat US Embargo, Boosts Chipmaking Machinery Imports by 14% | Baby Bust: Will Falling Global Birth Rates Drive Markets Lower? | Nvidia's Key Market China Wants To Beat US Embargo, Boosts Chipmaking Machinery Imports by 14% | Baby Bust: Will Falling Global Birth Rates Drive Markets Lower? | Top 10 Trending Stocks On WallStreetBets As Of January 22, 2024 (Via Swaggy Stocks) | Northland Capital Markets Downgrades Advanced Micro Devices to Market Perform | Nvidia, AMD To Triumph Over Q4 Market Weakness With Cutting-Edge AI, Says Analyst: What To Expect From The Chipmakers | 10 Information Technology Stocks With Whale Alerts In Today's Session | S&P 500, Nasdaq, Dow Jones Strike All-Time Highs Ahead Of Key Earnings This Week: What's Driving Markets Monday? | Billionaire Investor Jim Breyer Still 'Pounding The Table' On Nvidia, AMD"
AMD,2024-01-23,"After 130% Surge, AMD Faces Uncertain Road Ahead: Top Analyst Says Chipmaker's Future Shrouded In Doubt | Cantor Fitzgerald Initiates Coverage On Advanced Micro Devices with Overweight Rating, Announces Price Target of $190 | Cathie Wood's Ark Invest Bucks Trend, Trims 2 Major Chip Stocks Ahead Of Q4 Results: Profit-Taking Or Portfolio Shift? | Top 10 Trending Stocks On WallStreetBets As Of January 23, 2024 (Via Swaggy Stocks) | 10 Information Technology Stocks With Whale Alerts In Today's Session | Nvidia Will Lead 2024 Double-Digit Semiconductor Stock Rally, Analysts Say | Let Bears Fret About Tech Valuations, Analyst Says: How AI Leaders Microsoft, Nvidia And Google Can Push Higher | Nvidia and AMD Rule The Charts - Here Are Other Semiconductor Plays That Analysts Root For | 'Data As The New Oil':  Semiconductors 'Catching Up' With GDP In 2024, Says Analyst"
AMD,2024-01-24,"New Street Research Upgrades Advanced Micro Devices to Buy, Announces $215 Price Target | AMD Shares Surge Premarket, Setting Sights On All-Time Highs: What's Powering Rally? | Intel Q4 Earnings Preview: Analysts Cautious For 2024, Envisions 'More-Clouded Picture' After Strong 2023 | Top 10 Trending Stocks On WallStreetBets As Of January 24, 2024 (Via Swaggy Stocks) | 10 Information Technology Stocks With Whale Alerts In Today's Session | Tech Giants Nvidia, AMD, IBM, Microsoft, Google Partner With US Government For AI Research Project"
AMD,2024-01-25,"Biden's Project To 'Democratize' Access To AI Research Gets Backing From Microsoft, OpenAI, Nvidia, Meta And Others | Top 10 Trending Stocks On WallStreetBets As Of January 25, 2024 (Via Swaggy Stocks) | Broadcom Stock Reaches Record Heights On Semiconductor, AI Boom: How High Do Analysts Expect It To Climb? | Live On CNBC, Josh Brown Announces Sold Advanced Micro Devices | Live On CNBC, Bill Baruch Announces Trimmed NVIDIA, Advanced Micro Devices Position | 10 Information Technology Stocks With Whale Alerts In Today's Session | What's Going On With AMD Stock Thursday? | UBS Maintains Buy on Advanced Micro Devices, Raises Price Target to $220"
AMD,2024-01-26,"Intel, Nvidia, AMD, Processa Pharmaceuticals, Tesla: Why These 5 Stocks Are On Investors' Radars Today | Here's How Much You Would Have Made Owning Advanced Micro Devices Stock In The Last 5 Years | Top 10 Trending Stocks On WallStreetBets As Of January 26, 2024 (Via Swaggy Stocks) | What's Going On With Nvidia and AMD Stocks Friday? | Stocks Ease Despite Benign Inflation Data, Bitcoin Stages Comeback: What's Driving Markets Friday?"
AMD,2024-01-27,"Elon Musk Says Tesla Will Buy Chips From AMD, Invest Over $500M On Nvidia Hardware | Benzinga Bulls And Bears: Apple, Tesla, Amazon And Dogecoin Will Hit 10 Cents On Hopes Of Musk's X Payment Integration, Says Analyst"
AMD,2024-01-28,"Musk Refuting xAI Funding Reports, Biden's AI Project, Apple's New Assistant, Deepfake Threats And More: This Week In AI"
AMD,2024-01-29,"Tech Titans Microsoft, Apple Lead 'Magnificent Seven' Earnings Wave This Week: Can Mega-Caps Ignite Market Optimism? | Why Semiconductor And Chip Stocks Are Trading Lower Today | US Stocks Set For Mixed Open As Traders Await Tech Earnings Deluge, Central Bank Meeting: Analyst Says Fed Will Talk Tough For While Longer | Top 10 Trending Stocks On WallStreetBets As Of January 29, 2024 (Via Swaggy Stocks) | Susquehanna Maintains Positive on Advanced Micro Devices, Raises Price Target to $210 | B of A Securities Maintains Buy on Advanced Micro Devices, Raises Price Target to $195 | Morgan Stanley Maintains Overweight on Advanced Micro Devices, Raises Price Target to $193 | Key To The Market Is Biden's Response To Killing Of U.S. Soldiers â€“ Optimism Over Tech Earnings | Is Nvidia's AI Dominance Slipping? Inside the Billion-Dollar Battle for AI Chip Market | This Analyst Boosts AMD Forecasts Despite Short-Term Hurdles, Eyes on M1300 Chip Guidance | 10 Information Technology Stocks Whale Activity In Today's Session | Tech Titans Microsoft, Apple Lead 'Magnificent Seven' Earnings Wave This Week: Can Mega-Caps Ignite Market Optimism? | Why Semiconductor And Chip Stocks Are Trading Lower Today | US Stocks Set For Mixed Open As Traders Await Tech Earnings Deluge, Central Bank Meeting: Analyst Says Fed Will Talk Tough For While Longer | Top 10 Trending Stocks On WallStreetBets As Of January 29, 2024 (Via Swaggy Stocks) | Susquehanna Maintains Positive on Advanced Micro Devices, Raises Price Target to $210 | B of A Securities Maintains Buy on Advanced Micro Devices, Raises Price Target to $195 | Morgan Stanley Maintains Overweight on Advanced Micro Devices, Raises Price Target to $193 | Key To The Market Is Biden's Response To Killing Of U.S. Soldiers â€“ Optimism Over Tech Earnings | Is Nvidia's AI Dominance Slipping? Inside the Billion-Dollar Battle for AI Chip Market | This Analyst Boosts AMD Forecasts Despite Short-Term Hurdles, Eyes on M1300 Chip Guidance | 10 Information Technology Stocks Whale Activity In Today's Session | Cantor Fitzgerald Reiterates Overweight on Advanced Micro Devices, Maintains $190 Price Target | US Stocks Rise At Week's Start, Tesla Rebounds, SoFi, Lucid Shine: What's Driving Markets Monday? | Semiconductor Earnings Are Mixed Bag, Analysts Say: 6 Companies In Spotlight, Including: Skyworks, AMD, Qualcomm"
AMD,2024-01-30,"Earnings Scheduled For January 30, 2024 | Raymond James Downgrades Advanced Micro Devices to Outperform, Raises Price Target to $195 | US Stocks Hold Steady Ahead Of Microsoft, Alphabet Earnings: Analyst Warns Of 'Big Air Pocket' In Pivotal Trading Week | AMD Analysts Spotlight Crucial 'Swing Factor' Ahead Of Q4 Earnings Amid Tough Chip Industry Conditions | AMD Snatches A Downgrade Ahead Of Q4 Results: What's Going On | Top 10 Trending Stocks On WallStreetBets As Of January 30, 2024 (Via Swaggy Stocks) | In-Depth Analysis: Advanced Micro Devices Versus Competitors In Semiconductors &amp; Semiconductor Equipment Industry | 10 Information Technology Stocks With Whale Alerts In Today's Session | Rosenblatt Reiterates Buy on Advanced Micro Devices, Maintains $200 Price Target | US Stocks Ease Ahead Of Key Tech Earnings, UPS Sinks, General Motors Rallies: What's Driving Markets Tuesday? | Advanced Micro Devices Q4 2023 Adj EPS $0.77, Inline, Sales $6.20B Beat $6.12B Estimate | AMD Sees Q1 Revenue $5.1B-$5.7B vs $5.28B Est. | AMD Q4 Data Center Segment Revenue Up 38% YoY, Client Segment Revenue Up 62% YoY, Gaming Segment Revenue Down 17% YoY, Embedded Segment Revenue Down 24% YoY | AMD Stock Slips After In-Line Q4: Lisa Su Touts 'Exciting Time' For Chipmaker Driven By AI"
