Ticker,Date,Cleaned_Headlines
META,2023-10-27,"['earnings calls embrace ai: how microsoft, alphabet, meta, amazon and intel are talking tech for growth', ""middle east unrest overshadowed meta's and snap's strong quarterly results"", ""meta, tiktok, and youtube race for e licenses after indonesia's social media sales ban"", ""meta's threads introduces polls and gifs, begins testing view counts, pinned posts""]"
META,2023-10-28,"['after lower sales of quest 2 led to loss at reality labs, meta reportedly cuts quest 3 shipment forecast by 5%']"
META,2023-10-30,"['cnbc halftime report final trades: alphabet, meta platforms, w.w. grainger', ""could open source have thwarted terminator's skynet? here's what meta's llama 2 ai thinks"", 'facebook parent meta stock gains after it rolls out ad options for adults, no ads for teens in europe']"
META,2023-10-31,"['meta platforms rolling out ad subscription in eu is a revenue strategy: citi', ""alphabet, meta platforms and an industrial parts provider: cnbc's 'final trades'"", 'market clubhouse morning memo - october 30th, 2023 (trade strategy for spy, qqq, aapl, msft, tsla, and meta)']"
META,2023-11-01,"['watching meta platforms; hearing investor business daily swingtrader buys stock', ""'eu regulator bans meta's use of personal data for behavioural advertising' - barron's"", ""jim cramer prefers caution despite impressive returns from 'the enormous eight' led by nvidia, meta: 'each one set up like bowling pins'""]"
META,2023-11-02,"['this is what whales are betting on meta platforms', 'meta platforms rolling out a reels a/b testing tool that allows creators to test different captions and thumbnails on mobile device']"
META,2023-11-03,"['market clubhouse morning memo - november 3rd, 2023 (trade strategy for spy, qqq, aapl, msft, meta, nvda, and tsla)', 'meta chief ai scientist slams overbearing ai regulations:']"
META,2023-11-04,"['meta ceo mark zuckerberg tore his acl while training for a competitive mma fight, undergoes surgery', 'tech behemoths bend to cma rules over online marketplace: meta to allow opt of data sharing, amazon to boost fair competition']"
META,2023-11-06,"['meta platforms', 'market clubhouse morning memo - november 6th, 2023 (trade strategy for spy, qqq, aapl, msft, tsla, nvda, and meta)', 'meta platforms testing a new invite holiday bonus on instagram for creators in the u.s., south korea and japan; on facebook, adding more ways for followers to subscribe via reels and stories', ""here's how much $1000 invested in meta platforms 10 years ago would be worth today"", ""former google china president's startup 0.1ai hits $1b valuation, outperforms meta's llama 2""]"
META,2023-11-07,"['cnbc final trades: csco, cmcsa, meta', 'market clubhouse morning memo - november 7th, 2023 (trade strategy for spy, qqq, aapl, msft, nvda, meta, and tsla)', ""the elections are coming, and there's a limit to using ai tools, meta"", ""meta's chief ai scientist once again slams ai regulation, compares it with brutal romanian dictator's ban on typewriters"", ""meta launches special bonus program to boost instagram creators' earnings"", 'meta to bar political advertisers from using generative ai ads tools', 'amd ceo lisa su expects $1b in mi300 sales: microsoft, meta, oracle, google, amazon placing orders?']"
META,2023-11-08,"[""meta, cisco, comcast and more: cnbc's 'final trades'"", 'market clubhouse morning memo - november 8th, 2023 (trade strategy for spy, qqq, aapl, msft, nvda, meta, and tsla)', 'live on cnbc, stephanie link announces bought more fortinet, meta platforms', ""meta platforms partners with hugging face, scaleway to boost ai startups in france's largest tech hub""]"
META,2023-11-09,"['market clubhouse morning memo - november 9th, 2023 (trade strategy for spy, qqq, aapl, msft, tsla, nvda, and meta)', 'check out what whales are doing with meta', ""zuckerberg stands accused of ignoring expert advice, meta's plastic surgery filters stay despite risks to youth mental health""]"
META,2023-11-10,"['market clubhouse morning memo - november 10th, 2023 (trade strategy for spy, qqq, aapl, msft, nvda, googl, tsla, and meta)', 'mark zuckerberg seals deal with tencent as meta gears up for chinese market return after 14 years with affordable vr headset: report']"
META,2023-11-11,"['meta unveils ad facebook and instagram in europe amid new privacy laws', ""barron's weekend stock picks: tesla, li auto and meta is back in china""]"
META,2023-11-13,"['market clubhouse morning memo - november 13th, 2023 (trade strategy for spy, qqq, aapl, msft, googl, meta, nvda, and tsla)']"
META,2023-11-14,"['stifel reiterates buy on meta platforms, maintains $405 price target', 'judge rejects efforts by alphabet, bytedance, meta platforms, snap to dismiss litigation over alleged harms that children suffer from using social media', ""'bytedance revenue surges in second quarter, closing in on meta' - the information"", 'market clubhouse morning memo - november 14th, 2023 (trade strategy for spy, qqq, aapl, msft, googl, nvda, tsla, and meta)']"
META,2023-11-15,"['google, meta and social media ilk must address teen addiction allegations, judge', ""meta appeals against eu's designation of messenger, marketplace as 'gatekeepers' under digital markets act; will not challenge designations for facebook, instagram and whatsapp; to work constructively with european commission to prepare for compliance"", 'market clubhouse morning memo - november 15th, 2023 (trade strategy for spy, qqq, aapl, msft, nvda, meta, tsla, and googl)']"
META,2023-11-16,"[""long meta quest developer doesn't think zuckerberg's device will satisfy users who want the best: 'i think the quest is good for kids'"", 'market clubhouse morning memo - november 16th, 2023 (trade strategy for spy, qqq, aapl, msft, meta, nvda, googl, and tsla)', ""meta defies eu's digital markets act amidst soaring stock success - surging 9% for november""]"
META,2023-11-17,"['""meta\'s head of augmented reality software stepping down"" - reuters news']"
META,2023-11-20,"['meta platforms unusual options activity', 'market clubhouse morning memo - november 20th, 2023 (trade strategy for spy, qqq, aapl, msft, googl, tsla, meta, and nvda)', ""meta realigns strategy, disbands 'responsible ai' team""]"
META,2023-11-21,"['market clubhouse morning memo - november 21st, 2023 (trade strategy for spy, qqq, aapl, msft, nvda, googl, meta, and tsla)']"
META,2023-11-22,"[""decoding meta platforms's options activity: what's the big picture?"", 'tigress financial maintains strong buy on meta platforms, raises price target to $435', 'market clubhouse morning memo - november 22nd, 2023 (trade strategy for spy, qqq, aapl, msft, nvda, googl, meta, and tsla)', 'meta platforms stock at 52 high, still a strong buy?']"
META,2023-11-23,"[""democrats seek alternatives to elon musk's x amid controversies but shifting to mark zuckerberg's threads isn't easy either: 'they have ton of issues with meta'"", 'employees at these large companies are most satisfied with their pay packages: meta, alphabet (google) slipped in the rankings']"
META,2023-11-27,"[""are facebook and instagram underreporting harmful content? mark zuckerberg's meta faces more serious claims"", 'market clubhouse morning memo - november 27th, 2023 (trade strategy for spy, qqq, aapl, msft, nvda, meta, googl, and tsla)', ""what's going on with meta platforms monday?""]"
META,2023-11-28,"['market clubhouse morning memo - november 28th, 2023 (trade strategy for spy, qqq, aapl, msft, googl, nvda, tsla, and meta)', ""facebook parent meta's new privacy fee strategy faces backlash as it could set costly trend in app privacy"", 'facebook parent meta dealt legal blow as judge rejects appeal in ftc privacy dispute', ""meta's spokesperson, andy stone, becomes a target of russian interior ministry""]"
META,2023-11-29,"['meta platforms, x, tiktok, snap ceos to testify at jan. 31 senate hearing', 'meta enhances election safeguards for 2024 to tackle misinformation', 'market clubhouse morning memo - november 29th, 2023 (trade strategy for spy, qqq, aapl, msft, tsla, googl, nvda, and meta)']"
META,2023-11-30,"['market clubhouse morning memo - november 30th, 2023 (trade strategy for spy, qqq, aapl, msft, tsla, meta, googl, and nvda)', ""meta's metaverse ambitions hit a roadblock"", ""meta's threads set to enter eu market in december"", 'meta planning to launch threads in eu in december-', 'google, meta poach the most talent from other tech companies: 1 in 4 of their employees come from other tech giants']"
META,2023-12-01,"['market clubhouse morning memo - december 1st, 2023 (trade strategy for spy, qqq, aapl, msft, tsla, meta, googl, and nvda)', 'meta owned instagram and facebook plagued with pedophile networks and its algorithms are not helping: report']"
META,2023-12-04,"[""'the media grouped in ami sue meta for unfair competition and claim more than €550m' - ami"", 'market clubhouse morning memo - december 4th, 2023 (trade strategy for spy, qqq, aapl, msft, tsla, meta, googl, and nvda)', ""can apple's iphone 15 spark a tech rally? analyst eyes china growth"", 'apple, meta platforms and 2 other stocks insiders are selling', ""meta's ai chief definitely thinks we're overestimating potential of ai and quantum computing""]"
META,2023-12-05,"['meta platforms slapped with $600m lawsuit by spanish media group over unfair ad competition', 'meta, ibm and over 50 ai companies join forces in open ai advocacy initiative', 'meta unplugs cross chats between instagram and facebook messenger', 'market clubhouse morning memo - december 5th, 2023 (trade strategy for spy, qqq, aapl, msft, tsla, meta, googl, and nvda)']"
META,2023-12-06,"['meta expanding partnership to include instinct mi300x gpus in data centers', ""meta's stock plummets by 8% as ceo mark zuckerberg offloads $190 million in shares"", 'move aside, nvidia: meta, microsoft opt for new amd artificial intelligence chip', 'zuckerberg dumped $190m in meta stock, first sale since 2021 — a sign of things to come?', 'market clubhouse morning memo - december 6th, 2023 (trade strategy for spy, qqq, aapl, msft, tsla, meta, googl, and nvda)', ""behind the scenes of meta platforms's latest options trends"", 'meta platforms inc']"
META,2023-12-07,"['meta platforms', 'market clubhouse morning memo - december 7th, 2023 (trade strategy for spy, qqq, aapl, msft, nvda, tsla, googl, and meta)', 'microsoft (nasdaq: msft) vs. meta (nasdaq: meta) — analyzing $1,000 investments from may 18, 2012', ""'meta platforms releases more security guidelines for ai models introducing purple llama for safe and responsible ai development; purple llama will include tools and evaluations for cybersecurity and input/output safeguards' - axios"", 'the wall street journal reported late wednesday, meta to start fully encrypting messages on facebook and instagram', 'not to be left behind, meta launches new ai image generator to take on openai and microsoft']"
META,2023-12-08,"['in analysis: meta platforms versus competitors in interactive media &amp; services industry', ""meta introduces 'purple llama' project to encourage responsible ai use"", ""x? after musk's finger to bob iger, disney espn's nba insider woj lands on meta's threads""]"
META,2023-12-11,"['market clubhouse morning memo - december 11th, 2023 (trade strategy for spy, qqq, aapl, msft, nvda, tsla, googl, and meta)', 'meta rolls out new tagging feature for threads to tackle hashtag spams', ""meta's threads set to unveil in eu, will latest rollout revolutionize social media?""]"
META,2023-12-12,"[""here's how much $100 invested in meta platforms 10 years ago would be worth today"", 'cathie wood loads up on $9m worth of microsoft, meta and an evergreen chip stock: time to dip into tech shares?']"
META,2023-12-13,"[""meta's latest move - fact feature on threads ahead of major elections"", 'market clubhouse morning memo - december 13th, 2023 (trade strategy for spy, qqq, aapl, msft, tsla, nvda, meta, and googl)', ""google, meta, qualcomm: what's brewing behind their unseen tech coalition?""]"
META,2023-12-14,"[""threads app's european adventure - discover meta's latest interactive features"", 'market clubhouse morning memo - december 14th, 2023 (trade strategy for spy, qqq, aapl, msft, tsla, nvda, googl, and meta)']"
META,2023-12-15,"['market clubhouse morning memo - december 15th, 2023 (trade strategy for spy, qqq, aapl, msft, tsla, nvda, googl, and meta)']"
META,2023-12-18,"['market clubhouse morning memo - december 18th, 2023 (trade strategy for spy, qqq, aapl, msft, meta, nvda, tsla, and googl)']"
META,2023-12-19,"['dogecoin designer asks why no action against meta despite child sexual abuse allegations, elon musk responds…']"
META,2023-12-20,"['market clubhouse morning memo - december 20th, 2023 (trade strategy for spy, qqq, aapl, msft, tsla, nvda, googl, and meta)', ""is zuckerberg's meta blocking news on threads? software bug sparks concern among canadian users"", 'after meta, google limits bard and ai queries related to elections ahead of 2024 presidential race']"
META,2023-12-21,"[""zuckerberg's 'year of efficiency' drives meta stock to best year ever with eye 190% surge: what's next in 2024?"", 'market clubhouse morning memo - december 21st, 2023 (trade strategy for spy, qqq, aapl, msft, tsla, nvda, googl, and meta)']"
META,2023-12-22,"['market clubhouse morning memo - december 22nd, 2023 (trade strategy for spy, qqq, aapl, msft, tsla, nvda, googl, and meta)', ""microsoft axes windows 'mixed reality' feature as meta, apple continues to make headways"", ""cathie wood's ark invest buys tesla, meta shares amid market volatility — sells coinbase and grayscale bitcoin trust shares""]"
META,2023-12-26,"['apple app store data shows meta stole christmas, amazon enjoys strong holiday shopping trends', ""amazon echo frames vs. meta's ray: exploring the latest in smart glasses for everyday americans"", 'market clubhouse morning memo - december 26th, 2023 (trade strategy for spy, qqq, aapl, msft, googl, meta, tsla, and nvda)']"
META,2023-12-27,"[""meta's chief ai scientist yann lecun throws shade at openai,"", 'wedbush maintains outperform on meta platforms, raises price target to $420', 'meta to rally over 18%? here are 10 top analyst forecasts for wednesday', 'market clubhouse morning memo - december 27th, 2023 (trade strategy for spy, qqq, aapl, msft, googl, meta, tsla, and nvda)', 'amazon, meta, and google: analysts reveal unseen insights for 2024']"
META,2023-12-28,"[""here's why meta's chief ai scientist is not worried about open source ai being misused"", ""bitcoin generates buzz for riot platforms and microstrategy — meta, new york times, tesla also on investor's radars today"", ""meta's chief ai scientist calls openai a 'contract research house' for microsoft,"", 'market clubhouse morning memo - december 28th, 2023 (trade strategy for spy, qqq, aapl, msft, googl, meta, tsla, and nvda)']"
META,2023-12-29,"['hearing ibd swingtrader sells meta', 'market clubhouse morning memo - december 29th, 2023 (trade strategy for spy, qqq, aapl, msft, tsla, googl, meta, and nvda)']"
META,2023-12-30,"[""2023's top dogs: nvidia, meta lead s&p 500 charge in tumultuous year — but which 'magnificent seven' stock will be 2024's runaway winner?""]"
META,2024-01-02,"[""this analyst with 82% accuracy rate sees around 19% upside in meta platforms - here are 5 stock picks for last week from wall street's most accurate analysts"", ""meta's quest 2 vr headset gets a permanent price slash: dive into virtual reality for less"", 'market clubhouse morning memo - january 2nd, 2024 (trade strategy for spy, qqq, aapl, msft, tsla, googl, meta, and nvda)']"
META,2024-01-03,"[""satori fund's dan niles names amazon, meta top stocks to own in 2024"", 'market clubhouse morning memo - january 3rd, 2024 (trade strategy for spy, qqq, aapl, msft, tsla, googl, meta, and nvda)']"
META,2024-01-04,"['mark zuckerberg resumes massive stock sell, offloading almost $428m in meta shares since november', 'market clubhouse morning memo - january 4th, 2024 (trade strategy for spy, qqq, aapl, msft, tsla, googl, meta, and nvda)']"
META,2024-01-05,"['market clubhouse morning memo - january 5th, 2024 (trade strategy for spy, qqq, aapl, msft, tsla, googl, meta, and nvda)']"
META,2024-01-08,"['market clubhouse morning memo - january 8th, 2024 (trade strategy for spy, qqq, aapl, msft, meta, tsla, googl, and nvda)', ""apple's vision pro vs. meta's quest 3: virtual reality showdown"", ""this analyst with 82% accuracy rate sees around 19% upside in meta platforms - here are 5 stock picks for last week from wall street's most accurate analysts""]"
META,2024-01-09,"['bmo capital initiates coverage on meta platforms with market perform rating, announces price target of $397', 'market clubhouse morning memo - january 9th, 2024 (trade strategy for spy, qqq, aapl, msft, meta, tsla, googl, and nvda)', 'social media outlook for 2024: meta platforms faces uncertain growth while pinterest and snap shine in analyst ratings']"
META,2024-01-10,"['market clubhouse morning memo - january 10th, 2024 (trade strategy for spy, qqq, aapl, msft, meta, tsla, googl, and nvda)', ""meta's doja cat concert: could 'perfect way for fans' to feel like they're in the front row boost vr headset sales?"", 'mizuho maintains buy on meta platforms, raises price target to $470', ""meta ceo mark zuckerberg takes up 'most delicious' project of his life — raising cattle with macadamia nuts and beer for wagyu beef on $100m hawaii ranch"", 'meta employee claims she is being investigated after complaining about the suppression of pro content']"
META,2024-01-11,"['market clubhouse morning memo - january 11th, 2024 (trade strategy for spy, qqq, aapl, msft, meta, tsla, googl, and nvda)', 'mizuho maintains buy on meta platforms, raises price target to $470', 'meta under fire: walmart and match group slam company over ads next to underage sexual content', ""this analyst just bumped up facebook parent meta's price target by a significant margin - here's the reason for vote of confidence""]"
META,2024-01-12,"['market clubhouse morning memo - january 12th, 2024 (trade strategy for spy, qqq, aapl, msft, meta, tsla, googl, and nvda)', ""here's how much $1000 invested in meta platforms 10 years ago would be worth today"", 'meta offers $51m to resolve ads lawsuit with canadian facebook users in four provinces']"
META,2024-01-17,"['the analyst verdict: meta platforms in the eyes of 17 experts', 'piper sandler maintains overweight on meta platforms, raises price target to $415', ""'former chief operating officer sheryl sandberg to exit meta's board; will become an informal adviser to the company in may.' - axios"", 'meta ceo mark zuckerberg summoned to court in texas over alleged misuse of facial recognition']"
META,2024-01-18,"[""meta platforms' zuckerberg announces major ai initiatives: 7 things you need to know"", ""mark zuckerberg, meta accused of putting 'growth ahead of children's safety': unsealed new mexico lawsuit documents"", 'meta ceo mark zuckerberg', 'meta platforms ceo mark zuckerberg', ""meta's ai magic! ad returns reportedly soar 32% with breakthrough technology boost"", 'amazon, apple, meta, and other big tech companies receive data requests from eu']"
META,2024-01-19,"[""insights into meta platforms's performance versus peers in interactive media &amp; services sector"", ""meta platforms is wall street's top internet pick, analysts laud ai investments and advertising strength"", 'live on cnbc, stephanie link announces sold meta platforms', 'jmp securities maintains market outperform on meta platforms, raises price target to $410', ""what's going on with meta platforms stock?"", ""instagram axes technical managers in meta's efficiency drive, more organizations likely to follow suit: report"", ""mark zuckerberg hints at meta's nearly $9b investment in nvidia ai chips""]"
META,2024-01-20,"[""'not clear,' quips elon musk as tesla enthusiast questions meta's plan to buy nvidia's ai chips equivalent to 8 times tesla's computing needs""]"
META,2024-01-21,"[""from $200 device replacing iphone to mark zuckerberg's ai chips treasure: here's your ai weekly roundup""]"
META,2024-01-22,"['rbc capital reiterates outperform on meta platforms, maintains $400 price target']"
META,2024-01-23,"[""meta platforms' bright future: citi analyst predicts strong growth in ads, ai innovations"", ""maxine waters writes to mark zuckerberg, wants to know if meta is 'planning to launch a payments platform' that supports crypto""]"
META,2024-01-24,"['raymond james maintains strong buy on meta platforms, raises price target to $450', ""mark zuckerberg's meta's stiff stance on revenue sharing could cost billions to news publishers"", 'is your iphone 12 or m2 macbook air safe? apple confirms critical security flaw: report']"
META,2024-01-25,"['zuckerberg vs. musk: billionaire battle sees meta platforms rejoin $1 trillion market cap club before tesla', 'governor eric j. holcomb, board chairman for the indiana economic development corporation, joined executives of meta platforms inc as the company announced plans to establish a new $800m data center campus in indiana', ""biden's project to 'democratize' access to ai research gets backing from microsoft, openai, nvidia, meta and others"", ""meta blocks adults from messaging teens they don't follow to make it safe for young users""]"
META,2024-01-26,"[""mark zuckerberg's meta working on a more private 'flipside' instagram experience so you can post more candid photos with your friends"", 'market clubhouse morning memo - january 26th, 2024 (trade strategy for spy, qqq, aapl, msft, nvda, googl, meta, and tsla)', ""apple's alternative app store model in the eu could potentially cost meta, others 'millions' of dollars in yearly payments to the iphone"", ""how mark zuckerberg's meta soared beyond $1 trillion in market cap propelling this tech giant to unprecedented heights!""]"
META,2024-01-27,"[""spotify ceo slams apple's 'alternative app store' fee,""]"
META,2024-01-28,"['vision pro exceeds expectations, banned apple watch feature saves teen and more: top news in appleverse this week']"
META,2024-01-29,"['jefferies maintains buy on meta platforms, raises price target to $455', 'meta platforms, caterpillar and 2 other stocks insiders are selling', ""'we stay the course on meta and amazon': analysts preview tech earnings"", 'market clubhouse morning memo - january 29th, 2024 (trade strategy for spy, qqq, aapl, msft, nvda, googl, meta, and tsla)']"
META,2024-01-30,"['market clubhouse morning memo - january 30th, 2024 (trade strategy for spy, qqq, aapl, msft, nvda, googl, meta, and tsla)', 'meta steps up for child online safety: zuckerberg to testify as company tightens privacy controls', 'meta to rally around 16%? here are 10 top analyst forecasts for tuesday', 'xreal gathers $60m to go head with apple, meta, and google in the ar glasses arena', 'keybanc maintains overweight on meta platforms, raises price target to $465', ""'history will repeat itself:' munster warns meta welcoming headset war with apple echoes blackberry's greeting to cupertino's 2007 smartphone debut"", 'meta gets 22% price target boost ahead of q4 results as analyst pins hopes on ad market recovery, reels strength']"
META,2024-01-31,"[""'it's terrible': meta's zuckerberg apologizes to families of online child abuse victims at senate hearing"", 'market clubhouse morning memo - january 31st, 2024 (trade strategy for spy, qqq, aapl, msft, nvda, googl, meta, and tsla)', 'meta stock closes above $400 for first time in history ahead of q4 earnings thursday', ""meta platforms's earnings outlook""]"
META,2024-02-01,"[""meta's board initiates quarterly dividend of $0.50/share"", 'meta facebook daus 2.11b, up 6% yoy', 'meta platforms q4 2023 gaap eps $5.33 beats $4.95 estimate, sales $40.11b beat $39.17b estimate', ""meta platforms q4 earnings highlights: revenue beat, eps beat, company's first dividend and more"", 'meta ceo zuckerberg said meta is getting ready to roll out its ai services more widely in coming months  call', 'meta announces $50b increase to share repurchase authorization', 'market clubhouse morning memo - february 1st, 2024 (trade strategy for spy, qqq, aapl, msft, nvda, googl, meta, and tsla)', 'meta to deploy new version of in custom ai chip in data centers this year', ""nasdaq futures rebound as traders eye apple, meta, amazon earnings: analyst flags 'january barometer' that bodes well for the year"", 'meta faces criticism for copyright double standards: protects own ai model, opposes same for others']"
