Ticker,Date,headline
AMD,2015-01-12,AMD General Manager John Byrne To Leave Company
AMD,2015-01-13,"Option Alert: AMD Feb $2.5 Put; 25,000 Contract Trade at Ask @$0.17; Currently $2.63"
AMD,2015-01-19,Earnings Expectations For The Week Of January 19
AMD,2015-01-20,"Earnings Scheduled For January 20, 2015 | Earning & Economic Calendar for Tuesday January 20, 2015 | Advanced Micro Devices Reports Q4 EPS of $0.00 vs $0.01 Est; Revenue of $1.24B vs $1.24B Est | UPDATE: AMD Revenue of $1.24B, Down 13% Sequentially & 22% YoY | Advanced Micro Devices Sees Q1 Sales Down 12-18% QoQ to ~$1.02B-1.09B vs $1.20B Est | Advanced Micro Devices Reports Q4 Inline With Expectations | AMD Says In Conference Call It Sees High Levels Of Desktops In Inventory Channels | AMD Says In Call Company Will Increase R&D In Enterprise, Working To Correct Inventories Quickly, Diversifying Revenue Base | UPDATE: AMD Says It Sees Flat Inventory YoY In 2015"
AMD,2015-01-21,"Keep an Eye on These 10 Stocks for January 21, 2015 | Benzinga's Top #PreMarket Losers | UPDATE: Morgan Stanley Reiterates Underweight Rating, Lowers PT on Advanced Micro Devices Following Another Tough Quarter | Morning Movers"
AMD,2015-01-22,Advanced Micro Devices Analyst Roundup Following Q4 Results
AMD,2015-01-26,"China's BLX Looking to Acquire AMD, According to Report Out of China | Optiin Alert: AMD Feb $2,5 Call; 2810 Contract Trade at Ask @$0.19 | AMD Declines Comment on Rumor of Potential Deal with BLX IC Design | Analyst Thoughts On Advanced Micro Devices Takeover Rumor"
AMD,2015-01-27,"Nomura Comments On AMD Buyout Rumors, Notes Company 'Could Be Of Great Interest' To Chinese Buyer"
AMD,2015-01-28,CNBC's Stock Pops & Drops From January 28 | Morgan Stanley's Take On The AMD BLX Rumors
AMD,2015-01-30,Top Stories From The Week Ending January 30th
AMD,2015-02-01,Barron's Recap: Strategies for a New Age
AMD,2015-02-02,Why Advanced Micro Devices Is Trading Higher
AMD,2015-02-03,Citigroup Ranks Their Top 10 Semiconductor Stocks
AMD,2015-02-04,Option Alert: AMD Jul $3.00 Call; 3415 Contract Trade at Ask @$0.31; Now $2.80
AMD,2015-02-05,Advanced Micro Devices Back Over $3 For First Time In 4 Months
AMD,2015-02-06,"Dan Nathan Sees Unusal Options Activity In Advanced Micro Devices, Inc. | Advanced Micro Soars 16%, Should You Buy the Stock?"
AMD,2015-02-23,"BNP Paribas Initiates Coverage on Advanced Micro Devices at Underperform, Announces $2.30 PT"
AMD,2015-03-03,Option Alert: AMD Mar 6 $3.00 Call; 2500 Contract Trade at Ask @$0.18; Now $3.20
AMD,2015-03-12,"Watch Intel Peers Following Reduced Outlook: AMD, NVIDIA, Micron, TI, Seagate, H-P | Intel Corp.'s Lower Outlook Brings Down PC Stocks"
AMD,2015-03-25,UBS Downgrades Advanced Micro Devices to Sell
AMD,2015-03-26,"Fudzilla Reports Samsung Interested in Acquiring AMD | Option Alert: AMD Mar 27 $2.5 Call; 1333 Contract Trade at Ask @$0.16 | Benzinga's M&A Chatter for Thursday March 26, 2015"
AMD,2015-04-14,"Intel Shares Up 3% Following Qtr. Results, Guidance; AMD, H-P, NVIDIA, Lam Research, KLA-Tencor Shares Also Seeing Volatility"
AMD,2015-04-16,"Earning, Economic & IPO Calendar for Thursday April 16, 2015 | Earnings Scheduled For April 16, 2015 | Shares of AMD Spike to Post-Market High of $3.05; Earnings Have Not Yet Been Released | AMD Reports Q1 Loss of $0.09/Share, vs Loss of $0.05/Share Est., Sales $1.03B vs $1.05B Est. | AMD Expecting Q2 Sales Down 6% to Flat QoQ | AMD Announces Will Exit Seamicro, Dense Server Systems | AMD Misses Q1 Expectations, Shares Tumble"
AMD,2015-04-17,10 Must Watch Stocks for Today | Ascendiant Capital Downgrades Advanced Micro Devices to Hold | 10 Must Watch Stocks for Today | Ascendiant Capital Downgrades Advanced Micro Devices to Hold | Benzinga's Top #PreMarket Losers | Analyst: PC Weakness Too Much For AMD | Ascendiant Capital Downgrades Advanced Micro Devices To  Hold | Benzinga's Top Downgrades | Bernstein On AMD: 'Les Miserables' | Morning Market Losers
AMD,2015-04-20,Analysts Mixed On AMD After Earnings | Stock Market On Edge As Tech Lights Up Earnings Marquee
AMD,2015-04-21,Semiconductor Shipments Are Weak (Because Of PCs)
AMD,2015-04-27,"AMD to Launch Godavari APUs at End of May, According to Taiwan-based Supply Chain Makers -DigiTimes"
AMD,2015-05-06,AMD CEO Says There is a $15B Opportunity in the Data Center | AMD CEO Says Target EPS $0.50
AMD,2015-05-15,Morgan Stanley Digs Into AMD's New Product Roadmap | Jefferies Says Now's A Great Time To Buy Semiconductors
AMD,2015-06-04,"FBR Downgrades Xilinx, Altera In Massive M&A Note"
AMD,2015-06-09,"Northland Securities Initiates Coverage on Advanced Micro Devices at Outperform, Announces $5.00 PT | Northland Believes AMD And Intel Licensing Agreement Is Exceedingly Valuable | Northland Securities Initiates Advanced Micro Devices With Outperform | Does AMD Have 'Unrecognized Value'? This Northland Analyst Thinks So"
AMD,2015-06-15,Why Advanced Micro Devices And NVIDIA Are Worth Watching
AMD,2015-06-16,SK Hynix Ramps Production of High Bandwidth Memory
AMD,2015-06-17,Option Alert: AMD July 2 $2 Call; 2000 Contract Trade at Ask @$0.41
AMD,2015-06-20,"Weekly Tech Highlights: Sony Beat Apple To The Punch, Twitter M&A Rumors And More"
AMD,2015-06-21,"Advanced Micro Devices Considering Breakup, Spinoff, According to Sources -Reuters"
AMD,2015-06-22,"Option Alert: AMD July 2 $3 Call; 2000 Contract Trade at Ask @$0.22 | Advanced Micro Devices, Inc. Extends Gains On Split-Off Rumor"
AMD,2015-06-24,Summit Research's Srini Sundararajan Issues Note Suggesting Qualcomm is Looking to Buy Co.Which Has 'Expertise in Making Arm-Based Server Processors' | Option Alert: AMD Aug $3 Call; 2500 Contract Trade at Ask @$0.09
AMD,2015-06-29,Morgan Stanley On 'What's Moving Semi Stocks'
AMD,2015-06-30,"Hearing Chatter That AMD May Be Trying To Sell Its Server & Graphics Chips Biz, Could Be Part Of Preparation For A Sale To Qualcomm - UNCONFIRMED | Option Alert: AMD July 2 $2.5 Call; 1349 Contract Trade at Ask @$0.04"
AMD,2015-07-01,Bernstein Asks: Would Microsoft Buy AMD?
AMD,2015-07-02,Option Alert: AMD July 2 $3 Call Sweep; 1436 Contract Trade at Ask @$0.02 | AMD Shares Off High +6%; Traders Citing Vague Chatter Involving Microsoft | Thursday's Top 10 Volume Stocks
AMD,2015-07-06,"Shares of AMD Halted, News Pending | AMD Says Expects Q2 Sales Down 8%, Previously Guided Down 3% | AMD Expects Q2 Gross Margin of 28%, Previously Guided 32%, In Addition Expects $33M One Time Charge | Advanced Micro Devices To Resume Trading At 4:30pm ET | AMD Open Down To 2.25 | AMD Shares Fall ~8% Following Halt For Weak Guidance Issuance | UPDATE: AMD Shares Fall 14% After-Hours on Weak Guidance | Advanced Micro Devices Shares Are Crashing After-Hours On Nasty Guidance"
AMD,2015-07-07,"5 Stocks You Should Be Watching Today | What Happened At AMD Yesterday? Wedbush Is Here To Answer | Benzinga's Top #PreMarket Losers | UPDATE: AMD Shares -16% Premarket Following Monday's  Weak Guidance | Morning Market Losers | 5 Stocks You Should Be Watching Today | What Happened At AMD Yesterday? Wedbush Is Here To Answer | Benzinga's Top #PreMarket Losers | UPDATE: AMD Shares -16% Premarket Following Monday's  Weak Guidance | Morning Market Losers | Oppenheimer Likes Avago, Skyworks Solutions, Upgrades Marvell And Downgrades Broadcom | Mid-Morning Market Update: Markets Drop; Horizon Pharma Proposes To Buy Depomed for $29.25/Share | Mid-Day Market Update: Dow Tumbles 150 Points; Advanced Micro Devices Shares Slide On Nasty Guidance | Mid-Afternoon Market Update: A Schulman Slips After Q3 Results; Plug Power Shares Spike Higher"
AMD,2015-07-08,"AMD Unveils New Catalyst 15.7 Driver for Intuitive Windows 10 Experience Across AMD APU and GPU Solutions | Tuesday, Wednesday's Economic Conditions And Major Market Movers: China Continues To Decline, Greece Continues Delay"
AMD,2015-07-09,"Stocks Hitting 52-Week Lows | 'It's A Hard Rain's A Gonna Fall' Come Intel, AMD Earnings, Bernstein Warns"
AMD,2015-07-15,"Mizuho Securities Initiates Coverage on Advanced Micro Devices at Neutral, Announces $2.25 PT | Benzinga's Top Initiations | Are Intel's Biggest Analysts Bullish?"
AMD,2015-07-16,"10 Stocks To Watch For July 16, 2015 | Earnings Scheduled For July 16, 2015 | Advanced Micro Devices To Report Worst Quarter In Years | Five Stocks With Short-Selling Activity Worth Watching | AMD Reports Q2 Loss of $0.17/Share, Inline | AMD Reports Q2 Sales $942M vs $950.5M Est. | AMD Sees Q3 Sales Up 3-9% QoQ | Shares of AMD Trading ~3% Higher in Post-Market Action | Advanced Micro Devices Posts In-Line Q2 Loss"
AMD,2015-07-17,"7 Stocks You Should Be Watching Today | JJ Kinahan Discusses Options Activity In GE, Google, AMD & More | Morgan Stanley Stays Underweight AMD, Lowers Estimates Even More | Benzinga's Top #PreMarket Gainers | AMD's High Cash Burn 'Concerns' Citigroup Analysts | AMD Analyst Roundup Following Earnings | Stocks Hitting 52-Week Lows"
AMD,2015-07-20,UMC Enters Volume Production for TSV Process Used to Enable AMD's High-Performance Radeon R9 Fury X GPU | US Stock Futures Up Ahead Of Morgan Stanley Earnings
AMD,2015-07-21,United Microelectronics Enters Volume Production for AMD Graphics Chips Using TSV Technology -DigiTimes
AMD,2015-07-29,Six Stocks With Notable Short Selling Activity
AMD,2015-07-30,How To Trade Micron And China's Semiconductor Plan
AMD,2015-08-03,"PC Market Be Damned, NVIDIA Stock Is A Buy"
AMD,2015-08-12,Calls Of Note: The Research Moving The Market On Wednesday | Analyst On AMD's Executive Bonuses: 'Unbelievable'
AMD,2015-08-18,Mid-Day Market Update: Tuesday's Top Shorted Stocks
AMD,2015-08-24,"Taiwan Semiconductor Gains Customers for 16nm FinFET Chips, Including Apple, AMD, Avago, Broadcom, Nvidia, Xilinx, Loses Qualcomm Mobile Chips -DigiTimes"
AMD,2015-08-27,Windows 10 Creating Demand for Chip Orders for Notebooks -DigiTimes
AMD,2015-09-11,Bernstein Upgrades Advanced Micro Devices to Market Perform | Benzinga's Top Upgrades | Hearing Unconfirmed Market Chatter of Potential Microsoft Bid for AMD | Option Alert: $AMD Jan $3 Call Sweep; 1000 Contracts @$0.12; Now $1.93 | AMD Declines Comment on Rumored Approach from Microsoft | Microsoft Spokesperson Declines Comment on Earlier Report Related to Co. Interest in Bid for AMD
AMD,2015-09-14,"Benzzinga's Weekend M&A Chatter | Benzzinga's Weekend M&A Chatter | Must Watch Stocks for September 14, 2015"
AMD,2015-09-15,"Piper Jaffray's Egbert Calls Microsoft, AMD Tie-Up 'Unlikely,' But Says 'Would Make Some Strategic Sense' | Microsoft Finds Resistance At $44 Once Again | Microsoft Could Buy AMD And It'd Make Sense, Piper Jaffray Says"
AMD,2015-09-16,AMD Expands Technology Partnership With Mentor Graphics
AMD,2015-09-17,New Study Shows Upgrading to Latest AMD Processor Cuts Greenhouse Gas Emissions From Personal Computing Use by 50 Percent
AMD,2015-10-01,Hear That? It's Tech Earnings Seasonâ€¦And Its Coming | Advanced Micro Devices Reports Restructuring Plan To Reduce 5% Global Workforce; Actions To Be completed By FY16 | UPDATE: Advanced Micro 8K Shows Company Will Take $26M Charge In FY15 And $15M In FY16; Company Anticipates Savings Of $58M By FY16 | Advanced Micro Devices 8-K Shows Restructuing Plan To Reduce Workforce By 5%
AMD,2015-10-15,"Earnings Scheduled For October 15, 2015 | Advanced Micro Devices Selling Off Into The Close, Company Is Scheduled To Report After Hours | Advanced Micro Devices Reports Q3 Loss $0.17 Vs Est Loss $0.12, Sales $1.06B Vs Est $995.8B | AMD Sees Q4 Sales Down 13%-7% QoQ | UPDATE: AMD Q4 Sales Guidance in $922M-$986M Range vs $996M Est. | AMD, Nanton Fujitsu Microelectronics To Test Joint Venture | After-Hours Movers Led By Post-Earnings AMD, Wynn, Mattel And Schlumberger | From AMD Earnings Conference Call: Sees Q4 Adj. Gross Margin ~30%"
AMD,2015-10-16,"7 Must Watch Stocks for Today | Benzinga's Top #PreMarket Losers | Oppenheimer On AMD Following Earnings: Sees PC's 'Turning The Corner, But Challenges Remain' | What The Street Thinks About AMD's Earnings, Joint Venture, Restructuring And Prospects"
AMD,2015-11-06,Are You Investing Like A Millennial Or Like A Boomer?
AMD,2015-11-25,"The Vetr Crowd Really Hates AMD, Turns Incrementally Negative On Texas Instruments"
AMD,2015-11-30,"Early Global News . Monday . November 30, 2015"
AMD,2015-12-09,The 25 Worst-Performing CEOs In The Country
AMD,2015-12-10,AMD Orders Accounted for ~One-Third of ASMedia Technology 3Q15 Revenues -DigiTimes
AMD,2015-12-11,Weak PC Demand Seen for H1 2016 -DigiTimes
AMD,2015-12-28,17 Tech Companies That Will Meet With Analysts Next Week
AMD,2016-01-04,TOp 20 Analysts For 2015
AMD,2016-01-05,SIA Reports Worldwide Global Semiconductor Sales -3% in November
AMD,2016-01-15,Intel Starts Off Earnings Season For Chip-Maker Group With A...Thud
AMD,2016-01-19,"7 Must Watch Stocks for Today | Earnings Scheduled For January 19, 2016 | AMD EPS preview | AMD Reports Q4 Adj. EPS $(0.10), Inline, Sales $958M vs $954.7M Est. | Advanced Micro Devices Shares Down 6.15% After Hours On Disappointing Q1 Guidance Given With Earnings | AMD Expecting YoY Sales Growth in FY16, Sees Inventories Down | 3 Tech Stocks Moving On Tuesday's After-Hours Trading Session"
AMD,2016-01-20,"7 Stocks You Should Be Watching Today | Credit Suisse Negative On Advanced Micro Devices, Worries Co Is Quickly Losing Scale And A Declining R&D Budget | Deutsche Bank Maintains Hold On Advanced Micro Devices, Cautious On 2016 Growth | Pacific Crest Positive On Advanced Micro Devices Citing 2016 Growth Guidance, Raises FY 2016 EPS Est ANd Sees Fair Value For Shares Btwn $2-$3 | 10 Stocks Moving In Wednesday's Pre-Market Session | AMD earnings | Advanced Micro Devices Back Under $2 | Mid-Afternoon Market Update: Dow Falls Over 400 Points; Advanced Micro Devices Shares Drop After Disappointing Guidance"
AMD,2016-01-25,"Rambus Reports Extension of Patent License Deal with AMD | AMD, Rambus Extend Patent License Agreement For 5 Additional Years, Specific Terms Of Deal Are Confidential | Rambus Reports Extension of Patent License Deal with AMD | AMD, Rambus Extend Patent License Agreement For 5 Additional Years, Specific Terms Of Deal Are Confidential"
AMD,2016-02-10,AMD and Saguna Sign Collaborative Agreement to Design Low-Power High-Performance Mobile Edge Computing (MEC) Solutions for Mobile Networks | PacCrest Analysts Lower PC OEM Estimates En Masse
AMD,2016-02-24,"AMD Share in GPU, PC Markets Could Hit Record Lows in Q1 -DigiTimes"
AMD,2016-03-03,"Early Global News  .  Thursday  .  March 3, 2016"
AMD,2016-03-18,"The Market In 5 Minutes: Friday, March 18, 2016"
AMD,2016-03-23,"UBS Sees Global PC Hardware Market Recovery Likely Being Delayed, Says Buy Apple, Intel, And Microsoft, Says To Sell Advanced Micro Devices | PC Recovery Delayed...Again, Warns UBS"
AMD,2016-03-24,"AMD, Nvidia Working to Meet Demand for VR Devices -DigiTimes"
AMD,2016-04-04,Global Semi Sales Down ~2% In 2015v
AMD,2016-04-07,Craig-Hallum Initiates Coverage on Advanced Micro Devices at Hold | Benzinga's Top Initiations
AMD,2016-04-21,"Earnings Scheduled For April 21, 2016 | AMD Reports Q1 Adj. EPS $(0.12) vs $(0.13) Est., Sales $832M vs $818M Est. | Advanced Micro Devices Trading Up ~8.4% At $2.84 In After-Hours Session | AMD Sees Q2 Sales Growth 12-18% QoQ | AMD Shares +15.5% at $3.04 Following Better than Expected Earnings Report | After-Hours Recap: Markets & Oil Fall; Earnings Have Stocks Moving After The Bell"
AMD,2016-04-22,"10 Stocks To Watch For April 22, 2016 | MKM Partners Upgrades Advanced Micro Devices to Buy | Exane BNP Paribas Upgrades Advanced Micro Devices to Neutral | Morgan Stanley Maintains Underweight on Advanced Micro Devices, Raises PT to $2.65 | Credit Suisse Maintains Underperform on Advanced Micro Devices, Raises PT to $3.50 | Canaccord Genuity Maintains Hold on Advanced Micro Devices, Raises PT to $3.25 | 12 Stocks Moving In Friday's Pre-Market Session | Craig-Hallum Upgrades Advanced Micro Devices to Buy | Macquarie Maintains Neutral on Advanced Micro Devices, Raises PT to $2.00 | Benzinga's Top Upgrades | Mid-Morning Market Update: Markets Mostly Lower; McDonald's Beats Q1 Estimates | The Market In 5 Minutes: Sometimes It Snows In April | Stocks Hitting 52-Week Highs | Mid-Day Market Update: Microsoft Drops On Earnings Miss; NGL Energy Partners Shares Surge | AMD Is The Place To Be | Mid-Afternoon Market Update: AMD Jumps On Strong Results; Boston Beer Shares Slide"
AMD,2016-04-25,No Follow Through Rally In Advanced Micro Devices
AMD,2016-04-26,Option Alert: AMD Jun16 4.0 Calls Sweep: 2000 @  ASK  $0.20: 2002 traded vs 1125 OI: $3.52 Ref
AMD,2016-04-27,"Morgan Stanley Stays Bearish On AMD, Says Market Is Overrating JV"
AMD,2016-05-19,"InvestDiva's Kiana Danial Likes AMD's Stock, Sees A Charge Towards $9 Per Share"
AMD,2016-05-23,Advanced Micro Devices Knocking On The Day Of Major Resistance
AMD,2016-06-01,Is Advanced Micro Devices Now A Buy? Vetr Crowd Cannot Reach Agreement
AMD,2016-06-07,"Intel, AMD Postpone New CPU Platform Launches till January 2017 -DigiTimes"
AMD,2016-06-09,Bluefin's Q2 Semiconductor Supplier Forecasts Up 14%
AMD,2016-06-16,"Canaccord Genuity Upgrades Advanced Micro Devices to Buy, Raises PT to $6.00 | The Market In 5 Minutes | Benzinga's Top Upgrades | 8 Largest Price Target Changes For Thursday | Canaccord Sees Advanced Micro Devices' Upside Ahead Of New Gaming Console Cycle"
AMD,2016-06-17,Stocks Hitting 52-Week Highs | Advanced Micro Devices Climbs Into The $5 Handle For The First Time Since 2012 | Stocks Hitting 52-Week Highs | Advanced Micro Devices Climbs Into The $5 Handle For The First Time Since 2012
AMD,2016-06-20,Watch These 7 Huge Call Purchases In Monday Trade
AMD,2016-06-21,Advanced Micro Devices Makes Another Run At $5.50 Level
AMD,2016-06-28,Taiwan Semiconductor Could Blow Street Estimates Away
AMD,2016-06-29,"AMD Reports Purchase of HiAlgo, No Terms Disclosed"
AMD,2016-07-08,Bernstein Downgrades AMD from Market Perform to Underperform | Benzinga's Top Downgrades
AMD,2016-07-21,"Earnings Scheduled For July 21, 2016 | AMD Reports Q2 EPS $(0.05) vs. Est. $(0.08), Rev. $1.027B vs. Est. $951.29M | AMD Sees Q3 QoQ Sales Growth 18% +/- 3%"
AMD,2016-07-22,"12 Stocks To Watch For July 22, 2016 | 15 Stocks Moving In Friday's Pre-Market Session | Credit Suisse Saw Strong Execution From Advanced Micro Devices | Stocks Hitting 52-Week Highs | 12 Biggest Mid-Day Gainers For Friday | Friday Market Wrap: Stock Market Continues to Rise"
AMD,2016-07-25,Expert: This Stock Is The Best Swing Trade of 2016 | Monday's Market Wrap: Stocks Record Modest Declines
AMD,2016-07-26,Stocks Hitting 52-Week Highs | Breakout Watch: Advanced Micro Devices
AMD,2016-08-08,"Jefferies Analysts Are Buyers Of NVIDIA Amid Sales Momentum, Probability Of Upside"
AMD,2016-08-11,Can You Guess This Chart?
AMD,2016-08-19,Technical Alert: Advanced Micro Devices Reaches $8 For The First Time Since April 2012
AMD,2016-08-25,"Wells Fargo, Advanced Micro Devices, Fifth Third Bank Agreed to Settlement Deals that Could Violate U.S. Whistleblower Rules -Reuters | Advanced Micro Devices Gets A Price Target Bump At Canaccord"
AMD,2016-08-31,"AMD Announces Wafter Supply Agreement With GLOBALFOUNDRIES, AMD to Make $100M Payment | AMD Grants West Coast Hitech Warrants to Purchase 75M Shares for $5.98/Share"
AMD,2016-09-03,9 Times Executives Were Poached
AMD,2016-09-06,"Advanced Micro Devices Files For Potential Mixed Shelf, Size Not Disclosed | UPDATE: Advanced Mirco Devices Announces Public Offering of $600M In Common Stock"
AMD,2016-09-07,"Keep an Eye on These 10 Stocks for September 7, 2016 | 22 Stocks Moving In Wednesday's Pre-Market Session | 15 Biggest Mid-Day Losers For Wednesday"
AMD,2016-09-09,4 Stocks Which Plummeted Three Days On Increasing Volume
AMD,2016-09-12,"11 Stocks Which Plummeted Three Days On Increasing Volume | Advanced Micro Devices Now A 'Hold,' Following 22% Decline, Vetr Crowd Says"
AMD,2016-09-16,"Intel Shares Up 4% Following Raised Q3 Outlook; AMD Shares Up 3.8%, Micron Up 3.4%, NVIDIA Up 0.9%, Texas Instruments Up 0.8% | Chip Stocks Strong As Intel Raises Q3 Guidance"
AMD,2016-09-19,Can You Guess This Chart? | The Market In 5 Minutes: Stocks Unfazed By Weekend's Violent Attacks
AMD,2016-09-20,"Bernstein Upgrades Advanced Micro Devices to Market Perform | Susquehanna Initiates Coverage on Advanced Micro Devices at Neutral, Announces $6.50 PT | The Market In 5 Minutes: Traders In A Standstill Ahead Of FOMC Meeting"
AMD,2016-09-21,We Asked 3 Retail Traders About Their Strategies
AMD,2016-09-26,25 Stocks Which Rallied Three Days On Increasing Volume
AMD,2016-10-03,First Two Weeks Of October EPS Estimates All In One Place
AMD,2016-10-06,"10 Stocks Which Rallied Four Days,  Then Sold Off Yesterday | 10 Stocks Which Rallied Four Days, Then Sold Off Yesterday | Expect Pressure On Semi Stocks Amid Terminated KLA-Tencor/Lam Deal | 10 Stocks Which Rallied Four Days,  Then Sold Off Yesterday | 10 Stocks Which Rallied Four Days, Then Sold Off Yesterday | Expect Pressure On Semi Stocks Amid Terminated KLA-Tencor/Lam Deal"
AMD,2016-10-07,"Barclays On AMD: 'Turnaround Under Way, But Already Pricing In Some Success'"
AMD,2016-10-12,"Credit Suisse Upgrades Advanced Micro Devices, Inc. to Neutral, Raises to $7.00 | A Peek Into The Markets: U.S. Stock Futures Edge Lower Ahead Of Fed Minutes | Advanced Micro Devices Upgraded On Near-Term Momentum, Conservative Guidance | Benzinga's Top Upgrades | The Market In 5 Minutes: Fed Focus, British Pound, More Earnings | 8 Biggest Price Target Changes For Wednesday"
AMD,2016-10-14,18 Stocks Moving In Friday's Pre-Market Session | Advanced Micro Devices Rallies Off Chip Deal With Alibaba | Mid-Morning Market Update:  Markets Open Higher; Citigroup Profit Tops Expectations | Mid-Day Market Update: Advanced Micro Devices Climbs After Chip Deal With Alibaba; Ocean Power Technologies Shares Slide | 12 Biggest Mid-Day Gainers For Friday
AMD,2016-10-17,"Oppenheimer Upgrades Advanced Micro Devices, Inc. - Common Stock to Perform | AMD +7.09% Premarket @$6.95; Oppenheimer Upgraded  to Perform from Underweight | Benzinga's Top Upgrades | Advanced Micro Devices' Improved Near-Term Sales Trends Earn It An Oppenheimer Upgrade"
AMD,2016-10-19,Advanced Micro Devices' Q3 Earnings Preview: Mixed Voices From The Street
AMD,2016-10-20,"Earnings Scheduled For October 20, 2016 | 10 Must Watch Stocks for Today | AMD Reports Q3 Adj. EPS $0.03 vs $0.00 Est., Sales $1.307B vs $1.21B Est. | AMD Sees Q4 Sales Down 18% +/- 3% QoQ | AMD Sees FY16 Sales Up 6% YoY"
AMD,2016-10-21,"10 Stocks To Watch For October 21, 2016 | 20 Stocks Which Rallied Three Days On Increasing Volume | 16 Stocks Moving In Friday's Pre-Market Session | Advanced Micro Devices Has A Slate Of Exciting Products Coming In 2017 | Advanced Micro Devices Lower Despite Q3 Beat | 12 Biggest Mid-Day Losers For Friday"
AMD,2016-10-23,Advanced Micro Devices Performing Well With New CEO At The Helm
AMD,2016-10-27,"Jim Cramer Gives His Opinion On Advanced Micro Devices, IBM And Acacia | Macbook Pro Includes Radeon Pro 14nm GPU, Superfast SSD"
AMD,2016-10-28,"AMD Shares Spike Higher, Hearing Report Oracle May Be Interested in Deal with Co."
AMD,2016-11-04,Jim Cramer Shares His Thoughts On Acacia Communications And Advanced Micro Devices
AMD,2016-11-10,10 Stocks With Three-Day Increasing Volume
AMD,2016-11-11,"Barclays Issues A Rare Post-Earnings Upgrade On NVIDIA | After NVIDIA's Solid Q3, Analyst Sees 18% Upside"
AMD,2016-11-14,Can You Guess This Chart?
AMD,2016-11-16,Option Alert: AMD Nov 25 $6.5 Put; 7200 @Bid @$0.05; Ref=$7.21
AMD,2016-11-17,Watch These 5 Huge Put Purchases In Thursday Trade | Technical Alert: Advanced Micro Devices At Six-Year High
AMD,2016-11-21,Stocks Hitting 52-Week Highs
AMD,2016-11-22,"MKM Partners Says Raising Advanced Micro Devices PT From $8 To $10.50 on Higher Multiple of 2x, Reflects Improved Prospects For Co. Driven By New Product Pipeline, Including Zen Server and Vega GPUs | Vetr Crowd Thinks AMD Is Running Hot"
AMD,2016-11-23,Dan Nathan Sees Unusual Options Activity In Advanced Micro Devices
AMD,2016-12-01,Option Alert: AMD Dec16 8.5 Puts Sweep: 30000 @  ASK  $0.406: 30k traded vs 2519 OI:  Earnings 1/17 After Close (est)  $8.65 Ref | NVIDIA's Crazy Run Begins To Slow Down
AMD,2016-12-02,"Watch These 5 Huge Put Purchases In Friday Trade | Watch These 5 Huge Put Purchases In Friday Trade | Jim Cramer Shares His Thoughts On Salesforce, Advanced Micro Devices And Worthington Industries"
AMD,2016-12-05,"Chip Makers Trading Higher During India's GTCx Conference, NVIDIA up 2.04% | Chipmakers Trading High During Indian Conference"
AMD,2016-12-06,"Loop Capital Initiates Coverage On Advanced Micro Devices at Buy, Announces $16.00 Target | CORRECTION: Loop Capital Initiates Coverage On Advanced Micro Devices at Buy, Announces $11.00 Target | Advanced Micro Devices Up 5.4% On The Morning, TweakTown Reporting That Radeon GPU To Power Intel Next-Gen iGPU's | Technical Alert: Advanced Micro Devices At Highest Level Since February 2011 | Loop Capital Initiated Coverage On 9 Semi Stocks, All With Buy Ratings"
AMD,2016-12-08,"Bank of America Upgrades Advanced Micro Devices to Buy | The Market In 5 Minutes: Lululemon, Sears Moving In Different Directions Following Earnings | Stocks Hitting 52-Week Highs"
AMD,2016-12-12,BMO Capital Upgrades Advanced Micro Devices to Outperform | Option Alert: AMD Dec16 $10.5 Calls @Bid @$0.51;  Ref =$10.76
AMD,2016-12-14,"Canaccord Raises Target on AMD from $8.75 to $13, Maintains Buy; Sees Momentum Continuing as Co. Introduces Radeon Instinct GPU Accelerator Roadmap, Ryzen Performance Targets | Advanced Micro Devices' Price Target Raised To 2007 Level At Canaccord | Advanced Micro Devices Trading At Its Highest Level In Nearly A Decade"
AMD,2016-12-15,"Morgan Stanley Upgrades Advanced Micro Devices to Equal-Weight | A Peek Into The Markets: U.S. Stock Futures Mixed Ahead Of Economic Data | Benzinga's Top Upgrades, Downgrades For December 15, 2016"
