Ticker,Date,headline
MSFT,2025-01-29,"Dan Ives Expects Meta And Microsoft To Stand Firm On $60 - $80 Billion AI Spending Plans Amid DeepSeek's Disruptive AI Model | Nvidia Supplier ASML Beats Q4 Earnings Estimates, CEO Says 'AI Is Key Driver For Growth:' Buy, Sell, Or Hold? Here's What Technical Analysis Suggests | Tesla, Starbucks And 3 Stocks To Watch Heading Into Wednesday | Earnings Scheduled For January 29, 2025 | Nasdaq Jumps 2% After Nvidia, Other Tech Stocks Bounce Back From DeepSeek Hit: Greed Index Remains In 'Fear' Zone | OpenAI Alleges DeepSeek Used Proprietary Models Without Permission As Microsoft Investigates AI Security Risks: 'There's Substantial Evidence' | Black Swan Author Nassim Taleb Says Nvidia Stock's 17% Drop On Monday Is 'Just The Beginning' Of Market Rout | US Futures Point To Cautious Start As Investors Await Fed's Rate Decision: Tesla, Microsoft, Meta Among Stocks In Focus Ahead Of Earnings | DeepSeek's AI Breakthrough Benefits Microsoft, But Oracle Faces Cloud Growth Challenges: Analyst | EXCLUSIVE: Nvidia Hardest Hit Among Mag 7 Stocks By DeepSeek, Poll Shows — And This Stock Ranked Second | Top 10 Trending Stocks On WallStreetBets As Of January 29, 2025 (Via Swaggy Stocks) | Cantor Fitzgerald Reiterates Overweight on Microsoft, Maintains $509 Price Target | Analyzing Microsoft In Comparison To Competitors In Software Industry | Microsoft Earnings Are Imminent; These Most Accurate Analysts Revise Forecasts Ahead Of Earnings Call | 10 Information Technology Stocks With Whale Alerts In Today's Session | Stocks Tick Down Ahead Of Fed Meeting, Nvidia Jitters Resume, Trump Media Rallies: What's Driving Markets Wednesday? | 'OpenAI Says DeepSeek May Have Improperly Harvested Its Data' - NY Times | AI ETFs In Focus As Alibaba Challenges DeepSeek With New Model | Why Nvidia, Broadcom, Marvell Are This Analyst's Top AI Bets In 'Sputnik Moment' | Microsoft Q2 2025 GAAP EPS $3.23 Beats $3.11 Estimate, Sales $69.6B Beat $68.780B Estimate | Microsoft Reports Q2 Highlights: Productivity And Business Processes Revenue Hits $29.4B, Up 14%, Intelligent Cloud Grew 19% To $25.5B, Azure Revenue Up 31%, More Personal Computing Flat At $14.7B | Microsoft Shares Slide After Q2 Results, Cloud Revenue Misses Expectations: Details"
MSFT,2025-01-30,"MrBeast And Group Of Investors, Including Roblox CEO, Lock In Over $20 Billion For TikTok Takeover | Tesla, Meta, Microsoft, IBM, Nvidia: Why These 5 Stocks Are On Investors' Radars Today | Microsoft's $13 Billion Run Rate And OpenAI Azure Deal Spark Surge In Enterprise Demand For AI Solutions: Just 'First Tranche' Of Future Growth Potential | Microsoft CEO Satya Nadella Accepts DeepSeek AI Has Some 'Real Innovations' — But Won't Say If They Mark A Turning Point For AI Cost Reduction | SoftBank Eyes Historic $25 Billion Investment In OpenAI, Set To Dethrone Microsoft As Biggest Investor In ChatGPT-Parent | Tesla, Apple And 3 Stocks To Watch Heading Into Thursday | US Stocks Set For Gains Ahead Of Q1 GDP, Apple Earnings: Expert Says 'Higher January' Bodes Well For The Rest Of The Year | MrBeast And Group Of Investors, Including Roblox CEO, Lock In Over $20 Billion For TikTok Takeover | Tesla, Meta, Microsoft, IBM, Nvidia: Why These 5 Stocks Are On Investors' Radars Today | Microsoft's $13 Billion Run Rate And OpenAI Azure Deal Spark Surge In Enterprise Demand For AI Solutions: Just 'First Tranche' Of Future Growth Potential | Microsoft CEO Satya Nadella Accepts DeepSeek AI Has Some 'Real Innovations' — But Won't Say If They Mark A Turning Point For AI Cost Reduction | SoftBank Eyes Historic $25 Billion Investment In OpenAI, Set To Dethrone Microsoft As Biggest Investor In ChatGPT-Parent | Tesla, Apple And 3 Stocks To Watch Heading Into Thursday | US Stocks Set For Gains Ahead Of Q1 GDP, Apple Earnings: Expert Says 'Higher January' Bodes Well For The Rest Of The Year | Mizuho Maintains Outperform on Microsoft, Lowers Price Target to $500 | MSFT Stock Declines Over 4% In Premarket After Q2 Results, CEO Satya Nadella Says DeepSeek Has Some 'Real Innovations' | Meta Platforms To Rally Over 29%? Here Are 10 Top Analyst Forecasts For Thursday | Morgan Stanley Maintains Overweight on Microsoft, Lowers Price Target to $530 | UPS, Whirlpool, Microsoft And Other Big Stocks Moving Lower In Thursday's Pre-Market Session | Why VOO Investors Should Keep Calm Despite AI Stock Turbulence | Top 10 Trending Stocks On WallStreetBets As Of January 30, 2025 (Via Swaggy Stocks) | Insights Into Microsoft's Performance Versus Peers In Software Sector | Meta Vs. Microsoft: Can Their AI Infrastructure Plans Hold Up Against DeepSeek? | RBC Capital Reiterates Outperform on Microsoft, Maintains $500 Price Target | CORRECTION: Microsoft ticker Is 'MSFT' | Amazon AI-Powered AWS Boom: Can It Outshine Microsoft Azure? | Wall Street Remains Flat, Microsoft Eyes Heaviest Drop Since Late 2022, Gold Sets Fresh Records: What's Driving Markets Thursday? | 'OpenAI in Talks for Funding Round Valuing It Up to $340 Billion, Sources Say' | Microsoft Analysts Weigh Azure Weakness Against AI Strength: 'Most Compelling Investment Opportunities' | Amazon Cuts More Jobs in Cost-Saving Push: Report | 3 ETFs To Navigate Utility Stock Volatility As DeepSeek Challenges Power Demand Forecasts | UBS Maintains Buy on Microsoft, Lowers Price Target to $510"
MSFT,2025-01-31,"SoftBank May Lead OpenAI's $40 Billion Funding Round At A $300 Billion Valuation Despite DeepSeek Disruption: Report | Sam Altman Thanks Satya Nadella, Jensen Huang As OpenAI Deploys NVIDIA's GB200 On Microsoft Azure, Boosting Performance By 30X | Dow Jumps Over 150 Points As Investors Monitor Earnings Reports; Investor Sentiment Improves, Fear & Greed Index Remains In 'Neutral' Zone | China's DeepSeek-R1 Lands On Microsoft Azure And AWS — The Same Model That Shook Silicon Valley | US Stock Futures Climb After Apple Beats Q1 Expectations: Expert Says Tech Stocks Hold Above Key Level Despite DeepSeek Impact | Inquiry Into Microsoft's Competitor Dynamics In Software Industry | 5 ETFs To Watch During Microsoft's Post-Earnings Drop | Humanoid Robots Bigger Than Evs, Retail Investors Buy $1B Nvidia But Institutions Sell, Microsoft Offers DeepSeek | 10 Information Technology Stocks With Whale Alerts In Today's Session | Deal Dispatch: Sage And Silvus Are Up For Sale, MrBeast Secures $20B For TikTok | EXCLUSIVE: This 'Magnificent 7' Stock Will Feel The Pinch Of Fed's Rate Decision, Poll Shows | Stocks Trim DeepSeek Losses, Fed Holds Steady, Trump Slaps 25% Tariffs On Canada, Mexico: This Week In The Markets"
MSFT,2025-02-01,"OpenAI Launches o3-mini Model, Makes It Free After DeepSeek's Launch"
MSFT,2025-02-02,"Bill Gates' Early Departure From Harvard: Not Surprising, Says Former Professor: 'I Just Wish I'd Invested In Him' | Consumer Tech News (Jan 27-Jan 31): China's DeepSeek Launch Gets Mixed Reaction From Experts, Tech Biggies Reported Earnings & More"
MSFT,2025-02-03,"14 Million Job Seekers Didn't Hear Back From Potential Employers In Just A Single Quarter Last Year: Now LinkedIn Is Moving To Change That With AI Help | TikTok Ban Exposes 'Techno-Feudal' Power: Influencers With Massive Following Should Be Able To Carry Followers Across Platforms, Says Economist | Nvidia, SMCI, Broadcom, And Other Tech Stocks Slide In Monday Pre-Market As Trump Imposes Tariffs On Imports From China, Mexico, And Canada | Analyzing Microsoft In Comparison To Competitors In Software Industry | AMD Reports Q4 Earnings This Week: What's Going On With The Chip Stock? | 10 Information Technology Stocks With Whale Alerts In Today's Session | Dan Loeb's Third Point Trims Amazon, Microsoft, Meta As Tech Stocks Climb | Chevron, Exxon And Shell Shift Focus To Powering AI Growth"
MSFT,2025-02-04,"Nvidia, TSMC Stocks Fell As Trump Hit Mexico, Canada, And China With Tariffs—But Top Analyst Sees Only 'Limited' Supply Chain Impact On Chips | Windows 11 Disaster? Microsoft Quietly Removes Workaround For Unsupported PCs, Potentially Leaving Millions Unable To Upgrade"
