Ticker,Date,headline
AMD,2022-08-03,"Top Wall Street Bets Mentions For Tuesday August 2, 2022 After-Hours: AMD, GME, PYPL, SOFI, HOOD, ABNB, MSTR, TSLA, AMC, OXY | U.S. Stock Futures Gain Ahead of Services PMI; Crude Oil Drops Over 1% | Citigroup Maintains Neutral on Advanced Micro Devices, Lowers Price Target to $96 | This Healthcare Stock Is Trading Higher By 148%: Here Are 40 Stocks Moving Premarket | Raymond James Maintains Strong Buy on Advanced Micro Devices, Lowers Price Target to $130 | UBS Maintains Neutral on Advanced Micro Devices, Raises Price Target to $120 | Mizuho Maintains Buy on Advanced Micro Devices, Lowers Price Target to $140 | Deutsche Bank Maintains Hold on Advanced Micro Devices, Raises Price Target to $95 | JP Morgan Maintains Neutral on Advanced Micro Devices, Lowers Price Target to $120 | Why AMD Stock Is Sliding Today | Why Nvidia Shares Are Sliding Today | Starbucks To $93? Plus JP Morgan Predicts This PT For AMD | Morgan Stanley Maintains Overweight on Advanced Micro Devices, Raises Price Target to $102 | Northland Capital Markets Maintains Outperform on Advanced Micro Devices, Raises Price Target to $105 | AMD, SolarEdge Technologies And Some Other Big Stocks Moving Lower On Wednesday | Ten Stocks Trending on Discord for Wednesday August 3, 2022: EAR, HSDT, PSTX, APDN, KSPN, AMD, SOFI, ENDP, AEMD, PYPL | Top Wall Street Bets Mentions For Wednesday August 3, 2022 Since 9:30 AM ET Open: AMD, GME, TSLA, SOFI, HOOD, HEXO, AAPL, AMC, PYPL, SIGA | 6 Advanced Micro Devices Analysts React To Earnings Beat, Guidance Miss, Market Share Gains | Why Poseida Therapeutics Almost Doubled Today, Here Are 75 Stocks Moving In Wednesday's Mid-Day Session | KGI Securities Upgrades Advanced Micro Devices to Outperform, Announces $125 Price Target | Looking At Advanced Micro Devices's Recent Whale Trades"
AMD,2022-08-04,"Top Wall Street Bets Mentions For Wednesday August 3, 2022 After-Hours: GME, LCID, MSM, TSLA, AMC, AMD, AAPL, MELI, HOOD, BABA | Goldman Sachs Maintains Buy on Advanced Micro Devices, Raises Price Target to $112 | AMD, ECARX To Collaborate On 'Immersive Digital Cockpit In-Vehicle Computing Platform for Next-Generation Electric Vehicles' | 10 Information Technology Stocks With Whale Alerts In Today's Session | Top 15 Trending Stocks On WallStreetBets As Of Thursday, August 4, 2022 (Via Swaggy Stocks)"
AMD,2022-08-05,Traders Slightly More Optimistic Ahead Of NFP Despite This Data Showing A Decline In US Labor Market
AMD,2022-08-07,Disney Leads Media Earnings This Week As Reporting Season Moves Past The Peak
AMD,2022-08-08,"Why AMD Shares Are Falling | Check Out What Whales Are Doing With AMD | Why AMD Shares Are Falling | Check Out What Whales Are Doing With AMD | Top Wall Street Bets Mentions For Monday August 8, 2022 Since 9:30 AM ET Open: BBBY, GME, AMC, NVDA, TSLA, BBY, TLRY, PLTR, CLOV, AMD | 10 Information Technology Stocks Whale Activity In Today's Session | Top 15 Trending Stocks On WallStreetBets As Of Monday, August 8, 2022 (Via Swaggy Stocks) | Key Takeaways From Rosenblatt's View On Chipmakers' Earnings | Semiconductor Stocks Pressured Following Nvidia's Q2 Preannouncement"
AMD,2022-08-09,"Top Wall Street Bets Mentions For Tuesday August 9, 2022 Premarket: BBBY, GME, AMC, NVDA, TSLA, COIN, BBY, TUEM, AAPL, AMD | Why Advanced Micro Devices Stock Is Diving Following Micron News | President Biden Signing CHIPS Act Into Law | Here's Why Advanced Micro Devices, Nvidia Stock Must Hold These Key Levels | 10 Information Technology Stocks With Whale Alerts In Today's Session"
AMD,2022-08-10,"Top Wall Street Bets Mentions For Wednesday August 10, 2022 Since 9:30 AM ET Open: BBBY, TSLA, GME, COIN, AMC, TTD, LAZR, AMD, BBY, BNGO | Top 15 Trending Stocks On WallStreetBets As Of Wednesday, August 10, 2022 (Via Swaggy Stocks) | 2022 Returns For Investor And Pandemic Darlings: You Won't Believe This Stock That Is Positive On The Year"
AMD,2022-08-11,"10 Information Technology Stocks With Whale Alerts In Today's Session | Top Wall Street Bets Mentions for Thursday August 11, 2022 After-Hours: BBBY, GME, AMC, TSLA, BNGO, SDC, AAPL, ILMN, ASTS, AMD"
AMD,2022-08-12,Have Tech Stocks Bottomed? World's Largest Hedge Fund's Holdings Suggest Yes | This Is What Whales Are Betting On Advanced Micro Devices | Here's How Much $1000 Invested In Advanced Micro Devices 5 Years Ago Would Be Worth Today
AMD,2022-08-15,"Top Wall Street Bets Mentions This Weekend: BBBY, GME, AMC, TSLA, BBY, WMT, AAPL, AMD, VERU, TLRY | Saudi's Public Investment Fund Takes Share Stake Of 4.7M Shares In Advanced Micro Devices"
AMD,2022-08-16,"Saudi Public Investment Fund Picks Shares In Alphabet, Zoom, Microsoft | Looking At Advanced Micro Devices Recent Whale Trades"
AMD,2022-08-17,Advanced Micro Devices Shares Are Diving Lower Today: What's Happening?
AMD,2022-08-18,"Newegg Rolls Into CNE Gaming Garage Powered By AMD With Advanced Battlestations Gaming PC | Top Wall Street Bets Mentions for Thursday August 18, 2022 Since 9:30 AM AM ET Open: BBBY, GME, MNMD, AMC, AAPL, TSLA, AMD, BBY, FUBO, PRTY | Top 15 Trending Stocks On WallStreetBets As Of Thursday, August 18, 2022 (Via Swaggy Stocks)"
AMD,2022-08-19,"Qualcomm Eyes Server Market Again As Smartphone Market Cools Down; Amazon Could Be A Potential Client | Top 15 Trending Stocks On WallStreetBets As Of Friday, August 19, 2022 (Via Swaggy Stocks) | 10 Information Technology Stocks Whale Activity In Today's Session"
AMD,2022-08-21,"Top Wall Street Bets Mentions This Weekend: BBBY, GME, AMC, TSLA, REV, PRTY, AAPL, BBY, AMD, NVDA"
AMD,2022-08-22,"Top Wall Street Bets Mentions for Monday August 22, 2022 After-Hours: BBBY, GME, AMC, APRN, TSLA, NVDA, PANW, REV, AMD, OXY"
AMD,2022-08-23,"Top Wall Street Bets Mentions for Tuesday August 23, 2022 Since 9:30 AM ET Open: BBBY, AMC, GME, OXY, TSLA, AAPL, APRN, NVDA, AMD, REV | 10 Information Technology Stocks With Whale Alerts In Today's Session"
AMD,2022-08-24,"Ansys And AMD Collaborate To Speed Simulation Of Large Structural Mechanical Models Up To 6x Faster | Top Wall Street Bets Mentions for Wednesday August 24, 2022 Pre-Market: BBBY, GME, AMC, NVDA, TSLA, OXY, SOFI, BBY, PTON, AMD | 'AMD to ramp up 5nm chip production at TSMC in 2H22' - DigiTimes | Is Fisker Ready To Re-Emerge As The Tesla Killer? | Top 15 Trending Stocks On WallStreetBets As Of Wednesday, August 24, 2022 (Via Swaggy Stocks) | Looking At Advanced Micro Devices's Recent Whale Trades | Top Wall Street Bets Mentions for Wednesday August 24, 2022 After-Hours: NVDA, BBBY, GME, SNOW, CRM, TSLA, AMD, PTON, AMC, ADSK"
AMD,2022-08-25,"Top Wall Street Bets Mentions for Thursday August 26, 2022 Pre-Market: BBBY, TSLA, GME, NVDA, PTON, AMD, PLUG, AMC, LNG, BBY | A Look At Advanced Micro Devices (AMD) As The Stock Piggybacks Nvidia On Post-Earnings Surge | Top 15 Trending Stocks On WallStreetBets As Of Thursday, August 25, 2022 (Via Swaggy Stocks)"
AMD,2022-08-26,Why AMD And Nvidia Shares Are Diving Today | AMD And 2 Other Stocks Insiders Are Selling
AMD,2022-08-29,"$1000 Invested In Advanced Micro Devices 20 Years Ago Would Be Worth This Much Today | Top Wall Street Bets Mentions for Monday August 29, 2022 Since 9:30 AM ET Open: BBBY, GME, AAPL, BBY, TSLA, GSAT, AMD, OXY, AMC, ASTS | Top Wall Street Bets Mentions for Monday August 29, 2022 Premarket: BBBY, GME, BBIG, TSLA, AMC, AMD, GOOD, BBY, AAPL, ASTS | $1000 Invested In Advanced Micro Devices 20 Years Ago Would Be Worth This Much Today | Top Wall Street Bets Mentions for Monday August 29, 2022 Since 9:30 AM ET Open: BBBY, GME, AAPL, BBY, TSLA, GSAT, AMD, OXY, AMC, ASTS | Top Wall Street Bets Mentions for Monday August 29, 2022 Premarket: BBBY, GME, BBIG, TSLA, AMC, AMD, GOOD, BBY, AAPL, ASTS | Marvell Technology's Macro, Inflation Headwinds Prompt 5% Price Target Cut By Citi | 10 Information Technology Stocks Whale Activity In Today's Session"
AMD,2022-08-30,"AMD's 5nm Desktop Ryzen 7000 Launch Would Help It Gain Market Share, Analysts Say | 10 Information Technology Stocks Whale Activity In Today's Session"
AMD,2022-08-31,"Top Wall Street Bets Mentions for Wednesday August 31, 2022 Since 9:30 AM ET Open: BBBY, GME, AMC, SNAP, TSLA, AAPL, META, AMD, NVDA, CRWD | Top 15 Trending Stocks On WallStreetBets As Of Wednesday, August 31, 2022 (Via Swaggy Stocks) | Top Wall Street Bets Mentions for Wednesday August 31, 2022 After-Hours: BBBY, NVDA, GME, AMD, SNAP, AMC, AAPL, BBY, TSLA, OKTA"
AMD,2022-09-01,"Nvidia, AMD Shares Tumble As US Slaps Export Curbs on Top AI Chips To China: What's At Risk Here? | Why NVDA, AMD Shares Are Plunging Today | Why Nutanix Is Trading Higher By 16%; Here Are 33 Stocks Moving Premarket | Nasdaq Futures Slump As Nvidia China News Brings Tech-Sector Jitters, Investors Cautious Ahead Of Friday's Jobs Report | Arm, Qualcomm Engage In Legal Fight Over The Latter's Nuvia Acquisition | NVIDIA, Hormel Foods, Rio Tinto And Some Other Big Stocks Moving Lower In Today's Pre-Market Session | Top Financial Stories Thursday, September 1: Netflix Weighs Charging High Sum For Ads, Self Harm posts Grow On Twitter, California Fast-Food Bill Faces Industry Backlashâ€¦ | Why Is AMD Stock Down Today? | Top Wall Street Bets Mentions for Thursday September 1, 2022 Premarket: BBBY, GME, NVDA, AMC, AMD, AAPL, TSLA, ASTS, NEGG, SOXL | Benzinga Pro's Top 5 Stocks To Watch For Thursday, Sept. 1, 2022: NVDA, GME, SNOW, COUP, HPCO | China News Starts The Month Of September On A Negative Note | This Is What Whales Are Betting On Advanced Micro Devices | 10 Information Technology Stocks With Whale Alerts In Today's Session | Top 15 Trending Stocks On WallStreetBets As Of Thursday, September 1, 2022 (Via Swaggy Stocks) | Top Wall Street Bets Mentions for Thursday September 1, 2022 After-Hours: BBBY, GME, NVDA, LULU, AMC, AMD, AAPL, TSLA, ASTS, AVGO"
AMD,2022-09-02,"Why Okta Is Trading Lower By Over 32%, Here Are 58 Stocks Moving In Thursday's Mid-Day Session | Okta, NVIDIA, MongoDB And Other Big Losers From Thursday | Why Snap Shares Jumped 7%; Here Are 75 Biggest Movers From Yesterday | US Restriction On Nvidia, AMD Selling Chips To China Poses Structural Risk For Semiconductor Industry, Analyst Says | Top Wall Street Bets Mentions for Friday September 2, 2022 Since 12:00 AM ET: BBBY, GME, NVDA, AMC, LULU, TSLA, AMD, AAPL, ASTS, WISH | Why Advanced Micro Devices, Nvidia Are Flailing Despite US Relaxing Export Rules | Top 15 Trending Stocks On WallStreetBets As Of Friday, September 2, 2022 (Via Swaggy Stocks)"
AMD,2022-09-06,China Pledges To Consolidate Tech R&D Position As US Continue To Slap Restrictions
AMD,2022-09-07,Check Out What Whales Are Doing With AMD
AMD,2022-09-08,"Stifel Initiates Coverage On Advanced Micro Devices with Buy Rating, Announces Price Target of $122 | US Stock Futures Edge Lower; Fed's Powell Speech In Focus | What 22 Analyst Ratings Have To Say About Advanced Micro Devices | Benzinga's Top Ratings Upgrades, Downgrades For September 8, 2022 | Top Wall Street Bets Mentions for Thursday September 8, 2022 Since 9:30 AM ET Open: BBBY, GME, TSLA, AAPL, BYND, AMD, GSAT, ZIM, FUBO, SNAP | Ten Stocks Trending on Discord for Thursday September 8, 2022: PIXY, IMRA, RUBY, AMD, GSAT, APRN, NEXI, ISEE, AVCT, PPBT | 10 Information Technology Stocks With Whale Alerts In Today's Session"
AMD,2022-09-09,"How Do Chipmakers Avoid The China Bans? Nvidia Might Have Something Up Its Sleeve | 10 Information Technology Stocks Whale Activity In Today's Session | President Biden Tweets ""Folks, we need to make microchips here in America to bring down everyday costs and to create jobs. That's what the CHIPS and Science Act does."" | Top 15 Trending Stocks On WallStreetBets As Of Friday, September 9, 2022 (Via Swaggy Stocks)"
AMD,2022-09-11,"Top Wall Street Bets Mentions This Weekend: BBBY, GME, TSLA, AMC, ASTS, AMD, GSAT, AAPL, WISH, PLTR"
AMD,2022-09-12,"Chip Wreck Ahead? Biden Administration Said To Be Mulling More Curbs On Semiconductor, Tool Exports To China | 10 Information Technology Stocks Whale Activity In Today's Session"
AMD,2022-09-13,Here's Why AMD Shares Are Falling | 10 Information Technology Stocks Whale Activity In Today's Session | Here's Why AMD Shares Are Falling | 10 Information Technology Stocks Whale Activity In Today's Session
AMD,2022-09-14,"Tesla, Meta, NVIDIA And Other Big Losers From Tuesday | 10 Information Technology Stocks Whale Activity In Today's Session | Advanced Micro Devices Whale Trades Spotted"
AMD,2022-09-15,"Mizuho Maintains Buy on Advanced Micro Devices, Lowers Price Target to $125 | This Analyst Slashes Price Target On AMD, NVIDIA; Also Check Out Other Major PT Changes Here | 10 Information Technology Stocks Whale Activity In Today's Session | Nvidia Analyst Reverses Course A Week After China Ban Workaround Speculation"
AMD,2022-09-16,$100 Invested In This Stock 15 Years Ago Would Be Worth $600 Today
AMD,2022-09-18,A Look At Chipmakers In The Wake Of The Ethereum Merge. Is There Still Demand For Graphics Cards?
AMD,2022-09-19,"10 Information Technology Stocks With Whale Alerts In Today's Session | Top 15 Trending Stocks On WallStreetBets As Of Monday, September 19, 2022 (Via Swaggy Stocks) | What Should Nvidia Reveal At The GTC Conference? Citi Analyst Lays Down Expectations | What Are Whales Doing With Advanced Micro Devices"
AMD,2022-09-20,"AMD CEO To Visit Taiwan In Early October;  AMD Chairman And CEO Lisa Su Will Arrive In Taiwan In Early October To Meet Suppliers Including TSMC And ASE Technology, According To Industry Sources - AMD Digitimes"
AMD,2022-09-21,"What's Going On With AMD And Nvidia Shares | Shares of semiconductor companies were trading higher as the market reacts to the Fed's decision to hike rates by 75 bps. The Fed also issued outlook on inflation, unemployment and economic growth."
AMD,2022-09-22,"This Chipmaker Stock Has A Better 5-Year Return Than Bitcoin, Ethereum, Amazon, Apple, Nvidia, Microsoft, Ford And Starbucks | 10 Information Technology Stocks Whale Activity In Today's Session | Stocks That Hit 52-Week Lows On Thursday"
AMD,2022-09-23,"Morgan Stanley Maintains Overweight on Advanced Micro Devices, Lowers Price Target to $95 | Accenture Price Target Cut By This Analyst, Plus Deutsche Bank Predicts $483 For FactSet Research | Spero Therapeutics To Rally Around 240%? Plus This Analyst Slashes PT On Salesforce | What's Going On With Nvidia And AMD Shares Getting Hammered This Week | Ten Stocks Trending on Discord for Friday September 23, 2022: AVCT, ATHX, SPRO, AAPL, AMD, SAVA, TELL, ATXI, CSCW, CANO | Looking For An Entry To Trade Semiconductors Bearish? This ETF Offers 3X Leverage"
AMD,2022-09-26,"Advanced Micro Devices Whale Trades For September 26 | 10 Information Technology Stocks With Whale Alerts In Today's Session | Top 15 Trending Stocks On WallStreetBets As Of Monday, September 26, 2022 (Via Swaggy Stocks)"
AMD,2022-09-27,"AMD Launches Ryzen Embedded V3000 Series Processors Delivering New Levels Of Performance And Power Efficiency For ""Always-On"" Storage And Networking; New Processors Offer Up To 124% Greater CPU Performance; 50% Improved Memory Transfer Rate | Newegg Announces Availability Of AMD Ryzen 7000 Series Desktop Processors With 'Zen 4' Architecture | 10 Information Technology Stocks Whale Activity In Today's Session | Keysight, F5 and AMD Collaborate to Demonstrate 5G Terabit Scale Traffic at Mobile World Congress Las Vegas | Top 15 Trending Stocks On WallStreetBets As Of Tuesday, September 27, 2022 (Via Swaggy Stocks) | Mercury introduces its flagship Model 5560 FPGA co-processing board powered by AMD Xilinx Versal technology"
AMD,2022-09-28,"If You Invested $1,000 In Tesla, AMD, Nvidia, Apple, Microsoft, Amazon And Plug Power Shares 10 Years Ago, Here's How Much You'd Have Now | Check Out What Whales Are Doing With AMD | What's Going On With AMD And Nvidia Shares | Top 15 Trending Stocks On WallStreetBets As Of Wednesday, September 28, 2022 (Via Swaggy Stocks)"
AMD,2022-09-29,"What's Going On With AMD And Nvidia Shares | Stocks That Hit 52-Week Lows On Thursday | Top 15 Trending Stocks On WallStreetBets As Of Thursday, September 29, 2022 (Via Swaggy Stocks)"
AMD,2022-09-30,"Prominent Apple, Tesla Analyst Warns Of More Pain For US Stocks In Coming Months | Top 15 Trending Stocks On WallStreetBets As Of Friday, September 30, 2022 (Via Swaggy Stocks) | $100 Invested In This Stock 10 Years Ago Would Be Worth $2,100 Today | 10 Information Technology Stocks With Whale Alerts In Today's Session | Top Wall Street Bets Mentions for Friday September 30, 2022: TSLA, GME, BBBY, AAPL, NKE, AMD, AMC, META, PLTR"
AMD,2022-10-01,Why AMD Shares Fell Sharply This Week
AMD,2022-10-03,"If You Invested $1000 In This Stock 20 Years Ago, You Would Have $18,000 Today | If You Invested $1000 In This Stock 20 Years Ago, You Would Have $18,000 Today | Ten Stocks Trending on Discord for Monday October 3, 2022: FNHC, AVCT, TSLA, AAPL, ADTX, ATXI, APRN, AMD, CSCW, MYOV | Top Wall Street Bets Mentions for Monday October 3, 2022: TSLA, GME, AAPL, BBBY, PBR, AMC, META, DSL, AMD, UBS | Top 15 Trending Stocks On WallStreetBets As Of Monday, October 3, 2022 (Via Swaggy Stocks) | What's Going On With AMD And Nvidia Shares"
AMD,2022-10-04,"Meta Launches AI Software Tools Offering Flexibility Between NVIDIA & AMD Chips | Goldman Sachs Maintains Buy on Advanced Micro Devices, Lowers Price Target to $88 | Russia Fines TikTok, Amazon's Twitch, India Exported $1B iPhones, Sony Eyes Investment For PC & Mobile Push: Top Stories Tuesday, Oct. 04 | What's Going On With AMD And Nvidia Shares | This Is What Whales Are Betting On Advanced Micro Devices | Top Wall Street Bets Mentions for Tuesday October 4, 2022: TSLA, TWTR, GME, AAPL, BBBY, AMC, AMD, NFLX, NEGG, COIN | EXCLUSIVE: Top 10 Stocks Searched On Benzinga Pro In September: Where Do Tesla, Apple, Bed Bath & Beyond Rank? | Top 15 Trending Stocks On WallStreetBets As Of Tuesday, October 4, 2022 (Via Swaggy Stocks)"
AMD,2022-10-05,"Wells Fargo Maintains Overweight on Advanced Micro Devices, Lowers Price Target to $90 | Why AMD Shares Are Falling | 2 NASDAQ earning reports to watch in October | Top 15 Trending Stocks On WallStreetBets As Of Wednesday, October 5, 2022 (Via Swaggy Stocks) | YMTC Ban Likely A Plus For Micron & Western Digital, While A Minus For AMD & NVIDIA, Analyst Says | AMD shares were trading lower after Wells Fargo lowered its price target on the stock from $130 to $90."
AMD,2022-10-06,"10 Information Technology Stocks With Whale Alerts In Today's Session | NBC Reporter Mike Memoli Tweets 'Biden Said Chips Act Is In Both Economic And National Security Interests Of U.S. Notes That Chinese Communist Party Lobbied Against Its Passage, ""And Unfortunately, Some Of Our Friends On The Other Team Bought It""' | President Biden Tweets From POTUS Account ""America Is Going To Lead The Way In Microchip Manufacturing"" | Top 15 Trending Stocks On WallStreetBets As Of Thursday, October 6, 2022 (Via Swaggy Stocks) | U.S. To Announce New Measures That Will Effectively Halt Some Exports Of U.S. Equipment To Chinese Firms Making Advanced NAND And Dram Memory Chips | AMD Sees Q3 2022 Revenue ~$5.6B Vs $7.02B Est; Lowered From $6.7B Prior | AMD Says The PC Market Weakened Significantly In The Quarter | Why AMD Shares Are Falling During Thursday's After-Hours Session | Why Nvidia Shares Are Falling During Thursday's After-Hours Session | Why Intel Shares Are Falling During Thursday's After-Hours Session"
AMD,2022-10-07,"Samsung Shares Slide As Much As 2% On Bleak Q3 Profit View: Here's Its Sales Forecast | Keybanc Maintains Overweight on Advanced Micro Devices, Lowers Price Target to $100 | Why AMD Shares Are Nose-Diving On Friday | AMD, Tilray Brands And 3 Stocks To Watch Heading Into Friday | US Stock Futures Mixed; All Eyes On Jobs Report | Piper Sandler Maintains Overweight on Advanced Micro Devices, Lowers Price Target to $90 | Barclays Maintains Equal-Weight on Advanced Micro Devices, Lowers Price Target to $68 | Raymond James Maintains Strong Buy on Advanced Micro Devices, Lowers Price Target to $100 | Nasdaq, S&P Futures Show Indecision Ahead Of Jobs Data â€” AMD, Peers, Credit Suisse, Cannabis Stocks In Focus | Morgan Stanley Maintains Overweight on Advanced Micro Devices, Lowers Price Target to $86 | Benchmark Maintains Buy on Advanced Micro Devices, Lowers Price Target to $95 | Truist Securities Maintains Hold on Advanced Micro Devices, Lowers Price Target to $70 | Why Avenue Therapeutics Is Trading Lower By 59%; Here Are 31 Stocks Moving Premarket | Wells Fargo Maintains Overweight on Advanced Micro Devices, Lowers Price Target to $85 | Baird Maintains Neutral on Advanced Micro Devices, Lowers Price Target to $65 | Mizuho Maintains Buy on Advanced Micro Devices, Lowers Price Target to $102 | 12 Information Technology Stocks Moving In Friday's Pre-Market Session | Stifel Maintains Buy on Advanced Micro Devices, Lowers Price Target to $100 | B of A Securities Maintains Buy on Advanced Micro Devices, Lowers Price Target to $90 | Watching AMD; Hearing The Street Upgrades To Neutral, Sets $65 Price Target | Craig-Hallum Maintains Buy on Advanced Micro Devices, Lowers Price Target to $76 | Samsung Shares Slide As Much As 2% On Bleak Q3 Profit View: Here's Its Sales Forecast | Keybanc Maintains Overweight on Advanced Micro Devices, Lowers Price Target to $100 | Why AMD Shares Are Nose-Diving On Friday | AMD, Tilray Brands And 3 Stocks To Watch Heading Into Friday | US Stock Futures Mixed; All Eyes On Jobs Report | Piper Sandler Maintains Overweight on Advanced Micro Devices, Lowers Price Target to $90 | Barclays Maintains Equal-Weight on Advanced Micro Devices, Lowers Price Target to $68 | Raymond James Maintains Strong Buy on Advanced Micro Devices, Lowers Price Target to $100 | Nasdaq, S&P Futures Show Indecision Ahead Of Jobs Data â€” AMD, Peers, Credit Suisse, Cannabis Stocks In Focus | Morgan Stanley Maintains Overweight on Advanced Micro Devices, Lowers Price Target to $86 | Benchmark Maintains Buy on Advanced Micro Devices, Lowers Price Target to $95 | Truist Securities Maintains Hold on Advanced Micro Devices, Lowers Price Target to $70 | Why Avenue Therapeutics Is Trading Lower By 59%; Here Are 31 Stocks Moving Premarket | Wells Fargo Maintains Overweight on Advanced Micro Devices, Lowers Price Target to $85 | Baird Maintains Neutral on Advanced Micro Devices, Lowers Price Target to $65 | Mizuho Maintains Buy on Advanced Micro Devices, Lowers Price Target to $102 | 12 Information Technology Stocks Moving In Friday's Pre-Market Session | Stifel Maintains Buy on Advanced Micro Devices, Lowers Price Target to $100 | B of A Securities Maintains Buy on Advanced Micro Devices, Lowers Price Target to $90 | Watching AMD; Hearing The Street Upgrades To Neutral, Sets $65 Price Target | Craig-Hallum Maintains Buy on Advanced Micro Devices, Lowers Price Target to $76 | AMD Faces Price Target Cuts By Analysts Following Revenue Warning, Shares Tumble | Why AMD Shares Are Falling | Deutsche Bank Maintains Hold on Advanced Micro Devices, Lowers Price Target to $80 | Constellation Brands To Rally 21%? Plus Wells Fargo Predicts $225 For Visa | AMD, Samsung's Warnings Underline Looming Tech Slowdown â€” But This Analyst Sees Pockets Of Strength | JP Morgan Maintains Neutral on Advanced Micro Devices, Lowers Price Target to $80 | Why Intel Shares Are Falling After AMD News | Levi Strauss, Tilray Brands And Some Other Big Stocks Moving Lower On Friday | U.S. Chipmaking Software, Tools And Technology Are Fueling The Chinese Military's Modernization, Including The Development Of Weapons Of Mass Destruction - Senior U.S. Official | Why Apple Shares Are Falling | Why Aehr Test Systems Shares Are Trading Higher By Over 19%, Here Are 51 Stocks Moving In Friday's Mid-Day Session | Why Taiwan Semiconductor Manufacturing Shares Are Falling After AMD News | 10 Information Technology Stocks Whale Activity In Today's Session | Ten Stocks Trending on Discord for Friday October 7, 2022: NVIV, AMD, TOPS, ADTX, TLRY, ATXI, TSLA, AAPL, CANO, AEHR | Top Wall Street Bets Mentions for Friday October 7, 2022: TLRY, AMD, TSLA, GME, NVDA, BBBY, AAPL, SNDL, TWTR, MSOS | AMD Analysts Cut Price Targets After Chipmaker Lowers Guidance, But 'Long-Term Opportunity' Remains | Stocks That Hit 52-Week Lows On Friday | Why Micron Shares Are Falling After AMD News"
AMD,2022-10-09,Why AMD Shares Fell Sharply This Week
