Ticker,Date,headline
META,2015-01-03,10 Of The Most Popular Stocks In 2014
META,2015-01-04,Facebook Vs. Twitter: Who Will Win The Battle For Sports Video?
META,2015-01-05,"Bank of America Maintains Buy on Facebook, Raises PT to $91.00 | UPDATE: Bank of America Reiterates Buy Rating, Raises PT on Facebook as Market Share Trends Remain Positive | Survey: Internet Competitors' Places Hold Steady In Q4 | Analyst: Small-Cap Internet Stocks Could Outperform In 2015 | TD Ameritrade's Investment Movement Index Rises In December | Facebook Buys Wit.AI | Wit.ai Blog Post Confirms Purchase by Facebook | Benzinga's M&A Chatter for Monday January 5, 2015"
META,2015-01-06,"Facebook Acquires Natural Language Developer Wit.ai | Document Security Systems Offers Litigation Update: Says US District Court for Northern District of California Issued Order Granting Summary Judgment to Defendants LinkedIn, Facebook | Facebook WhatsApp Has Reached 700M Monthly Active Users, 30B Messages Sent Per Day"
META,2015-01-07,"Facebook's WhatsApp Reaches 700 Million Users, Outranks All Other Platforms | Re/code Story Highlighting Facebook Updates Related to Video on Social: 'Facebook Reminds Video Makers That Facebook Video Is Really Big'"
META,2015-01-08,"Recode.com Sees Video On Facebook As 'Really Big' | Stifel Turns Bearish On Google, Downgrades To Hold | 'New Era:' Stifel Downgrades Google Inc., Priceline Group Inc. | Analyst: Internet Sector Values 'Not Compelling' | Quickfire.tv Site Currently Down; Bloomberg Reporting Facebook Has Purchased Co. for Undisclosed Amount"
META,2015-01-09,"Benzinga's M&A Chatter for Thursday January 8, 2015 | Mike Prospero: Facebook Acquiring QuickFire Networks Will Significantly Impact YouTube"
META,2015-01-12,"SunTrust's Bob Peck On Wearables: Consumers Will Adapt To New Technology | Mark Zuckerberg, Xiaomi CEO Discussed Potential Facebook Investment Xiamoi, According to Sources -Reuters | Credit Suisse's 4 Tech Stocks To Own And 4 To Avoid"
META,2015-01-13,Facebook Announces AMBER Alerts on Facebook | Apple Watch Buzz Opens New Business Opportunities | Is Facebook Still Trying To Build A Smartphone? | Three Stocks Trending On Twitter (And The Top Trades To Follow)
META,2015-01-14,"The Facebook Hustle | Cramer Advises His Viewers On Stocks In Their Portfolios | UPDATE: Credit Suisse Reiterates Outperform Rating, Raises PT on Facebook on Multiple Positive Factors | UPDATE: Pivotal Research Reiterates Buy Rating, Raises PT on Facebook on Model Updates Ahead of 4Q14 Earnings | 'Facebook At Work' to be Available in App Stores on Wednesday | UPDATE: Oppenheimer Reiterates Outperform Rating, Raises PT on Facebook on Higher Instagram Valuation & Lower Tax Assumptions | Pivotal Roundup On Q4 Model Updates For Facebook, Google, Salesforce, Twitter And Yahoo | Mark Zuckerberg Currently Speaking At Conference | Facebook's Mark Zuckerberg Has Said Co. Might Be Open to Colombia Purchase | Technical Traders On Facebook's Run To $100"
META,2015-01-15,Millicom International Cellular Partners with Facebook's Internet.org in Colombia
META,2015-01-16,"Facebook Q4 Will Be Strong, SunTrust Analyst Notes | Nomura: Buy Yahoo, Facebook, and Google | Facebook Acquires Web Design Firm Teehan+Lax; No Terms Disclosed | CLARIFACATION: Teehan+Lax Join Facebook; Facebook Did Not Acquire The Firm"
META,2015-01-17,"Weekly Tech Highlights: Elon Musk's Risky Decision, Google's Snow Problem And More"
META,2015-01-18,New Facebook Platforms Excite Investors (And Analysts On Wall Street)
META,2015-01-19,Options Action's Final Trade | Carter Worth's Facebook Inc Trade
META,2015-01-20,Facebook Testing Voice-to-Text With Messenger | From Facebook Newsroom: 'News Feed FYI: Showing Fewer Hoaxes' | Facebook Testing Voice-to-Text With Messenger | From Facebook Newsroom: 'News Feed FYI: Showing Fewer Hoaxes' | Facebook Created Economic Impact Of $227 Billion And 4.5 Million Jobs Last Year: Deloitte Study
META,2015-01-21,Alibaba's Technical Breakdown | Facebook Announces Whatsapp Web; Says Will Not Be Able to Provide Web Client to IOS Users Due to Apple Platform Limitations | WhatsApp Browser-Messaging Will Not Run On iOS
META,2015-01-22,"Hearing ITG Positive on Facebook | From Davos Conference: Facebook Says Internet Price Must Come Down To Get World Online | Societe Generale Initiates Coverage on Facebook at Sell, Announces $65.00 PT | Societe Generale: Facebook Inc. Headed For Face Plant?"
META,2015-01-23,"Blockchain Spreads Its Wings | Apple And Instagram Get Harsh On Marijuana Entrepreneurs | Deutsche Bank Previews Facebook Q4 Earnings, Remains In The 'Bull Camp' | Pacific Crest's Takeaways From Facebook's View Of 2015 Advertising Priorities (Notes From The AdExchanger Industry Preview Conference)"
META,2015-01-24,"Weekly Tech Highlights: Microsoft's Surprise Invention, Apple Watch Concerns And More"
META,2015-01-25,"Earnings Expectations For The Week Of January 26: Apple, Google, Microsoft And More"
META,2015-01-26,Coinbase Launches First Regulated BitCoin Exchange
META,2015-01-27,"Hackers Claiming Affiliation With Lizard Squad Take Credit for Facebook, Instagram Outages -Reuters | Apple, Facebook, Google To Face The Heat As Regulators Tighten Screws On Encrypted Messaging Services | Facebook To Enter The Office | Why Doesn't Apple Host Public Hackathons? | Mt. Gox Fades As New Exchanges Emerge"
META,2015-01-28,"Must Watch Stocks for January 28, 2015 | Earnings Scheduled For January 28, 2015 | Earning & Economic Calendar for Wednesday January 28, 2015 | Dan Nathan Sees Unusal Options Activity In Facebook Inc Ahead Of Earnings | Options Expert: Into Earnings, Facebook's Path of Least Resistance is Lower | Facebook Results: What Investors Should Watch Out For? | Former Hedge Fund Manager Cody Willard Says Facebook's Monetization Is More Important Than User Growth | TD Ameritrade's JJ Kinahan On Facebook Options Ahead Of Earnings | Mark Mahaney's Take On Alibaba And Facebook Ahead Of Their Earnings | Three Technical Traders Prepare For Facebook Earnings | Notable Earnings After The Close: FB, JEC, STLD, QCOM, FLEX | This Hedge Fund Manager Comments –Exclusively- On Negative Sentiment From Facebook Users And Unjustified Valuation | Facebook May Not Need To Prove WhatsApp Was Worth $19 Billion | What Twitter Is Saying About The Top Tech Stocks Amidst The Earnings Season | Facebook Reports Q4 Adj. EPS $0.54, Sales $3.85B vs $3.77B Est. | Facebook Reports MAU 1.39B as of Dec. 31st, Mobile MAU 1.19B | Facebook Shares Down ~3% Following EPS | UPDATE: Facebook May Be Lower On Impact Of Strong USD, Company Would Have Had Revenue Growth of 53% Instead Of The 49% Recorded | Facebook Earnings Conference Call To Begin At 5pm ET | Facebook Conference Call Begins | Facebook Says 1.39B People Use Facebook Each Month | FB Says Wants To Focus On Serving Everyone In World Now | FB Says Has Great Effect In Creating Value For Companies | FB Sandberg Says FB Has Capitalized On Shift To Mobile | FB CFO Wehner Now Speaking | Facebook Had An 'Incredible' Quarter But More Work Needs To Be Done | FB Wehner Says 2015 Total Revenue Will be 5% lower If Forex Rates Remain The Same | FB Wehner Says 2015 Focus Is To Continue Investing In Business | Must Watch Stocks for January 28, 2015 | Earnings Scheduled For January 28, 2015 | Earning & Economic Calendar for Wednesday January 28, 2015 | Dan Nathan Sees Unusal Options Activity In Facebook Inc Ahead Of Earnings | Options Expert: Into Earnings, Facebook's Path of Least Resistance is Lower | Facebook Results: What Investors Should Watch Out For? | Former Hedge Fund Manager Cody Willard Says Facebook's Monetization Is More Important Than User Growth | TD Ameritrade's JJ Kinahan On Facebook Options Ahead Of Earnings | Mark Mahaney's Take On Alibaba And Facebook Ahead Of Their Earnings | Three Technical Traders Prepare For Facebook Earnings | Notable Earnings After The Close: FB, JEC, STLD, QCOM, FLEX | This Hedge Fund Manager Comments –Exclusively- On Negative Sentiment From Facebook Users And Unjustified Valuation | Facebook May Not Need To Prove WhatsApp Was Worth $19 Billion | What Twitter Is Saying About The Top Tech Stocks Amidst The Earnings Season | Facebook Reports Q4 Adj. EPS $0.54, Sales $3.85B vs $3.77B Est. | Facebook Reports MAU 1.39B as of Dec. 31st, Mobile MAU 1.19B | Facebook Shares Down ~3% Following EPS | UPDATE: Facebook May Be Lower On Impact Of Strong USD, Company Would Have Had Revenue Growth of 53% Instead Of The 49% Recorded | Facebook Earnings Conference Call To Begin At 5pm ET | Facebook Conference Call Begins | Facebook Says 1.39B People Use Facebook Each Month | FB Says Wants To Focus On Serving Everyone In World Now | FB Says Has Great Effect In Creating Value For Companies | FB Sandberg Says FB Has Capitalized On Shift To Mobile | FB CFO Wehner Now Speaking | Facebook Had An 'Incredible' Quarter But More Work Needs To Be Done | FB Wehner Says 2015 Total Revenue Will be 5% lower If Forex Rates Remain The Same | FB Wehner Says 2015 Focus Is To Continue Investing In Business | Facebook Call In Q&A Segment | Wedbush Analyst Says Facebook Trading Down After Hours Due To Disappointing Ad Revenue | FB Says Will Grow By Improving Targeting Of Ads | FB Says Approach Is To Increase Quality, Targeting of Ads Not Quantity"
META,2015-01-29,"Keep an Eye on These 10 Stocks for January 29, 2015 | SunTrust's Bob Peck Reacts to Facebook Earnings | Benzinga's Top #PreMarket Losers | Deutsche Bank Says Facebook Is 'Hitting Strides' With Video | Analysts React Positively to Facebook Earnings | Morning Market Losers | UPDATE: Credit Suisse Reiterates Outperform Rating, Raises PT on Facebook Following Better-Than-Expected Results | Oppenheimer's $100 Price Target On Facebook Unchanged Following 'Solid Quarter' | Facebook's Not The Only Tech Giant Entering The Workplace | Why Facebook's Expenditure Is A Real Cause Of Concern For Its Investors | Yelp Shares Move Lower on Report of Launch of Facebook Place Tips | RBC's Mark Mahaney Cuts Facebook's Target Price, Still Considers The Company To 'Have One of The Best Growth Dynamics' | Analysts Are Baffled That Google 'Can't Beat An Earnings Report'"
META,2015-01-30,"CNBC's Stock Pops & Drops From January 29 | After Wild Earnings Week, How Do Big Tech Stocks Compare On Fundamentals? | Top Stories From The Week Ending January 30th"
META,2015-02-01,Cramer Gives His Opinion On Groupon Inc And International Business Machines Corp.
META,2015-02-02,"Facebook to Give Network Switch Orders to Taiwan White-Box Suppliers -DigiTimes | Facebook to Give Network Switch Orders to Taiwan White-Box Suppliers -DigiTimes | Cantor Fitzgerald Previews Twitter's Q4, Expects 'Solid' Results | Facebook Is Under Selling Pressure: A Technical Look"
META,2015-02-03,"Super Bowl Ad Winners And Losers | Robert Peck Asks If Twitter's 'Facebook Moment' Begun? | Marc Andreessen Sells 853,994 Shares of Facebook @$77.38/Share -Form 4"
META,2015-02-04,Facebook Files For Resale of Up to ~162.7M Shares of Class A Common Stock by Selling Shareholders | Will Facebook Be Next To Adopt Bitcoin? | Will Twitter Inc. (TWTR) Post a Q4 Earnings Surprise?
META,2015-02-05,Quantum Trading CIO: Gains in Twitter are Afoot | Google Search Is Twitter's Plan To Monetize 500 Million Logged Out Users | Meet The Twitter Investor Who Could Be Trading It Better Than Anyone Else
META,2015-02-06,"Twitter's Q4 Should Be 'Good,' But What About Q1 2015? | Here's Why Robert Peck Remains Bullish On Twitter Post Earnings | Should You Buy Social Media ETF on Solid LNKD,TWTR Earnings? - ETF News And Commentary | Prologis Announces Sale of 56 Acres To Facebook"
META,2015-02-08,Will Facebook And Twitter Takeover Google's Ad Business?
META,2015-02-09,"Facebook 'Likes' Real Estate - Buys Prologis, Inc. 56 Acre Menlo Science & Tech Park"
META,2015-02-10,"Will Monster Worldwide's (MWW) Earnings Surprise in Q4? | Delta Air Lines Says Facebook Page Was Compromised | Immersis Brings Virtual Reality To The Living Room | Delta Comments About Facebook On Website, Says No Other Accounts Were Compromised"
META,2015-02-11,"Why Even After Twitter's Spectacular Results, Facebook Is Still The Better Bet | Social Sentiment Alert: AOL Looks A Lot Like Twitter And LinkedIn | Facebook 13G Shows Vanguard Takes 5.07% Stake, Up From 4.66% On 09/30/2014 | Government Push For Cybersecurity Highlights Growing Demand | Facebook Reveals '6-Pack' Networking Tool To Replace Cisco Spine Switches In Data Centers, Will Enable Company To Cut Infrastructure Spending | Facebook Introduces Own Designs for Networking Equipment -DJ | UPDATE: Facebook Shares Spiking Lower | Why Snapchat Is Facebook's Biggest Fear?"
META,2015-02-12,Top Wall Street Execs To Gather At White House Cybersecurity Summit
META,2015-02-13,"Amended 13G: FMR LLC Increases Stake in Facebook From 6.22% In Sept. to 6.436% | Cyberark Software Ltd. Extends Gains; Others In Sector Move Up | Billionaire Jim Simons' Latest Trades | Appaloosa Files 13f: No Longer Holding Citigroup, Halliburton, Facebook, CBS Corp, Powershares QQQ Trust"
META,2015-02-17,"4 Stocks Wall St. Analysts Love This Year...And 4 They Don't | Marathon Patent Group's Wholly-Owned Subsidiary TLI Commun GmbH Files Patent Infringement Lawsuit Against Facebook In Germany | Tigress Financial Partners Says Twitter's Growth Trends A 'Concern,' Reiterates Neutral Rating | From 'Facebook for Business' Blog: 'Announcing new Product Ads on Facebook' | BLiNQ Media Accpected Into Facebook Marketing Partner Program | 13F Breakdown: Soros Fund Management"
META,2015-02-18,Who Will Develop The Netflix Of The Auto Industry? | What Steven Cohen Is Doing With His Personal Wealth | Stephen Mandel's Lone Pine Capital Loves Tech And Consumer Stocks: Check Out Its Q4 Portfolio
META,2015-02-19,"Samsung Acquired An Apple-Centric Startup To Change Mobile Payments, Surpass Apple Pay | 1 Reason Facebook Shares Are Exploding Today | Here's The Massive Valuation Moving Facebook Stock"
META,2015-02-20,"Fast Money Picks For February 20 | Facebook Shares Move to Premarket Highs on Mention of Cowen Note Saying Instagram Worth $33B | Zuckerberg: I'd Love To Work With Google, They Are A  Great Search Product | Fast Money Picks For February 20 | Facebook Shares Move to Premarket Highs on Mention of Cowen Note Saying Instagram Worth $33B | Zuckerberg: I'd Love To Work With Google, They Are A  Great Search Product | Cramer: Facebook Is Not An Expensive Stock, When You Are Talking About 2017 | Google's YouTube Set to Roll Out Kids App Next Week"
META,2015-02-21,Cowen And Company Analyst Explains The Firm Valued Instagram At $33 Billion
META,2015-02-23,"Fast Money Picks For February 23 | Option Alert: FB March $84 Call; 5,729 Contracts On Bid @ $0.49 | Why Apple And Facebook Are Making Big Bets On Virtual Reality? | Notable Option Activity For Feb 23: KSS, MWE, FB, PKG, CTIC, AMAT, LC | 'Technology Disruptors And The Future Of The Internet:' Cantor Provides A Look Forward (And Some Ideas For 2015)"
META,2015-02-24,"Cantor Fitzgerald's Top 3 Internet Stock Picks | Cantor Fitzgerald's Top 10 Internet Stock Themes In 2015 | From Facebook's Business Blog: 'Introducing Ads Manager App' and 'Thank You,' Says Now 2M Active Advertisers on Platform | Facebook Finds Resistance At Higher End Of 3-Month Range"
META,2015-02-25,"Untapt CEO Wants To Fully Automate Fintech Job Placement | How To Get A Piece Of Lyft, Spotify, Dropbox And Other Startups Before Their IPOs | Can Facebook End Google's Dominance In Online Advertising?"
META,2015-02-26,Pinterest To Prove Quality Trumps Quantity | Internet Regulation Vote Unlikely To End Net Neutrality Fight | The Massive Morgan Stanley Note Moving LinkedIn
META,2015-02-27,Fast Money Picks For February 27 | Cowen Group's  Of Trading: I'll Be Long Twitter And Short Facebook Because Twitter Is Overvalued | How Does Facebook Make Money? | Facebook Finds Resistance And Retreats | Chugg CEO: In Essence We Re-IPOed The Company
META,2015-02-28,Staggering User Statistics For 10 Top Social Media Platforms
META,2015-03-01,Whatcha Gonna Do When Hulkamania & Cenation Take Over Silicon Valley?
META,2015-03-02,"Axiom Initiates Coverage on Facebook at Buy, Announces $105.00 PT | Hearing Unconfirmed Market Chatter Sheryl Sandberg Will Replace Marissa Mayer as Yahoo CEO | Facebook's Zuckerberg Says At Mobile World Congress That Growing The Internet Is 'extensive work' | Facebook's Zuckerberg Saying 'people will pay for services' And That Facebook 'drives data use' | Facebook CFO Says Co. is Planning Strong Investment In Ad Services, Remains Focused On Whatsapp and Messenger Opportunities | Facebook's Sandberg Says At Conference That Video On Facebook Is 'exploding' | Facebook's Sheryl Sandberg Says Company Is Focused On Moving Toward More Oublic Usage. Mobile Adds Paying Off 'in a big way' | Net Neutrality Ruling Could Have A Ripple Effect | Zuckerberg: We Mean Something Different From Operators, When We Say We Want To Connect The World"
META,2015-03-03,Twitter Launches Video Embedding Feature | BlackBerry Is 'Catering To Entrepreneurs' As They Move Away From Android | Axiom: Facebook Is Worth $105/Share | Hearing Facebook May Be Working on Competitor to Twitter's MoPub
META,2015-03-05,Yahoo at 20 | Mark Cuban: Current Tech Bubble Even Worse Than Dot-Com Bubble | Alibaba Shareholders Bracing For First Major Lockup Expiration | Is Mark Cuban Right About 2015's Tech Bubble?
META,2015-03-06,"Is Google Undervalued? Analysts Weigh In | Apple Allowing Companies to Test Watch Apps Before Launch -Bloomberg | Munster Sees 'Real Catalysts' for Facebook Coming in 2017, Highlights Instagram | 'In General, Facebook Still Under Monetizes Ads,' According to Munster | Citigroup 'Deep Dive's' In To Google, Says Company An 'Enigma'"
