Ticker,Date,headline
MSFT,2025-01-01,"Industry Comparison: Evaluating Microsoft Against Competitors In Software Industry | 10 Information Technology Stocks With Whale Alerts In Today's Session | Warren Buffett Says Buy S&P 500, But This Tech Investor Warns Of A 'Rude Awakening'"
MSFT,2025-01-02,"Nvidia's Investments In Elon Musk's xAI, Perplexity, OpenAI, And Other Startups Crossed $1 Billion Mark In 2024 | Alibaba Leverages Scale and Deep Pockets to Slash AI LLM Prices To Gain Market Share | Broadcom Thrives with 114% Stock Surge in AI Boom, While Intel Faces Steep Decline | Comparing Microsoft With Industry Competitors In Software Industry | World's Top 10 Richest People Gained More Wealth In 2024 Than Costco And Nike's Combined Valuation: How Elon Musk, Warren Buffett And Others Fared | Elon Musk Gets Support From 'Godfather Of AI' Geoffrey Hinton In Battle Against OpenAI"
MSFT,2025-01-03,"Jim Cramer Warns 'Day Is Not Near Enough To Justify The Current Valuations' Of Quantum Computing, Nuclear Power Stocks | Microsoft's Copilot Plus Set To Expand To Mini PCs At CES As Windows-Maker Looks To Take On Apple's Mac Mini | Bill Gates And Jeff Bezos Backed Mining Startup Raises $537 Million, Targets Going Public In Few Years | Top 10 Trending Stocks On WallStreetBets As Of January 3, 2025 (Via Swaggy Stocks) | Apple, Microsoft, Nvidia Push Vanguard's Low-Cost S&P 500 ETF Higher | Nvidia's $2 Trillion AI Rally In 2024 Fueled by Chips, Startups, and Robotics"
MSFT,2025-01-04,"Microsoft To Invest $80 Billion In AI Data Centers For Fiscal 2025 | EXCLUSIVE: Top 20 Most-Searched Tickers On Benzinga Pro In 2024 — Where Do Tesla, Nvidia, GameStop, Trump Media Stocks Rank? | Consumer Tech News (Dec 30-Jan 3): Apple Stops Selling iPhone 14, iPhone 14 Plus, iPhone SE, Trump Seeks A 'Political Resolution' Of TikTok Ban & More | Microsoft Highlights 6 AI Trends For 2025"
MSFT,2025-01-05,"Microsoft's $80 Billion Investment Outlay, Musk's Battle With OpenAI, And Nvidia's Billion-Dollar Bet: This Week In Artificial Intelligence"
MSFT,2025-01-06,"Microsoft Pauses Construction On $3.3 Billion Data Center Expected To Be Used By ChatGPT-Parent OpenAI For Massive Super Computer | Microsoft May Have Given Bitcoin a Miss, but Did You Know One of Its Largest Shareholders Is Betting Big on the Top Crypto? | Short-Seller Jim Chanos Warns Of Overbuilding Data Center Capacity, Compares AI Boom To Fiber Optic Bubble Of 2000s | Commercial Metals, Boeing And 3 Stocks To Watch Heading Into Monday | Piper Sandler Maintains Overweight on Microsoft, Raises Price Target to $520 | OpenAI CEO Sam Altman Says Company Losing Money On ChatGPT Pro Plan | AI Chip Stocks Nvidia, Broadcom, AMD, Taiwan Semi, Micron, Super Micro Surge Premarket: Whats Going On? | Inquiry Into Microsoft's Competitor Dynamics In Software Industry | Benzinga Market Summary: AI And Chip Stocks Rise Amid Microsoft AI Investment Plans, Fubo and Hulu + Live TV To Combine, Natural Gas Continues Higher | 10 Information Technology Stocks Whale Activity In Today's Session | AI, Quantum, And Robotics in Focus – All Eyes On Nvidia CEO Keynote | Israel Englander's Millennium Management Dumps Nvidia, Loads Up On Broadcom — Here's What The $70 Billion Hedge Fund Sees | AMD and Nvidia Overtake Intel in Key Markets, Challenging Its Leadership | Benzinga Market Summary: Bitcoin Rises, Trudeau To Resign As Liberal Party Leader, Tech Stocks Rise Amid CES 2025 And Microsoft AI Investment Plans"
MSFT,2025-01-07,"Ambarella Launches N1-655 edge GenAI System-On-Chip (SoC) To Support Large-Language Models | Software IP Licensor Ceva Says Its NeuPro-Nano Embedded AI NPUs Gain Traction In AIoT And MCU Markets | Taiwan Semiconductor Ramps Up Production in Japan, US, and Germany to Diversify Away from China | Nvidia Highlights AI Chips Powering PUBG, Robotics 'ChatGPT Moment,' Automotive Expansion And More At CES Event | Inquiry Into Microsoft's Competitor Dynamics In Software Industry | Microsoft Bets Big On India's AI Future With $3B Investment | 'AI Startup Anthropic Raising Funding Valuing it at $60 Billion' - WSJ | 3 Digital Infrastructure ETFs In Focus As Trump Reveals Billion-Dollar Data Center Construction Plan"
MSFT,2025-01-08,"Sony Was The First Japanese Company To List On US Markets, Co-Founder Akio Morita Championed 'Workers As Family' Philosophy — Does His Vision Still Resonate Today? | Amazon AWS To Invest $11 Billion In Georgia To Boost AI And Cloud Infrastructure: 'Expect To Create More Than 550 Well-Paying Jobs' | Sam Altman's Sister Files Lawsuit Against OpenAI CEO Alleging Sexual Abuse — Family Respond: 'Deeply Hurtful And Entirely Untrue' | OpenAI CEO Sam Altman Predicts AGI Will Arrive During The Trump Presidency, Says CHIPS Act Not Effective Enough | Jeff Bezos-Backed Anthropic Set To Become One Of The Top 5 US Startups As It Reportedly Eyes $60 Billion Valuation With $2 Billion Funding Round | Microsoft CEO Satya Nadella Draws Attention To AI-Powered Agriculture For 'Healthier, More Sustainable Harvests' Amid $80 Billion Investment Push | Dell Simplifies PC Lineup With Apple-Like Branding: XPS, Inspiron Brands Are Gone For Good | Nvidia Teams Up With MediaTek to Challenge Intel and AMD in Desktop CPU Market | Sony Was The First Japanese Company To List On US Markets, Co-Founder Akio Morita Championed 'Workers As Family' Philosophy — Does His Vision Still Resonate Today? | Amazon AWS To Invest $11 Billion In Georgia To Boost AI And Cloud Infrastructure: 'Expect To Create More Than 550 Well-Paying Jobs' | Sam Altman's Sister Files Lawsuit Against OpenAI CEO Alleging Sexual Abuse — Family Respond: 'Deeply Hurtful And Entirely Untrue' | OpenAI CEO Sam Altman Predicts AGI Will Arrive During The Trump Presidency, Says CHIPS Act Not Effective Enough | Jeff Bezos-Backed Anthropic Set To Become One Of The Top 5 US Startups As It Reportedly Eyes $60 Billion Valuation With $2 Billion Funding Round | Microsoft CEO Satya Nadella Draws Attention To AI-Powered Agriculture For 'Healthier, More Sustainable Harvests' Amid $80 Billion Investment Push | Dell Simplifies PC Lineup With Apple-Like Branding: XPS, Inspiron Brands Are Gone For Good | Nvidia Teams Up With MediaTek to Challenge Intel and AMD in Desktop CPU Market | Here's How Much $100 Invested In Microsoft 5 Years Ago Would Be Worth Today"
MSFT,2025-01-09,"Blackstone Invests $300 Million In AI Data Firm That Powers Elon Musk's xAI Supercomputer | Microsoft Plans To Slash Jobs Again: 'When People Are Not Performing, We Take The Appropriate Action' (UPDATED) | Inquiry Into Microsoft's Competitor Dynamics In Software Industry | 10 Information Technology Stocks With Whale Alerts In Today's Session | Bitcoin ETFs Quadruple SPY Returns, Magnificent 7 Plays Catch-Up"
MSFT,2025-01-10,Performance Comparison: Microsoft And Competitors In Software Industry | 10 Information Technology Stocks Whale Activity In Today's Session | Check Out What Whales Are Doing With MSFT | Semiconductor ETF Faces Key Resistance In AI-Driven Surge: Analyst
MSFT,2025-01-12,"Consumer Tech News (Jan 6-10): Microsoft Pauses Ambitious Data Center Project, Blackstone Makes $300 Million Investment In AI & More"
MSFT,2025-01-13,"Competitor Analysis: Evaluating Microsoft And Competitors In Software Industry | 'Microsoft Says Jay Parikh To Lead New Core AI – Platform And Tools Org' - Microsoft Blog | PUBG Developer Krafton Invests $136 Million in Game Studios, Expands AI Team for Future Gaming Innovations | Looking At Microsoft's Recent Unusual Options Activity | 'HCLTech and Microsoft expand partnership to revolutionise contact centers with Generative AI' - CNBC"
MSFT,2025-01-14,"Elon Musk Emerges As Potential TikTok US Buyer As Ban Deadline Looms, Company Terms It 'Pure Fiction' | Meta Investors Push Mark Zuckerberg To Replace $72B Cash With Bitcoin To Combat Inflation: Here's What It Means For Investors | US Semiconductor Sanctions Spell Trouble for Nvidia, But May Benefit Big Tech | Insights Into Microsoft's Performance Versus Peers In Software Sector | Pearson And Microsoft Announce Multi-Year Partnership To Transform The Future Of Learning And Work With AI | Microsoft Launches CoreAI Division: Ex-Meta Exec To Supercharge Copilot And AI Innovations | ""Microsoft Plans To Pause Hiring In Part Of Its Consulting Business In The U.S. According To An Internal Memo, As The Company Seeks Ways to Reel In Expenses"" -CNBC Report"
MSFT,2025-01-15,"Microsoft, Applied Digital, Rigetti Computing, Eli Lilly, Tesla: Why These 5 Stocks Are On Investors' Radars Today | QUBT, QBTS Up 12%, RGTI Gains 3% In Wednesday Premarket: Quantum Computing Stocks Gain Momentum After Microsoft Says 'We Are Right On The Cusp Of Seeing Quantum Computers Solve Meaningful Problems' | NVIDIA Announces First-Ever Quantum Day At GTC 2025, Days After Jensen Huang Said Quantum Computing Is 20 Years Away | Microsoft To Cut Costs, Pause Hiring In US Consulting, Tighten Spending | What's Going On With Quantum Computing Stock Today? | Understanding Microsoft's Position In Software Industry Compared To Competitors | 10 Information Technology Stocks Whale Activity In Today's Session | Trump Considers Executive Order To 'Save' TikTok From Being Banned In 4 Days"
MSFT,2025-01-16,"Elon Musk Buying TikTok Could Hurt Tesla Stock, Warns Gary Black — But Wedbush's Dan Ives Thinks It Makes Sense | French AI Startup, Founded By Google And Meta Veterans, Signs Million-Dollar Content Moderation Deal With AFP To Counter Big Tech's Pullback | Microsoft Launches 365 Copilot Chat For Business With Pay-As-You-Go Plan | Quantum Computing Stocks Continue Their Wild Surge In Thursday Premarket: QUBT Up 15%, QBTS Climbs 9%, RGTI Gains Over 3% | SentinelOne Brings The Power Of Purple AI To Zscaler, Okta, Palo Alto Networks, Proofpoint, Fortinet And Microsoft Data | Analyzing Microsoft In Comparison To Competitors In Software Industry | Meta Boosts Green Energy With New Solar Deal, Supports AI Data Center Growth | Bond Rally Drives Stock Market, Taiwan Semi Results Show AI Demand, Manipulators Having A Heyday With Quantum Computing | Billionaire Investor Who Predicted The Dot-Com Crash 25 Years Ago Warns Of Another Market Storm Brewing In The US | Nvidia Suffers $10 Billion Setback, AI Chip Sanctions Spell Trouble For 3 ETFs"
MSFT,2025-01-17,"Tesla's Drop Against Modestly Lower Nasdaq Comes As Investors Weigh Elon Musk's $40-50 Billion TikTok Deal, Gary Black Says TSLA Share Swap Unlikely Due To This Upcoming Milestone | Tesla's Drop Against Modestly Lower Nasdaq Comes As Investors Weigh Elon Musk's $40-50 Billion TikTok Deal, Gary Black Says TSLA Share Swap Unlikely Due To This Upcoming Milestone | Jim Cramer Questions Nvidia's Trading Pattern Amid Positive TSMC Earnings And Biden's China Export Regulations | Sony Cancels Two Live-Service Games, Stays Committed to Long-Term Monetization | Quantum Computing Stock Drops Over 3% During Friday Premarket Amid Fraud Allegations | Sector Crosscurrents Drive Potential Opportunities In Direxion's Tech Bull And Bear 3X ETFs | Taiwan Semi Chief To Skip Trump Inauguration, Calls US Semiconductor Sanctions 'Manageable' | Quantum Computing Stocks Are 'Totally Divorced From Reality,' Says Analyst Flagging Inflated Valuations | Cantor Fitzgerald Initiates Coverage On Microsoft with Overweight Rating, Announces Price Target of $509 | Market Analysis: Microsoft And Competitors In Software Industry | OpenAI's Sam Altman On o3-Mini Model, Says 'Have Now Finalized A Version And Are Beginning The Release Process; Planning To Ship In About A Couple Of Weeks'"
MSFT,2025-01-19,"Consumer Tech News (Jan 13-17): Meta Plans Performance Based Job Cuts, Youtuber MrBeast Aims To Buy TikTok To Prevent Shutdown & More | Nvidia's $10 Billion Setback, OpenAI Controversy, And Microsoft's AI Chat Launch: This Week In Artificial Intelligence | Peter Lynch's Advice: 'Don't Invest in a Company Before You Look At the Financials. If You Made It Through Fifth Grade, You Can Handle the Math' | Trump Said He Will Use Emergency Powers To Allow People To Build Big AI Plants | IonQ, H&E Equipment Services And ImmunityBio Are Among Top Mid Cap Gainers Last Week (Jan 13-Jan 17): Are The Others In Your Portfolio?"
MSFT,2025-01-20,Apple's Making Your Mac's Mail Much Smarter: Here's What's Coming | Comparative Study: Microsoft And Industry Competitors In Software Industry
MSFT,2025-01-21,"Huawei Wants To Take Nvidia's Place In AI In China, Shifts Focus to Inference Over Training | Evaluating Microsoft Against Peers In Software Industry | 10 Information Technology Stocks Whale Activity In Today's Session | Softbank CEO Masayoshi Son Is Expected At The White House Tuesday Afternoon, Along With Sam Altman Of OpenAI And Larry Ellison Of Oracle | 'Trump To Announce Private Sector AI Infrastructure Investment; OpenAI, Softbank And Oracle Are Planning A Joint Venture Called Stargate' - CBS News"
MSFT,2025-01-22,"Elon Musk Says Project Stargate Doesn't 'Actually Have The Money' After Trump Announces $500 Billion AI Investment Led By SoftBank, Oracle And OpenAI | US Stocks Likely To Open Higher As President Trump Announces $500 Billion AI Project: Oracle, Netflix, Nvidia Among Top Stocks To Watch | Morgan Stanley Maintains Overweight on Microsoft, Lowers Price Target to $540 | Forecasting The Future: 15 Analyst Projections For Microsoft | Anthropic Gains Big With Google Backing, Aims for $60 Billion Valuation and Surging AI Revenue | Tech Stocks Rise After Trump Announces AI Infrastructure Investment | Industry Comparison: Evaluating Microsoft Against Competitors In Software Industry | 'OpenAI Is Preparing To Release A New ChatGPT Feature This Week That Will Automate Complex Tasks Typically Done Through The Web Browser, Such As Making Restaurant Reservations Or Planning Trips, According To A Person With Direct Knowledge Of The Plans' - The Information | Stargate Adds Fuel To AI Frenzy, Chinese Stocks Sink On Trump Tariff Talk | OpenAI Tells Indian Court Any Order To Remove ChatGPT Training Data Inconsistent With Certain U.S. Obligations; Indian Courts Have No Jurisdiction To Hear Any Copyright Case Against OpenAI, Company Says | 'JPMorgan Lends $2.3B for Blue Owl-Tied Oracle Data Center' - Bloomberg News | 10 Information Technology Stocks With Whale Alerts In Today's Session | Microsoft Invests In Carbon Credits To Restore Amazon Rainforest, Faces Challenges From Data Center Growth, Trump's Fossil Fuel Focus | Marc Benioff Trashes Microsoft Copilot, Says Salesforce Is Becoming A Digital Labor Provider: 'This Is What AI Was Meant To Be' | SoftBank's Role in $500 Billion Stargate AI Venture Seen as Major Growth Driver, Analyst Says | Watching Kopin; Shares See Volume As Traders Circulate Article 'Army Kickstarts Possible Recompete Of Microsoft's $22 Billion IVAS Production Deal', ""Kopin Has Also Said It's Interested In Completing, While Companies Like Palantir May Also Be Eyeing A Bid."" | S&P 500 Hits Fresh Records At 6,100: Strong Earnings, Trump's AI Wager Fuel Bull Run | Christopher Young Informs Microsoft Of His Decision To Resign; He Will Cease To Serve As Executive Vice President, Business Development, Strategy, And Ventures, Effective Immediately - Filing"
MSFT,2025-01-23,"Microsoft's LinkedIn Hit With Lawsuit For Violating User Privacy, Allegedly Sharing Private Data For AI Model Training | Satya Nadella Stands Firm After Elon Musk Questions Stargate's $100 Billion Funding Potential: 'All I Know Is, I'm Good For My $80 Billion' | TikTok-Parent ByteDance Plans $12 Billion AI Chip Investment In 2025 To Bolster Global AI Ambitions Amid US Export Controls: Report | PLTR Stock Is Up 166% In Last 6 Months. Now Dan Ives Sees Room For 17% More Growth: 'Our Recent Checks And Growing Confidence…Is Key To The Bull Thesis' | Tesla, Nvidia ETFs In The Works To Tap Rising Interest In Same-Day Stock Options | Walmart Boosts Regional Manager Pay As Retailers Struggle To Find Leaders | Analyzing Microsoft In Comparison To Competitors In Software Industry | Stargate Project: Microsoft Gains, Oracle Waits, Data Centers Face Long-Term Questions | Salesforce's AI Agents Pivot Is Already Showing Results | President Trump Says We Need Double The Energy We Have In U.S. For AI To Be As Big As We Want It; Am Going To Give Emergency Declarations So Building Can Start; We Are Going To Allow Very Rapid Plant Building, They Can Fuel It With Anything They Want | Microsoft's LinkedIn Hit With Lawsuit For Violating User Privacy, Allegedly Sharing Private Data For AI Model Training | Satya Nadella Stands Firm After Elon Musk Questions Stargate's $100 Billion Funding Potential: 'All I Know Is, I'm Good For My $80 Billion' | TikTok-Parent ByteDance Plans $12 Billion AI Chip Investment In 2025 To Bolster Global AI Ambitions Amid US Export Controls: Report | PLTR Stock Is Up 166% In Last 6 Months. Now Dan Ives Sees Room For 17% More Growth: 'Our Recent Checks And Growing Confidence…Is Key To The Bull Thesis' | Tesla, Nvidia ETFs In The Works To Tap Rising Interest In Same-Day Stock Options | Walmart Boosts Regional Manager Pay As Retailers Struggle To Find Leaders | Analyzing Microsoft In Comparison To Competitors In Software Industry | Stargate Project: Microsoft Gains, Oracle Waits, Data Centers Face Long-Term Questions | Salesforce's AI Agents Pivot Is Already Showing Results | President Trump Says We Need Double The Energy We Have In U.S. For AI To Be As Big As We Want It; Am Going To Give Emergency Declarations So Building Can Start; We Are Going To Allow Very Rapid Plant Building, They Can Fuel It With Anything They Want | Sam Altman Posts On X ""big news: the free tier of chatgpt is going to get o3-mini! (and the plus tier will get tons of o3-mini usage)"" | Micron Technology Shares Are Falling: What's Going On?"
MSFT,2025-01-24,"Elon Musk Or Larry Ellison? Dan Ives On Who Could Win TikTok's Billion-Dollar Soap Opera: 'Someone Hand Picked From Beijing But Also Trump's White House' | Xbox Developer Direct Drops Big Surprises — Ninja Gaiden 4, Doom: The Dark Ages, And New Game Pass Titles: What You Need To Know | Nvidia, Microsoft, Or Oracle: Which Stock Among These Stargate AI Project Beneficiaries Are The Least Expensive To Own? | Tevogen Bio On Thursday Reported On Its Recent Fireside Chat With Microsoft Discussing The  Future Of AI-Driven Drug Development During the J.P. Morgan Healthcare Conference | OpenAI Wrestles With Microsoft Stake Valuation As It Looks To Transition To For-Profit Entity Amid Trump's $500 Billion Stargate AI Project: Report | OpenAI Debuts 'Operator' AI Agent That Performs Web Tasks, But Early Error Has Sam Altman Scrambling For A Quick Fix | Understanding Microsoft's Position In Software Industry Compared To Competitors | Guggenheim Reiterates Neutral on Microsoftto Neutral | Check Out What Whales Are Doing With MSFT | OpenAI Posts On X ""Canvas update: today we're rolling out a few highly-requested updates to canvas in ChatGPT...."" | 'Japan's SoftBank To Sound Out Apollo, Brookfield On Stargate Funding' - Nikkei | 'LinkedIn Takes Legal Action To Defend Member Privacy' - Pressroom"
MSFT,2025-01-25,"Benzinga Bulls And Bears: Amazon, Tesla, Meta And Dogecoin ETF Hopes Rise With New Fund Filing | Consumer Tech News (Jan 20-Jan 24): Trump Revokes Biden's AI Policies, Meta Launches New 'Edits' App To Lure TikTok Users & More"
MSFT,2025-01-26,Bill Gates: 'I Would Probably Be Diagnosed on the Autism Spectrum' if Growing Up Today | Remote Work Vs. Return-To-Office: Can Veeva's Flexibility Outshine JPMorgan's Office Mandate?
MSFT,2025-01-27,"Nvidia Stock Slides Overnight On Robinhood As China's DeepSeek Sparks Doubts Over GPU Spending Frenzy — Chamath Palihapitiya Highlights Report Indicating AI Holy Grail Cracked | Reported Friday, Tevogen Bio Expands Collaboration With Microsoft To Advance AI-Powered PredicTcell Technology On Azure | Nvidia, AMD, Broadcom, SMCI, TSMC And Other Tech Giants Lead Monday Pre-Market Selloff As Nasdaq 100 Futures Plummet Over 650 Points Amid Reports Of Chinese AI Startup DeepSeek Overtaking ChatGPT | Aurora Mobile Partners With China's DeepSeek To Boost AI Capabilities | Satya Nadella Said 'We Should Take Development Out Of China Very, Very Seriously.' Now, DeepSeek's R1 Has Emerged As A ChatGPT Killer, Outperforming OpenAI With 50x Lower Costs: Here's More | US Stock Futures Tumble As DeepSeek Buzz Jolts Big Tech: Expert Says The Chinese AI Model Is Yet To Prove Its Viability At Lower Cost In Long Term | Google Wants To Indulge In Workforce Training and Global Policy Discussions On AI | Top 10 Trending Stocks On WallStreetBets As Of January 27, 2025 (Via Swaggy Stocks) | In-Depth Analysis: Microsoft Versus Competitors In Software Industry | Market Clubhouse Morning Memo - January 27th, 2025 (Trade Strategy For SPY, QQQ, AAPL, MSFT, NVDA, GOOGL, META and TSLA) | China's DeepSeek AI Rattles Tech Stocks, Analyst Ives Says Market Plunge 'Golden Buying Opportunity' | What's Going On With Tevogen Bio Stock Today? | DeepSeek Sparks AI Carnage As Magnificent Seven, Broadcom Lose Nearly $900 Billion In Value: Why This Expert Is Still 'Bullish' On US Tech | DeepSeek Says Due To Large-Scale Malicious Attacks On DeepSeek's Services, We Are Temporarily Limiting Registrations To Ensure Continued Service | Trump's Executive Orders Fuel Tech, Weaken Energy Stocks In His First Week: Immigration, Tariff Reforms On Cards But Experts Say 'Don't Play Politics With Your Portfolio' (CORRECTED) | 10 Information Technology Stocks With Whale Alerts In Today's Session | DeepSeek R1 Vs. OpenAI: What Consumers Need To Know About AI's Latest Challenger | Taiwan Semiconductor Partners with MTR to Tackle Carbon Emissions | Piper Sandler Maintains Overweight on Microsoft, Maintains $520 Price Target"
MSFT,2025-01-28,"Amid Nvidia And Chinese AI Anxieties, Top Analyst Predicts Higher AI Infrastructure Demand Despite Market Jitters: 'The Market Is Overreacting To DeepSeek's Success' | Nvidia Says DeepSeek An 'Illustration' Of How New AI Models Can Be Created While Being Export-Control Compliant Amid $600 Billion Market Value Plunge | Chamath Palihapitiya Warns Of AI Shift: 'The Battle Is Now More About AI Inference Vs Training' As DeepSeek Sparks Nvidia Selloff | Amid Nvidia And Chinese AI Anxieties, Top Analyst Predicts Higher AI Infrastructure Demand Despite Market Jitters: 'The Market Is Overreacting To DeepSeek's Success' | Nvidia Says DeepSeek An 'Illustration' Of How New AI Models Can Be Created While Being Export-Control Compliant Amid $600 Billion Market Value Plunge | Chamath Palihapitiya Warns Of AI Shift: 'The Battle Is Now More About AI Inference Vs Training' As DeepSeek Sparks Nvidia Selloff | Fundstrat's Tom Lee Sees Nvidia's 17% Plunge As An 'Opportunity,' Calls Nasdaq's Over 600 Points Plunge Drop A Market 'Overreaction' | Microsoft's AI Revenue Set To Surpass $10 Billion: Piper Sandler Maintains Overweight Rating | Microsoft Eyes TikTok US Deal, Trump Says Acquisition Talks Are Underway | Microsoft Gears Up For Q2 Earnings: Will The Bullish Trend Hold? | 'OpenAI launches ChatGPT Gov for U.S. government agencies' - CNBC | Comparative Study: Microsoft And Industry Competitors In Software Industry | OpenAI Launches 'ChatGPT Gov' For US Agencies As DeepSeek Threat Heats Up AI Race | Wall Street Comes To Nvidia's Defense After Biggest Loss Ever, Many Momos Wiped Out | Microsoft Unusual Options Activity For January 28 | Should Astera Labs Investors Worry About DeepSeek? | 10 Information Technology Stocks Whale Activity In Today's Session | Not Just DeepSeek - Alibaba Unveils AI Model To Rival OpenAI's Operator | How DeepSeek's Breakthrough Is Changing The Landscape For Multi-Industrials | Sam Altman Posts On X ""next phase of the msft x oai partnership is gonna be much better than anyone is ready for!!"" | Microsoft, Amazon Web Services Could Face Cloud Services Investigation From UK Regulators | Microsoft Q2 Earnings Preview: Street 'Too Optimistic' On Near-Term AI Returns? | EXCLUSIVE: Will DeepSeek Hurt Magnificent 7 Stocks Valuation? 57% Say This | Magnificent 7 Earnings Ahead: 3 ETFs To Ride The Wave"
