,Ticker,Date,headline
31,MSFT,2025-03-06,"Microsoft Dodges UK Competition Crackdown Over OpenAI Deal, Watchdog Director Says Partnership Doesn't Get 'A Clean Bill Of Health' | Bitcoin, Ethereum Rise But A Spot ETF Filing Has Sent This L1 Token Flying 13% | Microsoft May Have Given Bitcoin Investments A Miss But A Large MSFT Stock Holder Is A Strong Crypto, Blockchain Advocate | BioNexus Stock Pops As It Embraces Ethereum-Focused Treasury Strategy, Says It Is First On Nasdaq To Do So | US Indicts 12 Chinese Nationals Over Alleged Global Hacking Operation Targeting Critics: '...Been Paying Hackers-For-Hire To Inflict Digital Harm On Americans' | Melinda French Gates Reveals An IBM Manager Inspired Her To Join Bill Gates Co-Founded 'Little Company' Microsoft | ChatGPT Parent OpenAI's Specialized AI Agents Could Cost Up To $20 Thousand Per Month: report | How To Trade SPY When Market Reacts To Key Catalysts | Apple's Foldable AI iPhone Could Cost Over $2,000, 20 Million Units Shipped By 2027: Analyst | In-Depth Analysis: Microsoft Versus Competitors In Software Industry | Microsoft Says To Invest Additional 5.4 Billion Rand In South Africa AI Infrastructure | SPY ETF Has Ruled For Decades, But Is It Still The Best Bet? | Bloomberg: 'OpenAI, Oracle Eye Nvidia Chips Worth Billions for Stargate Site'"
32,MSFT,2025-03-07,"Nvidia, Meta And Amazon-Backed Scale AI Reportedly Faces US Labor Probe Over Fair Pay Practices | Jim Cramer Says Market Isn't 'Oversold Enough' For A Powerful Bounce Back Led By Broadcom's Strong Earnings | Microsoft Pours $297 Million Into AI And Cloud Expansion In South Africa | ""Microsoft's AI Guru Wants Independence From OpenAI. That's Easier Said Than Done"" - The Information | Market Analysis: Microsoft And Competitors In Software Industry | 'U.S. Likely To Ban Chinese App DeepSeek From Government Devices' - Wall Street Journal | Stifel Maintains Buy on Microsoft, Lowers Price Target to $475 | 10 Information Technology Stocks Whale Activity In Today's Session | Nvidia, Meta And Amazon-Backed Scale AI Reportedly Faces US Labor Probe Over Fair Pay Practices | Jim Cramer Says Market Isn't 'Oversold Enough' For A Powerful Bounce Back Led By Broadcom's Strong Earnings | Microsoft Pours $297 Million Into AI And Cloud Expansion In South Africa | ""Microsoft's AI Guru Wants Independence From OpenAI. That's Easier Said Than Done"" - The Information | Market Analysis: Microsoft And Competitors In Software Industry | 'U.S. Likely To Ban Chinese App DeepSeek From Government Devices' - Wall Street Journal | Stifel Maintains Buy on Microsoft, Lowers Price Target to $475 | 10 Information Technology Stocks Whale Activity In Today's Session | 15 Analysts Assess Microsoft: What You Need To Know"
33,MSFT,2025-03-08,"Google's Monopoly Fight Just Got More Intense: Justice Department Reaffirms Plan To Split Up The Tech Giant In Historic Antitrust Battle | Amazon Execs Question Microsoft's Quantum Computing Breakthrough, Says It's Necessary To 'Push Back' Against Satya Nadella's Comments: Report | Benzinga Bulls And Bears: Broadcom, ChargePoint, BigBear.ai — And Tariff Whiplash Confounds Markets"
34,MSFT,2025-03-10,"Mark Zuckerberg's Meta Platforms A Lucrative Bet As 'Investors Favor Less Leveraged Tech Stocks,' Says Expert Amid Mag7's 2025 Underperformance | Alphabet's Legal Headache Isn't Going Away - And Apple Could Be The Wild Card, Says Analyst | Investigating Microsoft's Standing In Software Industry Compared To Competitors | 'OpenAI Signs 5-Year Cloud Computing Contract Worth $11.9BWith Coreweave, Sources Say' | What's Going On With Microsoft Shares Monday? | Magnificent 7 Sheds Over $750 Billion In Market Cap In One Day: Is Big Tech's Honeymoon Over? (CORRECTED)"
35,MSFT,2025-03-11,"Tesla's 101x Valuation Raises Alarm As Gordon Johnson Warns Of Sales Slump, Dan Ives Sees AI Upside Despite Elon Musk's DOGE Distractions | OpenAI Secures Near-$12 Billion CoreWeave Deal, Taking Stake In Cloud Firm Ahead Of $35 Billion IPO To Reportedly Reduce Microsoft Dependence | China Is 'Very Sneaky,' Will Source Nvidia Chips From 3rd Parties, Says Expert Amid Blackwell Chipmaker's 22% YTD Decline | Traders Await Pivotal February Inflation Data As Stagflation Fears Weigh On Wall Street: What To Expect | Assessing Microsoft's Performance Against Competitors In Software Industry | 'Google, Anthropic Discuss AI Data Security Deals With Snowflake, Databricks; Snowflake Is In Talks With Google About Making Its Gemini Models Available Securely For Customers To Build AI Applications; Snowflake Expects Deals For OpenAI And Anthropic Models To Boost Revenue' - The Information | $1000 Invested In Microsoft 15 Years Ago Would Be Worth This Much Today"
36,MSFT,2025-03-12,"Ronald Reagan Warned That Tariffs Destroy Prosperity — Trump Is Doubling Them Anyway, And Now US Tech Giants Like Apple And Nvidia Are Bracing For Impact | Microsoft Weighs Natural Gas With Carbon Capture For AI Data Centers, But Cost Is Key | AMD Gears Up For Breakout Year In Artificial Intelligence GPUs Business: Analyst | Warren Buffett Rakes In $607 Million While Elon Musk, Jeff Bezos, And Other Top Moneybags Bleed $67 Billion In A Day Amid Market Wipeout | Palantir CEO Becomes Top-Earning Tech Boss As AI Stock Soars 216%: Report | Microsoft Options Trading: A Deep Dive into Market Sentiment | Performance Comparison: Microsoft And Competitors In Software Industry | Magnificent 7 Stocks Add $250 Billion In Value After Benign Inflation As Traders Rush To Buy Dips | Trump's FTC Moves Ahead With Broad Microsoft Antitrust Probe"
37,MSFT,2025-03-13,"Sam Altman Warns AI Will Be Deflationary, But Says OpenAI's Biggest Constraint Isn't Data Or Demand, It's GPUs | DA Davidson Upgrades Microsoft to Buy, Raises Price Target to $450 | Sam Altman's OpenAI Urges Trump Administration For Rapid AI Advancement And Reduced Regulation | Smart ETF Picks For A Cooling Inflation Era | NVIDIA And Microsoft Partner To Bring Neutral Shading Support To Microsoft DirectX, Giving Developers Access To AI Tensor Cores In NVIDIA GeForce RTX GPUs | Microsoft To Rally More Than 17%? Here Are 10 Top Analyst Forecasts For Thursday | NVIDIA & Microsoft Unlock RTX Neural Shaders For Next-Gen Graphics: Details | Evaluating Microsoft Against Peers In Software Industry | Live On CNBC, Kevin Simpson Announces Bought More Microsoft | 10 Information Technology Stocks With Whale Alerts In Today's Session | Nvidia Stock Reached All-Time Highs After Jensen Huang's CES Keynote — Will Next Week's GTC Spark Another Surge?"
38,MSFT,2025-03-14,"SoftBank To Build $676 Million AI Data Center In Japan, Linked To OpenAI Partnership | Exploring The Competitive Space: Microsoft Versus Industry Peers In Software | Unpacking the Latest Options Trading Trends in Microsoft | Deal Dispatch: Trump M&A Boom Is A Bust, Purple Mattress Considers Sale, Celtics Auction Heats Up"
39,MSFT,2025-03-15,Apple Scrambles To Fix Siri's AI Failures After Public Misstep—Top Executive Admits Marketing It Too Soon Made Things Worse | Apple Scrambles To Fix Siri's AI Failures After Public Misstep—Top Executive Admits Marketing It Too Soon Made Things Worse
40,MSFT,2025-03-16,"Consumer Tech News (Mar 10-Mar 14): Manus AI Creating Hype, Tesla Eyes Affordable Version Model Y In China & More | Consumer Tech News (Mar 10-Mar 14): Manus AI Creating Hype, Tesla Eyes Affordable Version Model Y In China & More"
